id,created_at,text,favorites,retweets,lang,in_reply_to_user,in_reply_to_user_id,in_reply_to_status_id,country,country_code,place_name,place_type,coordinates
669930360130572288,2015-11-26 17:26:59,I posted a new photo to Facebook https://t.co/EZDsC3dhEC,0,0,en,,,,,,,,
665261635037073408,2015-11-13 20:15:08,"“No act of kindness, no matter how small, is ever wasted.” ― Aesop #WorldKindnessDay https://t.co/syOgiSQfEq",2,4,en,,,,,,,,
664493592849747968,2015-11-11 17:23:12,Happy Veterans Day! Thank you for your service! https://t.co/DHawhzu5cU,0,0,en,,,,,,,,
663823184521662464,2015-11-09 20:59:15,What Does Yahoo's New Google Partnership Mean For SEO's Future? https://t.co/LRELdWZV6z,0,0,en,,,,,,,,
661990764247838720,2015-11-04 19:37:52,The holiday season is officially here! https://t.co/EDyXERquAd,1,0,en,,,,,,,,
660139390845345792,2015-10-30 17:01:10,Check out these fun Halloween apps! https://t.co/CQNsMyZhE4,0,0,en,,,,,,,,
657616732429815812,2015-10-23 17:57:01,3.2 billions people are online. Are you reaching them? https://t.co/Hkpf00EOwn,0,0,en,,,,,,,,
656860023474130944,2015-10-21 15:50:08,Here's how some big brands are getting in on the Back to the Future frenzy. https://t.co/0Qf06Fk14b,0,0,en,,,,,,,,
656855249295007744,2015-10-21 15:31:09,Happy 'Back to the Future' day!  Hope to get our hands on one of these. https://t.co/qZzqFH3aRH,0,0,en,,,,,,,,
654376866611007488,2015-10-14 19:22:57,http://t.co/TBojcyMfCr,0,0,und,,,,,,,,
649303117645742080,2015-09-30 19:21:41,Facebook is bringing profile photos to life with 7-second videos http://t.co/oEoNu6LvpW,1,0,en,,,,,,,,
648914096021073920,2015-09-29 17:35:51,Don't believe that privacy hoax all over your Facebook feed http://t.co/gm6pqgdJBI,0,0,en,,,,,,,,
648913664880214016,2015-09-29 17:34:08,"Hey, Caffeine Addicts: It's National Coffee Day http://t.co/9E7JOqPUG1",0,0,en,,,,,,,,
648604323811717120,2015-09-28 21:04:55,The 2015 State of Social Media Marketing [INFOGRAPHIC] http://t.co/lyTEFjLYKZ,1,0,en,,,,,,,,
647494646789115904,2015-09-25 19:35:28,Check out these graphic apps to help make your social media posts stand out! http://t.co/fsA3Vt5MpJ,0,0,en,,,,,,,,
646043037148143616,2015-09-21 19:27:17,http://t.co/is9oiwuSNm,0,0,und,,,,,,,,
644933128256008192,2015-09-18 17:56:54,Happy National Cheeseburger Day! http://t.co/0dCaJwnXJr,0,0,en,,,,,,,,
639862893425655808,2015-09-04 18:09:36,Have a great Labor Day weekend! http://t.co/MV9kMs0QUV,0,0,en,,,,,,,,
639203845353160704,2015-09-02 22:30:47,Congratulations to our client Britt's Carpet Outlet for winning the Best of SWFL Award 15 years in a row! http://t.co/zTxNoEQkQe,0,0,en,,,,,,,,
638415839243452416,2015-08-31 18:19:31,"Congratulations to our client Copy Concepts, Inc. for winning ""Best Copier Sales &amp; Service"" at the 25th Annual... http://t.co/IpRhefk89r",0,0,en,,,,,,,,
636612698193661952,2015-08-26 18:54:29,Happy National Dog Day from the kitties at Avant! #NationalDogDay http://t.co/3lNTkTfVq8,0,0,en,,,,,,,,
633693371542962176,2015-08-18 17:34:07,How to Create Social Media Images That Connect With Your Audience http://t.co/VULK0QFQJQ,0,0,en,,,,,,,,
631142550150250496,2015-08-11 16:38:04,6 Quick Tips for Using Social Media to Boost SEO http://t.co/D1Fv1GlD50,0,0,en,,,,,,,,
629689902146396160,2015-08-07 16:25:46,FYI - Firefox users http://t.co/RbEKjr4hp7,1,0,en,,,,,,,,
629011082821111809,2015-08-05 19:28:23,Facebook Is Making it Easier for Businesses to Chat Privately With Customers http://t.co/74ZEVFjKzR,0,0,en,,,,,,,,
628235140112760832,2015-08-03 16:05:04,FYI - The FREE Windows 10 upgrade is now available. http://t.co/7sKO6C5WI7,0,0,en,,,,,,,,
627174451294154752,2015-07-31 17:50:16,Post Smart: When Not to Post on Social Media [INFOGRAPHICS] http://t.co/hPDBXibvnY,1,0,en,,,,,,,,
626468658395639808,2015-07-29 19:05:42,Have we really become too busy or too lazy to type a Happy Birthday message to our friends and family? http://t.co/7DqUubKSNY,0,0,en,,,,,,,,
625777331228033024,2015-07-27 21:18:36,Google Panda update http://t.co/Mac9SOLsFx,0,0,en,,,,,,,,
623912430050144256,2015-07-22 17:48:09,A few tips for taking great social media pics! http://t.co/Rq1Ckai2ia,0,0,en,,,,,,,,
621416268546080768,2015-07-15 20:29:18,Facebook Tests A New “Watch Later” Button http://t.co/aYQTsMV9AL,0,0,en,,,,,,,,
620993236530806784,2015-07-14 16:28:19,"Learn the what, how and why of the top 10 social media platforms. http://t.co/5CuIO1dWkK",0,0,en,,,,,,,,
620670292814393344,2015-07-13 19:05:03,Go ahead and have fries with that! Today is National French Fry Day! #NationalFrenchFryDay http://t.co/P2meyRmck7,0,0,en,,,,,,,,
620662020166316032,2015-07-13 18:32:11,What Are the Best Times to Post on Social Media? [INFOGRAPHIC] http://t.co/W7Vwo10e7t,0,0,en,,,,,,,,
619535698480267264,2015-07-10 15:56:35,What is the Ideal Length of Everything Online? [INFOGRAPHIC] http://t.co/QMQDNHCT69,0,0,en,,,,,,,,
617358034776555521,2015-07-04 15:43:20,Have a safe and happy 4th of July! #4thofjuly http://t.co/cAXwhIxQRf,0,0,en,,,,,,,,
613743626502467585,2015-06-24 16:20:58,Finally! We're sure everyone has wished this option existed at some point! http://t.co/T9X9yL8H4y,0,0,en,,,,,,,,
613087301174960128,2015-06-22 20:52:57,We are here to help you and your business be more awesome! ;) http://t.co/kwi70y7gob,0,0,en,,,,,,,,
611969512896905216,2015-06-19 18:51:16,Notice any changes in your placement? An update to Google's core search algorithm took place yesterday. http://t.co/kvAoe7O9Cb,0,0,en,,,,,,,,
610878716021972992,2015-06-16 18:36:50,FYI for anyone using LastPass. http://t.co/SFsrlIN7GG,0,0,en,,,,,,,,
610521108098453505,2015-06-15 18:55:49,Why emoji may soon replace your passwords. http://t.co/TAeme4oeHH,0,0,en,,,,,,,,
609443927658262528,2015-06-12 19:35:29,Tweets will now appear on Google's search results. http://t.co/qPTo29hFN2,0,0,en,,,,,,,,
608699019804708864,2015-06-10 18:15:30,Don't risk losing your Google My Business verification. http://t.co/LUBdjnGWbq,0,0,en,,,,,,,,
607998805896753152,2015-06-08 19:53:06,We believe customer service is one of the most important parts of running a business. http://t.co/cbDZtLc5jA,0,0,en,,,,,,,,
606874995768344576,2015-06-05 17:27:28,Happy National Doughnut Day! Check out this doughnut infographic and find out where you can get a free doughnut... http://t.co/hKqKkWftA6,1,0,en,,,,,,,,
606189183019941888,2015-06-03 20:02:18,Expect possible ranking changes in the next few weeks. http://t.co/OfFo0O46GT,0,0,en,,,,,,,,
605448231162626048,2015-06-01 18:58:01,Windows 7 &amp; 8.1 users can reserve a FREE upgrade to Windows 10. http://t.co/qtG6G1u43U,0,0,en,,,,,,,,
604356445337948163,2015-05-29 18:39:39,How to build your own light box. Great for product photos. http://t.co/JtQe2K1dzC,0,0,en,,,,,,,,
601852717947031552,2015-05-22 20:50:44,"Happy Bitcoin Pizza Day! Exactly 5 years ago, someone bought 2 pizzas for 10k Bitcoins...$2,343,400 today. http://t.co/SEZZmr278j",0,0,en,,,,,,,,
601097856540418048,2015-05-20 18:51:11,"If a potential client can't quickly and easily find what they need on your website, they will move on to the next... http://t.co/FAAezaIRQ3",0,0,en,,,,,,,,
600400965372669954,2015-05-18 20:41:59,Google to add 'Buy' buttons to mobile search results. http://t.co/qA1QPSDP1s,0,0,en,,,,,,,,
599292810253246464,2015-05-15 19:18:34,Happy National Chocolate Chip Cookie Day! http://t.co/D7mB8DYIY2,0,0,en,,,,,,,,
599290928998780928,2015-05-15 19:11:06,http://t.co/7jeyU3VCKS,0,0,und,,,,,,,,
599289700701044737,2015-05-15 19:06:13,http://t.co/tMdvg6SuVR,0,0,und,,,,,,,,
598942779180482560,2015-05-14 20:07:41,Wondering how to use Pinterest for your business? http://t.co/L2WMPVXtAd,0,0,en,,,,,,,,
598158037925425152,2015-05-12 16:09:24,Another marketing fail. Wonder if they teamed up with the Bud Light guys? http://t.co/QhYJrcAece,0,0,en,,,,,,,,
597866212127825922,2015-05-11 20:49:47,Happy Palindrome Week! http://t.co/kjdZ5veQq2,0,0,en,,,,,,,,
596739876294434816,2015-05-08 18:14:08,"May is Lupus Awareness Month. Our client Troy of Spray Decks, Inc. was diagnosed with lupus in February and will... http://t.co/FrKbC6WUYi",1,0,en,,,,,,,,
596034174471004160,2015-05-06 19:29:55,Can't find the time to manage your social media? We can help! http://t.co/TCi0vnukYX,0,0,en,,,,,,,,
595248639615868929,2015-05-04 15:28:29,Happy Star Wars Day! #Maythe4th http://t.co/ilVbCmauFr,1,0,en,,,,,,,,
594191423047639040,2015-05-01 17:27:29,Noticing any changes in your mobile search placement since Google's mobile friendly update? Contact us to find... http://t.co/4eZ4K9Cct7,0,0,en,,,,,,,,
593848706530680833,2015-04-30 18:45:39,Still haven't set up a Facebook page for your business? Check out this article to make the process easier. http://t.co/73d5g8xk2P,0,0,en,,,,,,,,
593479835093176321,2015-04-29 18:19:53,Ad campaign fail! http://t.co/ewk8LbF2bZ,0,0,en,,,,,,,,
592756474541174787,2015-04-27 18:25:31,Wow! I remember just peeling the stickers off... http://t.co/f0YIBTnGE1,0,0,en,,,,,,,,
591281425720152065,2015-04-23 16:44:12,Wow! I guess we should start brainstorming some video ideas... http://t.co/TAUE0DnVQX,0,0,en,,,,,,,,
590909599458406400,2015-04-22 16:06:41,Happy Earth Day! http://t.co/9CZrKFNlty,0,0,en,,,,,,,,
590204892385583104,2015-04-20 17:26:26,Here is more information on Google's mobile friendly update that rolls out tomorrow. http://t.co/JMhoxuIcBL,0,0,en,,,,,,,,
589124361438760961,2015-04-17 17:52:47,Happy Friday! http://t.co/7D95up6lk9,0,0,en,,,,,,,,
588353623538737153,2015-04-15 14:50:09,It's Tax Day! Here are some freebies and deals to brighten your day. http://t.co/vdz86SRuSC,0,0,en,,,,,,,,
586571237716992000,2015-04-10 16:47:35,Forget the dress...Is this cat going up or down the stairs? http://t.co/2mGMgzT1lY,0,0,en,,,,,,,,
585904411009945602,2015-04-08 20:37:51,Is your website mobile friendly? What you need to do to prepare for Google's April 21st algorithm update. http://t.co/E5ojtjKV5y,0,0,en,,,,,,,,
581487313789853699,2015-03-27 16:05:53,"""55% of website visitors spend less than 15 seconds actively reading content on a page"" - Here are the five steps... http://t.co/SFdCJDdPHR",0,0,en,,,,,,,,
580053002360369152,2015-03-23 17:06:27,"""Your website is your greatest asset. More people view your webpages than anything else."" -- Amanda Sibley http://t.co/3Ub9UHTrJV",0,0,en,,,,,,,,
578948395018141696,2015-03-20 15:57:08,I posted a new photo to Facebook http://t.co/KqG5STROag,0,0,en,,,,,,,,
568489143581458432,2015-02-19 19:15:48,"Faster, safer web browsing is almost here! The first major change to HTTP in 16 years. http://t.co/lclO4VWOSI",0,0,en,,,,,,,,
565586207095414784,2015-02-11 19:00:34,"""You get what you pay for when it comes to SEO. Choosing the cheap option in the beginning can actually end up... http://t.co/H9nIspcM0q",0,0,en,,,,,,,,
562353096341606403,2015-02-02 20:53:20,Here are the Super Bowl 2015 commercials in case you missed any! #sb49 http://t.co/NsshprqXuy,0,0,en,,,,,,,,
555776201705668608,2015-01-15 17:19:06,Think Facebook is a media powerhouse? Just wait til its video player takes over http://t.co/PqVceLwIk5,0,0,en,,,,,,,,
553674366706536449,2015-01-09 22:07:10,"""An overwhelming 94 percent of people have cited a website’s design as being the reason they mistrusted or... http://t.co/AIabxZdv0Q",0,0,en,,,,,,,,
553240233945628674,2015-01-08 17:22:05,Here are 3 ways to keep your Facebook business page secure http://t.co/FdVEPKD3hc,0,0,en,,,,,,,,
552925922501099520,2015-01-07 20:33:07,Great advice! http://t.co/ctyfg7yLuk,0,0,en,,,,,,,,
550757954350501890,2015-01-01 20:58:23,Happy New Year! http://t.co/vpGeKmGSCh,0,0,en,,,,,,,,
549684999830908928,2014-12-29 21:54:51,We agree! You definitely get what you pay for... http://t.co/bRform84Cs,0,0,en,,,,,,,,
547481054756745217,2014-12-23 19:57:09,Thinking of a new website for the new year? http://t.co/0m6CubWp1c,0,0,en,,,,,,,,
538024530900692992,2014-11-27 17:40:18,Happy Thanksgiving from all of us at Avant! http://t.co/yryfLV2B1T,0,0,en,,,,,,,,
534470703320682497,2014-11-17 22:18:40,"Facebook is cracking down on promotional posts. This includes pushing users to buy your product, enter your... http://t.co/IRR6xtUfvf",0,0,en,,,,,,,,
532255067181965313,2014-11-11 19:34:31,Happy Veterans Day! http://t.co/YjrVlEyTqy,0,0,en,,,,,,,,
530780282434359297,2014-11-07 17:54:15,Need help creating a new color scheme for your branding? Check out this great site! http://t.co/Q36XpGkSNv http://t.co/RrDbdTnGQP,0,0,en,,,,,,,,
530086799579033600,2014-11-05 19:58:36,I posted a new photo to Facebook http://t.co/nUurKvYK5J,0,0,en,,,,,,,,
529741673296052226,2014-11-04 21:07:11,Remember to get out and #vote today! #ElectionDay http://t.co/IQOY82htZI,0,0,en,,,,,,,,
528211806079418368,2014-10-31 15:48:02,Happy Halloween! http://t.co/cLmfdYrCRW,0,0,en,,,,,,,,
527542972251119616,2014-10-29 19:30:20,Happy #NationalCatDay! Uber is teaming up with the ASPCA to bring kittens to offices for 15 minute cuddle... http://t.co/2IGmzOnLPN,0,0,en,,,,,,,,
525706689677639680,2014-10-24 17:53:36,Here are some great tools for sprucing up your social media graphics. http://t.co/9Li63ctyp1,0,0,en,,,,,,,,
524649402083074048,2014-10-21 19:52:19,Notice any changes in your ranking this week? Google has rolled out their latest algorithm update Penguin 3.0. http://t.co/5A5Ofo43Oj,0,0,en,,,,,,,,
520633473112219648,2014-10-10 17:54:27,"Check our our latest mobile app project Weekend QB!

Weekend QB gives you the hottest picks and predictions for... http://t.co/x6RyFFmrF8",0,0,en,,,,,,,,
517349895632863232,2014-10-01 16:26:41,New Panda updates are rolling out this week. This one is targeting low quality content. http://t.co/F1PrQXg1oG,0,0,en,,,,,,,,
517038023046082560,2014-09-30 19:47:25,Starting a new business? Here are a few tips for creating your business plan. http://t.co/c3pIXhnzcn,0,0,en,,,,,,,,
510503137598504960,2014-09-12 19:00:07,Facebook is testing disappearing posts that can be set to expire in 1 hour to 7 days. http://t.co/TjzX8lrKZN,0,0,en,,,,,,,,
509422132330500096,2014-09-09 19:24:35,Have a great idea for an app? We can help you bring it to life. http://t.co/41g9DYBskE,0,0,en,,,,,,,,
507222885841514496,2014-09-03 17:45:34,http://t.co/5kaaq24T9w,0,0,und,,,,,,,,
497840128975310848,2014-08-08 20:21:50,Happy World Cat Day from the kitties at Avant! #worldcatday http://t.co/nSE828419y,0,0,en,,,,,,,,
496720552732930050,2014-08-05 18:13:03,Another reason why a Facebook business page is important. We can even help you with set up and management. http://t.co/cOKykaVGOg,0,0,en,,,,,,,,
495251215195054080,2014-08-01 16:54:25,"""Pigeon"" is the latest Google algorithm update affecting local searches. http://t.co/gTIfsZhBBd",0,0,en,,,,,,,,
493841093570863106,2014-07-28 19:31:06,"15 apps to help you create habits, reach goals and more. http://t.co/Nv1N5YSPWb",0,0,en,,,,,,,,
492719262675791872,2014-07-25 17:13:21,I posted a new photo to Facebook http://t.co/vmsAJzNouo,0,0,en,,,,,,,,
492011678016741377,2014-07-23 18:21:39,FYI - 10 new changes to your Facebook page layout http://t.co/A9pUSfQOXR,0,0,en,,,,,,,,
491307454224166912,2014-07-21 19:43:19,Is your website outdated? Read on for 5 reasons to update your website design -... http://t.co/3JAhTGbtw7,0,0,en,,,,,,,,
489506139806388226,2014-07-16 20:25:32,Here are some tips to amp up your Facebook business page. http://t.co/yt4txzgaXT,0,0,en,,,,,,,,
488722880793157633,2014-07-14 16:33:09,Watch today's kids react to the Game Boy. We love these videos! http://t.co/KXAKfzkJxN,0,1,en,,,,,,,,
486976822757052416,2014-07-09 20:54:56,360 free web and app icons! http://t.co/ON9jxmMXBA,0,0,en,,,,,,,,
486242024958734336,2014-07-07 20:15:07,"Yes, Monday after a 3 day work week can be tough. Enjoy some smooth jazz and rain while you work... http://t.co/JgxyvGpkmu",0,0,en,,,,,,,,
485092742532706304,2014-07-04 16:08:17,Wishing everyone a safe and happy 4th! Have a great weekend! http://t.co/uXtjqDgIPA,0,0,en,,,,,,,,
484429236019945472,2014-07-02 20:11:44,Are you using Facebook to promote your business? Here are 4 tips to help you out. Need help? Give us a call! http://t.co/KHC1imCnw0,0,0,en,,,,,,,,
483638767916695552,2014-06-30 15:50:42,Happy Social Media Day! #SMDAY http://t.co/oP7ULCETqP,0,0,en,,,,,,,,
482551057189728257,2014-06-27 15:48:32,Need new business cards? We're here to help. Here are some creative ideas. http://t.co/4WFNVPW8v4,0,0,en,,,,,,,,
481890975212896256,2014-06-25 20:05:36,Trademarks 101 - We are often asked whether a business should trademark or not. Here are some answers. http://t.co/N53W5GJG9P,0,0,en,,,,,,,,
481145738400133120,2014-06-23 18:44:17,I think we need these for office! http://t.co/vbhXKKQKrQ,0,0,en,,,,,,,,
480037544433029121,2014-06-20 17:20:43,Did you know twice as many baby boomers vs. millennials are likely to engage with brands' content? More social... http://t.co/0WCTSM00iR,0,0,en,,,,,,,,
479309467453239296,2014-06-18 17:07:36,Amazon to release it's first smartphone today. http://t.co/Sh6clw8e9g,0,0,en,,,,,,,,
478619422790541312,2014-06-16 19:25:37,Are you using your marketing budget wisely? http://t.co/PYYpfKu4OE,0,0,en,,,,,,,,
477510875599749120,2014-06-13 18:00:39,This live infographic shows internet usage in real time. http://t.co/m9NL1sSzZU,0,0,en,,,,,,,,
477162234167459840,2014-06-12 18:55:16,This social media image size cheat sheet should save you some time! http://t.co/HEFW9NYp8v,0,0,en,,,,,,,,
476795035670052865,2014-06-11 18:36:09,"Google is purging suspended YouTube accounts, which means your subscribers are about to go down. http://t.co/RSuqsdeTyt",0,0,en,,,,,,,,
476090222493859840,2014-06-09 19:55:29,The new Facebook page design will be visible to all fans on June 13. Read on to see what's new and what changes... http://t.co/RQ8MtLq1Ip,0,0,en,,,,,,,,
474954044029800449,2014-06-06 16:40:42,Happy National Doughnut Day! Check out this link to find out where you can get FREE doughnuts today. http://t.co/5fpqXXAe57,0,0,en,,,,,,,,
474580481254912000,2014-06-05 15:56:18,LinkedIn unveils new profile design. http://t.co/8PfMwUPsDj,0,0,en,,,,,,,,
474237290680975360,2014-06-04 17:12:35,Instagram adds 10 new photo editing features! http://t.co/gO1S9kKqMI,0,0,en,,,,,,,,
472437022989492224,2014-05-30 17:58:58,Run your own business or thinking of starting one? Here are 7 tips for entrepreneurs. http://t.co/Zw4SIXvnzN,0,0,en,,,,,,,,
472076265445666817,2014-05-29 18:05:27,Design student redesigns all 30 MLB stadium logos for fun. http://t.co/ie7c1G1kks,0,0,en,,,,,,,,
471710790408761344,2014-05-28 17:53:11,Watch these kids have a breakdown trying to use a 1977 Apple computer! http://t.co/eJY7e4t1hG,0,0,en,,,,,,,,
469954523008872448,2014-05-23 21:34:24,Happy Friday! http://t.co/xtjwmg7bbe,0,0,en,,,,,,,,
469512308461682689,2014-05-22 16:17:12,Facebook Switches Default Setting to Private to Prevent Oversharing http://t.co/mgMR3OhBtU,0,0,en,,,,,,,,
469132547210117120,2014-05-21 15:08:09,"eBay Advises Users To Change Passwords Following Cyberattack, “Large Number” Of Users Affected http://t.co/4gyzcpUPyi",0,0,en,,,,,,,,
468789597770907648,2014-05-20 16:25:24,3-reasons-your-business-isn’t-leaving-facebook | Social Media Today http://t.co/i7n1YI6WFZ,0,0,en,,,,,,,,
468457621201379328,2014-05-19 18:26:15,Looking to update your logo? Check out these 2014 logo design trends. http://t.co/wjxGLzRCzD,0,0,en,,,,,,,,
467382375769718784,2014-05-16 19:13:36,"Here's a great guide for sizing your Facebook photos, banner, profile pic and more! http://t.co/9pmK45c8Gq",0,0,en,,,,,,,,
467023353665290240,2014-05-15 19:26:59,Adding a photo to your tweet can boot retweets by 35%! http://t.co/Uq91Www0VJ,0,0,en,,,,,,,,
466644133839638528,2014-05-14 18:20:06,Photos and graphics generate the most interest on Facebook with an 87% interaction rate. http://t.co/wtV9DpvyWN,0,0,en,,,,,,,,
464128087202877440,2014-05-07 19:42:13,Happy Teacher Appreciation Day! http://t.co/C1ZgyXKuUk,0,0,en,,,,,,,,
462297761916780544,2014-05-02 18:29:10,"Serious security flaw in OAuth, OpenID discovered - CNET http://t.co/w0DlFJRWak",0,0,en,,,,,,,,
460856104813998081,2014-04-28 19:00:32,Internet Explorer Security Bug: How to Protect Yourself http://t.co/soqrYkD2kM,0,0,en,,,,,,,,
453982539330228224,2014-04-09 19:47:26,How to Protect Yourself From the Heartbleed Bug http://t.co/whajZRvQHe,0,0,en,,,,,,,,
451419816297914368,2014-04-02 18:04:05,What's the Deal With Facebook's Privacy Dinosaur? http://t.co/2GYy75CVpI,0,0,en,,,,,,,,
449658860739907584,2014-03-28 21:26:41,"Is Twitter becoming more like Facebook? They just added the ability to add photos, tag people and share rather... http://t.co/1InCMM7rLW",0,0,en,,,,,,,,
447132380117995520,2014-03-21 22:07:21,Spring is Here! Time to clean up your website. http://t.co/BCLyhdELdN,0,0,en,,,,,,,,
446685893747671041,2014-03-20 16:33:10,Is Twitter getting rid of @ &amp; #? http://t.co/GDp5K3h4Ef,0,0,en,,,,,,,,
446032205366575104,2014-03-18 21:15:39,Google dedicates the most space to local business results. Are you there? http://t.co/aRt5CGpNXX,0,0,en,,,,,,,,
444541803639762944,2014-03-14 18:33:19,http://t.co/WJO5j28KnV,0,0,und,,,,,,,,
444194783943077888,2014-03-13 19:34:23,We are happy to announce the launch of Wigert's Bonsai Nursery's new website. Florida's largest full service... http://t.co/8XlRSSvkyW,0,0,en,,,,,,,,
443857439406821376,2014-03-12 21:13:54,Happy 25th Birthday to the Web! http://t.co/qTPMBFleGv,0,0,en,,,,,,,,
443487130627497984,2014-03-11 20:42:26,You're Not Crazy: Google Search Results Look a Little Different http://t.co/2pSB3wsh0h,0,0,en,,,,,,,,
441980495069315072,2014-03-07 16:55:36,Don't forget our FREE gift card promotion is still going on. Thank you for sharing! http://t.co/Z1XZKaGMFC,0,0,en,,,,,,,,
441274656280940544,2014-03-05 18:10:51,More women use the top social media http://t.co/9lZHd0vd8h,0,0,en,,,,,,,,
438824300691197952,2014-02-26 23:54:00,Good advice! http://t.co/UC17m54QSe,1,0,en,,,,,,,,
438742030546522112,2014-02-26 18:27:06,Real life social media! http://t.co/7Y2BBX4AE9,0,0,en,,,,,,,,
436916681990873088,2014-02-21 17:33:49,The Hard Truth About How The Facebook News Feed Works Now http://t.co/0Xn0382KtH,0,0,en,,,,,,,,
436544366979465216,2014-02-20 16:54:22,http://t.co/Rj0YXJergT,0,0,und,,,,,,,,
436288299791962112,2014-02-19 23:56:51,Facebook to Buy WhatsApp for $16 Billion http://t.co/p2HRK6qYXt,0,0,en,,,,,,,,
436246123875803137,2014-02-19 21:09:15,Enjoy dinner on us! Receive a FREE $50 gift card when you refer a friend. http://t.co/y2vmzYR9pG,0,0,en,,,,,,,,
434380706387468288,2014-02-14 17:36:45,Happy Valentine's Day! http://t.co/OORKqR2Lfv,0,0,en,,,,,,,,
433987768880857088,2014-02-13 15:35:21,Twitter Testing Major Redesign That Looks a Lot Like Facebook http://t.co/8JthKtDQOD,0,0,en,,,,,,,,
433627947556024322,2014-02-12 15:45:33,I posted a new photo to Facebook http://t.co/yMPQJWWR7d,0,0,en,,,,,,,,
433323202501017602,2014-02-11 19:34:36,Yes we agree and are offering 20% off all new social media campaigns this week! http://t.co/M51Iq0BhC4,0,0,en,,,,,,,,
431130559440367616,2014-02-05 18:21:50,BBB warns of funeral announcement email scam http://t.co/m2X08IQJEI,0,0,en,,,,,,,,
426737478590926848,2014-01-24 15:25:17,Happy 30th Mac! http://t.co/qFtmS55Thw,0,0,en,,,,,,,,
426059987324911616,2014-01-22 18:33:11,Don't forget our New Year's Special is still on! During the month of January we are offering 20% off all new... http://t.co/CGBmoaYAl8,0,0,en,,,,,,,,
421768597174628352,2014-01-10 22:20:44,Happy Friday! Have a great weekend! http://t.co/6rfkTuy9fI,0,0,en,,,,,,,,
420301145139990528,2014-01-06 21:09:36,Avant Innovations is happy to announce we will be donating a much needed website to the Hot Flashz dance team!... http://t.co/Qpxyq2NT8o,0,0,en,,,,,,,,
419167289842229248,2014-01-03 18:04:04,"Scam Alert - Google Telemarketing Calls

Be aware of calls claiming to be Google. These telemarketers are not... http://t.co/nEk2gCLHB5",0,0,en,,,,,,,,
417794559179907072,2013-12-30 23:09:19,Wow your clients with a new website in 2014! Contact us for a free consultation. http://t.co/JJoWgG1bjz,0,0,en,,,,,,,,
415936570189819905,2013-12-25 20:06:20,Happy Holidays from all of us at Avant Innovations! http://t.co/8t5klZ8Ya5,0,0,en,,,,,,,,
415157233794560000,2013-12-23 16:29:32,"Local organization Operation Open Arms needs your help to bring home a US Army soldier, Navy SEAL, and Special... http://t.co/ejGXjIPY6l",0,0,en,,,,,,,,
414145237619970050,2013-12-20 21:28:13,Congratulations to our client All About Sliders patio door repair for being awarded the 2013 Angie's List Super... http://t.co/BLaIkhKN25,0,0,en,,,,,,,,
413731738804682752,2013-12-19 18:05:07,The power of social media! :) http://t.co/5uFvRuYPOy,0,0,en,,,,,,,,
413337814600667136,2013-12-18 15:59:49,8 Tips For Planning Your Small Business' 2014 Marketing Strategy http://t.co/uCOsFopx1e,0,0,en,,,,,,,,
411731150566993920,2013-12-14 05:35:30,http://t.co/ahwdOJddk5,0,0,und,,,,,,,,
410869944474406912,2013-12-11 20:33:23,I posted a new photo to Facebook http://t.co/IILYNrQO2l,0,0,en,,,,,,,,
410167893788483585,2013-12-09 22:03:41,We are excited to be working with  Wigert's Bonsai Nursery to redesign their current website! http://t.co/Qp4QwToEDA,0,0,en,,,,,,,,
408307649613004800,2013-12-04 18:51:44,Too funny! Doesn't Santa use email these days? http://t.co/v6s29yoxkz,0,0,en,,,,,,,,
406117380520026112,2013-11-28 17:48:23,Have a wonderful Thanksgiving! http://t.co/APCFUAqLXr,0,0,en,,,,,,,,
397774256957685761,2013-11-05 17:15:47,"""The website you created for me is the BEST advertising I've ever done!"" - Troy Sassaman, Spray Decks, Inc.... http://t.co/lQMHzOFg53",0,0,en,,,,,,,,
393053143849639936,2013-10-23 16:35:46,Congratulations to our client Britt's Carpet Outlet for winning The Best of SWFL award 13 years in a row! http://t.co/R3JJZqKMph,0,0,en,,,,,,,,
389902110587756544,2013-10-14 23:54:41,I posted a new photo to Facebook http://t.co/A9BppGJFW8,2,0,en,,,,,,,,
