id,created_at,text,favorites,retweets,lang,in_reply_to_user,in_reply_to_user_id,in_reply_to_status_id,country,country_code,place_name,place_type,coordinates
670274971931922434,2015-11-27 16:16:21,Just in time for #BlackFriday — how to use a crowd to create positive customer experiences: https://t.co/hr2TlEY0hj,0,0,en,,,,,,,,
670003028703977476,2015-11-26 22:15:44,Loyalty marketers and the struggle to keep up with rapidly changing tech: https://t.co/Puy1mfXvvi @Loyalty360,1,0,en,,,,,,,,
669972963857403905,2015-11-26 20:16:16,Saying you'll put customers first and systematically doing so are two VERY different things. https://t.co/rO7QGWhxZl,1,0,en,,,,,,,,
669912565175230464,2015-11-26 16:16:16,"Happy Thanksgiving to the Medallia family of brands, Medallians, and all of their loved ones! We are #thankful for our customers!",0,0,en,,,,,,,,
669640682831761409,2015-11-25 22:15:54,Banks: Are you ready for Millennials? https://t.co/RDGiWLn05K,0,0,en,,,,,,,,
669610599635136512,2015-11-25 20:16:22,Case study: What happens when you tie executive compensation to CX metrics? https://t.co/voamKEaXjD,0,0,en,,,,,,,,
669580294048096256,2015-11-25 18:15:56,Brands Need Highly Integrated Tech to Simplify Customer Engagement - https://t.co/qasDhAQ1kU,1,1,en,,,,,,,,
669278172043730944,2015-11-24 22:15:25,Did you know that 6 current Medallians (including our President and co-founder) were in the @PeaceCorps? https://t.co/rPe2JB1zyf,0,0,en,,,,,,,,
669248214026031104,2015-11-24 20:16:22,Just in time for #BlackFriday — how to use a crowd to create positive customer experiences: https://t.co/rFUYUrwVr8,0,0,en,,,,,,,,
669225263742480384,2015-11-24 18:45:11,Secret Life of Medallians: Coming Home from the @PeaceCorps - https://t.co/OSkaQ8F49h,0,0,en,,,,,,,,
669221496179527681,2015-11-24 18:30:12,"RT @jtang0: ￼￼After a positive experience, #Millennials are two and a half times as likely as #Boomers to post about it online. https://t.c…",0,2,en,,,,,,,,
669221331884449792,2015-11-24 18:29:33,"RT @trechtin: What makes an effective CEM platform? Tips from John Abraham, GM of Medallia.  #Medallia #CX #CEM #VOC #BigData https://t.co/…",0,2,en,,,,,,,,
669202937705570304,2015-11-24 17:16:28,The key to walking the talk of customer-centricity - https://t.co/fXX7ZzdUWY,1,0,en,,,,,,,,
668893923868323841,2015-11-23 20:48:33,RT @chrisbalck: EXPERIENCE 2016 - Registration for the largest gatherings of CX leaders is open. Become a member of Generation CX! https://…,0,1,en,,,,,,,,
668893450960576513,2015-11-23 20:46:40,RT @SpirosMargaris: Insightful graphics. What #Millennials Want in a Banking Experience https://t.co/Dt124Xe8bj @Medallia #fintech https://…,0,5,en,,,,,,,,
668885782007054338,2015-11-23 20:16:12,"When you make important business decisions, how often are you thinking about your customers? https://t.co/mFihNw2RGD",1,1,en,,,,,,,,
668855570527617024,2015-11-23 18:16:09,Turning the Crowd into a Party: Thoughtfully Dealing with Peak Demand - https://t.co/hZhaedszCR,0,0,en,,,,,,,,
668523287530614784,2015-11-22 20:15:46,"What it Really Takes to ""Put the Customer First"" - https://t.co/L3hr2tMwDh",0,0,en,,,,,,,,
668160936461627397,2015-11-21 20:15:55,"How do you say, ""Unsatisfactory customer experience,"" in Japanese? https://t.co/ahmbhiEIHx",0,0,en,,,,,,,,
667830357169836032,2015-11-20 22:22:19,"RT @MikeBarrowJr: What It Really Takes to ""Put the Customer First"" - Medallia https://t.co/ApE8FaYpKt",0,1,en,,,,,,,,
667828687341907969,2015-11-20 22:15:41,"When you make important business decisions, how often are you thinking about your customers? https://t.co/cyzvpgIJve",0,0,en,,,,,,,,
667798589863776256,2015-11-20 20:16:05,How will disruption in the retail space manifest itself during Black Friday (and Cyber Monday) this year? https://t.co/xlhqGrfrjB,1,0,en,,,,,,,,
667753359559008256,2015-11-20 17:16:21,Peak demand doesn't have to ruin customer experiences: https://t.co/g9cCcRWUbr,0,0,en,,,,,,,,
667481293500899328,2015-11-19 23:15:16,How to wire the customer into business decisions: https://t.co/MJPqAQveqQ,0,0,en,,,,,,,,
667458626739691520,2015-11-19 21:45:12,"What it Really Takes to ""Put the Customer First"" - https://t.co/BkY4IyKU7F",1,2,en,,,,,,,,
667436202065338369,2015-11-19 20:16:05,How Sage is upping their customer experience game - https://t.co/UqP3XkqQm8,1,1,en,,,,,,,,
667409101849260032,2015-11-19 18:28:24,RT @HireOnLinkedIn: 5 lessons @Medallia learned about providing a great candidate experience: https://t.co/9AE3HSY68r https://t.co/pWpHnsMr…,0,5,en,,,,,,,,
667409042264989696,2015-11-19 18:28:10,RT @appirio: Medallia and the Evolution of Employee Feedback https://t.co/yWUYBtx3F3 https://t.co/mpEXVKFeu5,0,3,en,,,,,,,,
667408599807893505,2015-11-19 18:26:24,RT @vegafactr: ICYMI: How Your #Workplace Culture Impacts #CustomerExperience @Medallia https://t.co/4ZgOje1zX2,0,1,en,,,,,,,,
667073805802733568,2015-11-18 20:16:03,What happens when you tie executive compensation to CX metrics? https://t.co/wr6EhZtmtu,1,0,en,,,,,,,,
667043556494831618,2015-11-18 18:15:51,"How the ""Co-creation model"" can help you tackle peak demand — https://t.co/CkouI2LZ0j",0,0,en,,,,,,,,
666756528200949760,2015-11-17 23:15:18,Just in time for #BlackFriday — how to use a crowd to create positive customer experiences: https://t.co/EOpAFQHUpr,0,0,en,,,,,,,,
666741568540422144,2015-11-17 22:15:52,"""The Cobra Effect"" might sound cool, but it's not good for your workplace culture (and customer experience) - https://t.co/JAog1rnyHD",1,0,en,,,,,,,,
666712442408431618,2015-11-17 20:20:07,Turning the Crowd into a Party: Thoughtfully Dealing with Peak Demand - https://t.co/e1wKOFEPRB,0,0,en,,,,,,,,
666707585245032448,2015-11-17 20:00:49,RT @vegafactr: It was great sharing our knowledge on high-performing #WorkCultures with @Medallia! Check out the blog/webinar: https://t.co…,0,1,en,,,,,,,,
666707401660231680,2015-11-17 20:00:06,RT @HootEmilyK: Great article on #candidateexperience https://t.co/wxb6o3xZVY @sfu_hrsa this is what @talinearslanyan and myself were talki…,0,4,en,,,,,,,,
666662873872101376,2015-11-17 17:03:09,LIVE NOW: Exploring the Retail Bank of the Future w/ Bain &amp; Company - https://t.co/PNQOYbB6ZM,0,0,en,,,,,,,,
666379010293809152,2015-11-16 22:15:11,"Work in banking? Don't miss tomorrow's webinar on the retail bank of the future: 
https://t.co/IkFcQzxdNv",0,0,en,,,,,,,,
666321523247071232,2015-11-16 18:26:45,RT @AdriJ97: A great event for all CX professionals! https://t.co/I2tCDhXLUu,0,2,en,,,,,,,,
666320579860017152,2015-11-16 18:23:00,@HarmsWayChad :D !! Glad you liked it!,0,0,en,HarmsWayChad,9287142,666131435921608704,,,,,
666318899143643136,2015-11-16 18:16:19,BLOG + WEBINAR: How your workplace culture impacts customer experience - https://t.co/B9iHZ4zazm,0,1,en,,,,,,,,
665986611625246721,2015-11-15 20:15:56,Building a High-Performing Workplace Culture - https://t.co/VFmgQY34fI,0,0,en,,,,,,,,
665624205615067136,2015-11-14 20:15:51,"The downside of ""going digital"" in financial services? Most upgrades go from innovations to table stakes - https://t.co/AD6F5wXUdS",0,0,en,,,,,,,,
665291879915921408,2015-11-13 22:15:19,Join the customer experience movement at Experience 2016 - https://t.co/nX7b2r2F7w,0,0,en,,,,,,,,
665254111286312961,2015-11-13 19:45:14,Registration for one of the largest gatherings of CX leaders is now open. Become a member of Generation CX: https://t.co/hdjAP3RvsH,1,1,en,,,,,,,,
665238139699658752,2015-11-13 18:41:46,RT @appirio: Make the most of every employee journey through regular surveys with @Medallia https://t.co/f8l9puHgrv https://t.co/FqCwr4IRjO,0,2,en,,,,,,,,
665238010036899840,2015-11-13 18:41:15,RT @HireOnLinkedIn: 5 lessons @Medallia learned about providing a great candidate experience: https://t.co/krCy4r9qOw https://t.co/tja0lKte…,0,6,en,,,,,,,,
665231707998691328,2015-11-13 18:16:13,Check out our new research on Millinneals' banking habits: https://t.co/MJJl67qpZS,1,0,en,,,,,,,,
665231682363121664,2015-11-13 18:16:07,What's the retail bank of the future look like? https://t.co/5cSE0gDW7b,0,0,en,,,,,,,,
664929613106307073,2015-11-12 22:15:48,"The downside of ""going digital"" in financial services? Most upgrades go from innovations to table stakes - https://t.co/LIskaySnwY",3,0,en,,,,,,,,
664899486825730048,2015-11-12 20:16:05,"""The Cobra Effect"" might sound cool, but it's not good for your workplace culture (and customer experience) - https://t.co/gd5cIn42Pb",2,0,en,,,,,,,,
664882230351802369,2015-11-12 19:07:31,RT @DeloitteDIGI_US: Investing in the future of customer experience management with @Medallia –  https://t.co/Wq526Lr90v,0,2,en,,,,,,,,
664869269444952064,2015-11-12 18:16:01,Don't miss next week's webinar on retail banking! https://t.co/S7wZXKkUqy,1,0,en,,,,,,,,
664862474408210433,2015-11-12 17:49:01,"RT @trechtin: Exploring the Retail Bank of the Future With Bain &amp; Company’s Mark Schofield Tuesday, November 17th, 9am PT / 12pm E…https://…",0,1,en,,,,,,,,
664582205570719744,2015-11-11 23:15:19,Hate your bank? Send them this: https://t.co/cF62rGMMoE,0,1,en,,,,,,,,
664567267766755328,2015-11-11 22:15:58,Find out how Sage's CEO incentivized customer-centricity - https://t.co/E3IRFkyI85,1,0,en,,,,,,,,
664530572719611904,2015-11-11 19:50:09,Exploring the retail bank of the future with Bain &amp; Company - https://t.co/cfOswlnICB,0,0,en,,,,,,,,
664525905621045249,2015-11-11 19:31:36,RT @HireOnLinkedIn: 5 lessons @Medallia learned about providing a great candidate experience: https://t.co/uOaWLzwVsN https://t.co/6P6u4CzW…,0,3,en,,,,,,,,
664506911136550913,2015-11-11 18:16:08,"Is your workplace culture suffering from the ""Cobra Effect""? https://t.co/UKlacVdia7",0,0,en,,,,,,,,
664204765757349888,2015-11-10 22:15:31,BLOG + WEBINAR: How your workplace culture impacts customer experience - https://t.co/7A6Rd434q5 @neelvf @mcgregorle,0,0,en,,,,,,,,
664174708292743170,2015-11-10 20:16:04,How to keep up in the Age of the Customer: https://t.co/5Jh40Yvhiw,2,0,en,,,,,,,,
664144282585055232,2015-11-10 18:15:10,Building a High-Performing Workplace Culture - https://t.co/txnTOOXXgf,0,0,en,,,,,,,,
664130924427235328,2015-11-10 17:22:05,RT @appirio: Get More Out of Your Customer Feedback with @Medallia https://t.co/RnNqK88weN #CX #CEX https://t.co/AFYjFO9gpt,0,1,en,,,,,,,,
664114242870779904,2015-11-10 16:15:48,Check out our new research on Millinneals' banking habits: https://t.co/dlJCztxrwS,2,0,en,,,,,,,,
663842388343988225,2015-11-09 22:15:33,Why you should focus on the candidate journey much like the customer journey: https://t.co/p7QLFKRwXP,0,0,en,,,,,,,,
663812157008699392,2015-11-09 20:15:25,How to use customer feedback as rocket fuel for innovation: https://t.co/vW1QizADEH,0,0,en,,,,,,,,
663781919151292418,2015-11-09 18:15:16,The 5 Keys to Seeing How You're Doing in the Eyes of the Customer: https://t.co/eHUek3FfXi,1,1,en,,,,,,,,
663768036604821504,2015-11-09 17:20:06,@trdollar of course :) ! Thank you for joining us!,1,0,en,trdollar,73540921,662461047601655808,,,,,
663767866475470849,2015-11-09 17:19:26,"RT @dsgnjbs: On Dribbble: ""Medallia is hiring a Visual Designer in Palo Alto"" https://t.co/gtR8nuEy5r #design #job",0,1,en,,,,,,,,
663767409355055105,2015-11-09 17:17:37,RT @MXMetrics: Medallia Founders Talk Costumer Experience to KTVU https://t.co/BKLu64jVy2 by @youtube https://t.co/kSEQtwNTBf,0,2,en,,,,,,,,
663766059556671488,2015-11-09 17:12:15,@mcgregorle Thank you and @neelvf for being wonderful speakers!,1,0,en,mcgregorle,89332904,662675999058960384,,,,,
663765769453441024,2015-11-09 17:11:06,RT @patatokyo: Cultural bias insight out from @Medallia that in #CX surveys: #Japanese and #Dutch give harshest scores; #Spanish and #Frenc…,0,2,en,,,,,,,,
663765661190103040,2015-11-09 17:10:40,RT @Loyalty360: A Great #CX Isnt Something You Can Script https://t.co/GmQBvJdhda @Medallia,0,1,en,,,,,,,,
663765573608845312,2015-11-09 17:10:19,RT @DellNetworking: Check out how @Medallia achieved high throughput with Dell #networking https://t.co/VSDJpmYnNI,0,3,en,,,,,,,,
663449916644196352,2015-11-08 20:16:01,The Five Keys to Seeing How You’re Performing in the Eyes of the Customer - https://t.co/ARViMPPS46,2,1,en,,,,,,,,
663087490069372928,2015-11-07 20:15:51,"Check out our newest CX case study on the software company, Sage! https://t.co/IvfiHicKM8",0,0,en,,,,,,,,
662725257015332867,2015-11-06 20:16:28,The value of seeing yourself as customers do: https://t.co/maBZAKqKan,1,1,en,,,,,,,,
662679902018252800,2015-11-06 17:16:15,How one B2B software company is motivating its employees to prioritize customers: https://t.co/bIcx1viVH3,0,0,en,,,,,,,,
662362892881289217,2015-11-05 20:16:34,Your customers know you better than you know yourself. https://t.co/yCuOGAiecr,0,0,en,,,,,,,,
662332547641286656,2015-11-05 18:15:59,Find out how @SageNAmerica's CEO incentivized customer-centricity - https://t.co/QyOCknTw1C,0,0,en,,,,,,,,
662318218841866240,2015-11-05 17:19:03,Join us in less than an hour for our webinar on the impact of company culture on customer experience! https://t.co/5owGbzXkmN,0,0,en,,,,,,,,
662027994932858880,2015-11-04 22:05:48,"RT @vegafactr: If you missed out on the last webinar, don't fret! Learn about #WorkCulture &amp; #CustomerExperience on 11/5. @Medallia https:/…",0,1,en,,,,,,,,
662000549504671745,2015-11-04 20:16:45,Customer Experience Innovation in an Agile World - https://t.co/OPzOdNoxp7,1,0,en,,,,,,,,
661985327976984576,2015-11-04 19:16:15,"Tomorrow's live webinar features @mcgregorle &amp; @neelvf, NYT-bestselling authors of ""Primed to Perform"" - https://t.co/KiLUb7cXeI",0,0,en,,,,,,,,
661970324842528768,2015-11-04 18:16:38,"Mirror, Mirror on the Wall: You and Your Customers are Seeing Different Reflections: https://t.co/xIL8TPR9ce",0,0,en,,,,,,,,
661638145532960768,2015-11-03 20:16:41,Join us next week for a free event focused on ending gender biases in the workplace! https://t.co/VNvj1tuxHa,0,0,en,,,,,,,,
661622859450728448,2015-11-03 19:15:56,"WEBINAR: This Thursday, join @mcgregorle &amp; @neelvf, NYT-bestselling authors of ""Primed to Perform"" - https://t.co/SZx4OWXRjk",0,1,en,,,,,,,,
661592705504559104,2015-11-03 17:16:07,The Five Keys to Seeing How You’re Performing in the Eyes of the Customer - https://t.co/WmYAMI7Xz5,4,1,en,,,,,,,,
661562495874818049,2015-11-03 15:16:04,The impact of culture on customer experience: https://t.co/i8NU4IXXny,0,0,en,,,,,,,,
661275659470249984,2015-11-02 20:16:17,Do you know what your customer sees when they engage with your company? https://t.co/lSbFCHgJcN,0,1,en,,,,,,,,
661245449286873088,2015-11-02 18:16:15,VIDEO: Customer Feedback's Role in Innovation - https://t.co/aMxeRATxIB,0,0,en,,,,,,,,
660913183016751105,2015-11-01 20:15:56,The value of seeing yourself as customers do: https://t.co/KR9xZMVBVH,0,0,en,,,,,,,,
660475244885499905,2015-10-31 15:15:44,WEBINAR: How does your employee culture impact the customer experience? https://t.co/X94sJYeUFx,0,0,en,,,,,,,,
660354436213133313,2015-10-31 07:15:41,Silicon Valley: Join us on November 5th to deprogram gender biases -  https://t.co/BWP7ebkYwH,1,1,en,,,,,,,,
660203401075171328,2015-10-30 21:15:31,"Mirror, Mirror on the Wall: You and Your Customers are Seeing Different Reflections: https://t.co/FcooXxw3XJ",0,2,en,,,,,,,,
660173443070107648,2015-10-30 19:16:28,"Everyone's talking about ""innovation."" But how do you actually do it systematically? https://t.co/Nbd1WvkFqy",0,0,en,,,,,,,,
660142960902844416,2015-10-30 17:15:21,Your customers know you better than you know yourself. https://t.co/cxMPC0PVS4,0,0,en,,,,,,,,
660129235537932293,2015-10-30 16:20:49,"First 100 registrants for our webinar with NYT-bestselling authors of ""Primed to Perform"" get the book for free! https://t.co/IcYLpWBSpi",0,0,en,,,,,,,,
660116862051737600,2015-10-30 15:31:38,RT @RingCentral: Winning With a Great Customer Experience https://t.co/oUGGRmoM7G,0,1,en,,,,,,,,
660116786931761152,2015-10-30 15:31:21,RT @MedalliaCareers: Just doing work on #halloween at @medallia_inc #paloalto https://t.co/4He80tFypl,0,4,en,,,,,,,,
660116673203183617,2015-10-30 15:30:53,RT @D_Gardens: Customer Feedback: The Greatest Source of Innovation via @Medallia https://t.co/XZJFKXOFHG https://t.co/hDuf3PwmPr,0,2,en,,,,,,,,
659841007933067264,2015-10-29 21:15:30,"For all-things-customer-experience, check out our all new CX Hub! https://t.co/er50MjkVQP",1,1,en,,,,,,,,
659811060237656064,2015-10-29 19:16:30,How is customer feedback fuel for innovation? https://t.co/cV1V1q8rcK,0,0,en,,,,,,,,
659800193815195648,2015-10-29 18:33:19,RT @seanrabourn: Sharknado at Medallia!!! #sharknado #medallia #halloween #halloween2015 #lovelife #team #fitness… https://t.co/CgE08qCfru,0,1,no,,,,,,,,
659799938281381888,2015-10-29 18:32:18,"RT @Greenhouse: Through systematized feedback &amp; data, @Medallia is always thinking abt ways it can improve the candidate’s journey https://…",0,1,en,,,,,,,,
659448602935304192,2015-10-28 19:16:13,Live in the Bay Area? Join us for a free event aimed at ending biases in the workplace: https://t.co/MZ4fLESqDH,0,1,en,,,,,,,,
659429222465839104,2015-10-28 17:59:12,"RT @sammoore77: Medallia's Unconscious Bias workshop/discussion. A very important topic, hosted by the brilliant Dr. Lauren Jackman! https:…",0,1,en,,,,,,,,
659428537930223616,2015-10-28 17:56:29,"RT @jbnbos: Robert Schiff GM, FS Medallia at #money2020 - I've never heard a Bank say I want to create a great customer experience like tha…",0,3,en,,,,,,,,
659428043467919364,2015-10-28 17:54:31,@heidersbach Glad you enjoyed it!! Thank you for the shout out and joining us :) !,0,0,en,heidersbach,198931190,659072366480261120,,,,,
659427767264616449,2015-10-28 17:53:25,RT @EngagementExpo: A Great #CX IsnÍt Something You Can Script https://t.co/c7NkVtTFwJ @Medallia,0,1,en,,,,,,,,
659418394131853313,2015-10-28 17:16:11,Fred Reichheld joins other customer experience leaders in a discussion on innovation: https://t.co/79ZwjbsCb3,0,0,en,,,,,,,,
659116211259707392,2015-10-27 21:15:25,NPS creator @FredReichheld talks customer experience and innovation: https://t.co/7VkLhdJjfP,1,1,en,,,,,,,,
659056073341579264,2015-10-27 17:16:27,VIDEO: Customer Feedback's Role in Innovation - https://t.co/qS2rfk7DHi,0,0,en,,,,,,,,
659055569836355584,2015-10-27 17:14:27,RT @docker: Just announced: @docker Palo Alto Meetup at @Medallia https://t.co/b5QEdMCdAZ w/ @irabinovitch of @datadoghq &amp; @tom_trahan of @…,0,9,en,,,,,,,,
659055448633556992,2015-10-27 17:13:58,@Taz_Seattle thank you for letting us know :) !,0,0,en,Taz_Seattle,206908936,658840674096119808,,,,,
658723868815839232,2015-10-26 19:16:23,Customer Experience Innovation in an Agile World - https://t.co/vPZtdsr3ls,0,0,en,,,,,,,,
658693649732128769,2015-10-26 17:16:18,"Find out how Delta, one of the newest members of the Medallia family, is improving customer experience: https://t.co/ygP9WJvrQD",1,0,en,,,,,,,,
658671110444204032,2015-10-26 15:46:44,RT @romawat_jobs: Look what I found at B&amp;N this morning. Proud @Medallia moment when I flipped to this page. https://t.co/rCaYywYDn6,0,2,en,,,,,,,,
658361366277955584,2015-10-25 19:15:56,"How can older, larger organizations achieve the levels of agility and innovation of their disruptive competitors? https://t.co/2w8FCvAWog",0,0,en,,,,,,,,
657999015041216517,2015-10-24 19:16:04,"Everyone's talking about ""innovation."" But how do you actually do it systematically? https://t.co/ad1dAhok6q",2,0,en,,,,,,,,
657654037106544640,2015-10-23 20:25:15,It was great meeting so many customer-centric leaders at #CXSF2015! And thank you @Forrester for being amazing hosts! #ForrForum,1,1,en,,,,,,,,
657651054344077312,2015-10-23 20:13:24,RT @fuzzpro: Experiences are more important to us than things. We're shifting from materialism to experientialism.  @tmendelsohn @eventbrit…,0,4,en,,,,,,,,
657636653876584448,2015-10-23 19:16:11,The importance of customer experience innovation: https://t.co/gukQB9S0Rl,0,1,en,,,,,,,,
657621737178312704,2015-10-23 18:16:54,"RT @mattgfrost: Come check out ""Uncovering Gender Bias"" hosted by @Medallia in early November! https://t.co/sf0RkcELzJ via @Eventbrite",0,1,en,,,,,,,,
657621317903060992,2015-10-23 18:15:14,"RT @janeriad: A culture of innovation requires you to:
1. Spread Knowledge
2. Promote Inclusiveness 
3. Tolerate Failure
#etsy #CXSF2015",0,4,en,,,,,,,,
657619825917825024,2015-10-23 18:09:19,RT @forrester: You cannot be a #CX leader without innovation. But innovation will not happen on its own. You must make it happen. #ForrForum,0,15,en,,,,,,,,
657619725170712576,2015-10-23 18:08:55,"RT @forrester: Experiences don't just happen; you have to be very deliberate. 'Hope is not a strategy', says @KennyL. #ForrForum",0,30,en,,,,,,,,
657344967623356417,2015-10-22 23:57:07,@SonyaRuzheva Of course!! Thanks for stopping by :) !,0,0,en,SonyaRuzheva,15484363,657338633066680325,,,,,
657324878052245504,2015-10-22 22:37:18,Medallia's John Abraham takes the stage at #ForrForum #CXSF2015! https://t.co/nNz5TR6qrz,2,1,en,,,,,,,,
657324381031518208,2015-10-22 22:35:19,Dig into the research behind John Abraham's presentation at Forrester #CXSF2015: https://t.co/CBQ86AwREe #ForrForum #CXSF,4,3,en,,,,,,,,
657312283584950272,2015-10-22 21:47:15,RT @forrester: Emotions are missing from our digital world. Our devices have high IQ but no EQ says @kaliouby. #ForrForum,0,35,en,,,,,,,,
657311095699304448,2015-10-22 21:42:32,"RT @forrester: When brands adopt these #emotion principles, the results can be extremely positive on loyalty. #ForrForum https://t.co/vuzTF…",0,56,en,,,,,,,,
657310847379763200,2015-10-22 21:41:32,Such a good point! Reminds us of this recent post: https://t.co/VlMNgM5n9e https://t.co/Q9ETrK5Zty,0,0,en,,,,,,,,
657309504430718976,2015-10-22 21:36:12,How are you managing your customers' unconscious emotions? #ForrForum #CXSF2015,5,1,en,,,,,,,,
657307181612601344,2015-10-22 21:26:58,"RT @forrester: Emotion has the strongest influence on loyalty in 17/18 industries studied, more so than ease and effectiveness. #ForrForum",0,37,en,,,,,,,,
657305669297553408,2015-10-22 21:20:58,@Dtown14Blue Haha what would #CXSF2015 be without CX jokes?,0,0,en,Dtown14Blue,2415240296,657299709673865216,,,,,
657304432720351232,2015-10-22 21:16:03,"Everyone's talking about ""innovation."" But how do you actually do it systematically? https://t.co/V4eBr7EVEO #CXSF2015 #ForrForum",0,0,en,,,,,,,,
657287419746619392,2015-10-22 20:08:27,RT @forrester: Digital disruption allows customers to experience new behaviors at reduced risk and reduced loss. #ForrForum,0,22,en,,,,,,,,
657287256181374976,2015-10-22 20:07:48,RT @forrester: Hyperadoption leads to hyperabandonment - 9/10 apps don't get used after first download. #ForrForum,0,14,en,,,,,,,,
657274412895502336,2015-10-22 19:16:46,What's your plan for competing with Amazon? https://t.co/bG15lmGWIP #CXSF2015 #ForrForum,0,0,en,,,,,,,,
657266703697649664,2015-10-22 18:46:08,"How can older, larger businesses learn to be as agile as today's disruptors? https://t.co/h4F2HsFAuL #CXSF2015 #ForrForum",0,0,en,,,,,,,,
657258934324101124,2015-10-22 18:15:15,"Do you eat, sleep, and dream CX? Check out our all-new CX Hub: https://t.co/CgiT9mOGVR #CXSF2015",0,0,en,,,,,,,,
657249864850366464,2015-10-22 17:39:13,Good morning San Francisco! Let's talk CX. Visit booth 400! #CXSF2015 https://t.co/FOnDEshC3r,2,1,en,,,,,,,,
657244140447617024,2015-10-22 17:16:28,We're excited to announce the release of Medallia Ask Now — a new tool to supercharge your rate of innovation: https://t.co/9KTJBhQy0j #CXSF,1,1,en,,,,,,,,
657241186210439168,2015-10-22 17:04:44,RT @janeriad: 28% of companies have models that tie CX to business results. #KPMG #CXSF2015,0,2,en,,,,,,,,
657239791340118016,2015-10-22 16:59:11,@SonyaRuzheva We are! Come see us at booth 400!,0,0,en,SonyaRuzheva,15484363,656537542183923713,,,,,
657238703438344192,2015-10-22 16:54:52,"RT @jolisouci: ""Spread a mindset, not a footprint."" Great advice from @evelynjoyhuang @CapitalOne #CXSF2015 https://t.co/yMp6Kxy6qr",0,1,en,,,,,,,,
657238076289249280,2015-10-22 16:52:22,@janeriad come see us at Booth 400! #CXSF2015,0,0,en,janeriad,19543252,657237750786060288,,,,,
656959729634140160,2015-10-21 22:26:19,Come see Medallia tomorrow at #CXSF! We'll be talking innovation and handing out a couple of surprises :) https://t.co/S5FPCAkCia,0,1,en,,,,,,,,
656941902017744896,2015-10-21 21:15:29,Check out our newest blog and whitepaper on innovation: https://t.co/vumvmSYJK0,0,0,en,,,,,,,,
656911965974040576,2015-10-21 19:16:32,"Is the glow of your ""brand halo"" blinding you from valuable customer feedback? https://t.co/iuHAZAvB2f",0,0,en,,,,,,,,
656899984214859776,2015-10-21 18:28:55,Customer Experience Innovation in an Agile World - https://t.co/tVKOnsiAlF,0,0,en,,,,,,,,
656549592964710400,2015-10-20 19:16:35,"To get the c-suite onboard with CX, you need to take a walk in their shoes: https://t.co/mD95cTdjZj",0,0,en,,,,,,,,
656519369158205440,2015-10-20 17:16:29,Is your candidate experience misrepresenting your company and your culture? https://t.co/A0lAyGl2WU,0,0,en,,,,,,,,
656217249234206721,2015-10-19 21:15:58,"A new capability that brings ""A/B Testing"" from online and into the real world: https://t.co/MvtlQRECe7",2,1,en,,,,,,,,
656187225848291328,2015-10-19 19:16:40,Our CEO and President talk Medallia with Bloomberg @business! https://t.co/scdpr7at7M,1,0,en,,,,,,,,
656157000729014272,2015-10-19 17:16:34,Achieving empathy in the digital era: http://t.co/IsRX0dXbsE,0,0,en,,,,,,,,
656149186417573888,2015-10-19 16:45:31,RT @EllenDes: Finding new ways to win #siliconvalley #talent war: focus on candidate experience @medallia @joshbudway @LinkedIn https://t.c…,0,1,en,,,,,,,,
656126740172054528,2015-10-19 15:16:19,4 Steps to Winning the Candidate Experience: http://t.co/AVQpewMHPX,0,0,en,,,,,,,,
