id,created_at,text,favorites,retweets,lang,in_reply_to_user,in_reply_to_user_id,in_reply_to_status_id,country,country_code,place_name,place_type,coordinates
596355153181188096,2015-05-07 16:45:22,"""In my life, I want to convince people of the importance of loyal relationships.” @FredReichheld #MedalliaEXP15",1,0,en,,,,,,,,
596354357924364289,2015-05-07 16:42:13,"""You cannot be the best version of yourself if you're not unlocking the full potential of your employees."" -Amy Pressman #MedalliaEXP15",1,2,en,,,,,,,,
596353406492680192,2015-05-07 16:38:26,"Up next: A fireside chat between Medallia co-founder &amp; president, Amy Pressman, and @FredReichheld! #MedalliaEXP15",0,0,en,,,,,,,,
596351879052931072,2015-05-07 16:32:22,Frances Frei just brought room to (laughing) tears with this story about urinals and #CX: http://t.co/nYcMPczDFD #MedalliaEXP15,1,2,en,,,,,,,,
596349902508142592,2015-05-07 16:24:31,"RT @juan_cnba: Frances Frei @ #MedalliaExp15 ""I want to leave in a world where employees deliver excellence casually"" Brilliant, simple, in…",0,4,en,,,,,,,,
596349814780071936,2015-05-07 16:24:10,Customers can unintentionally lead companies out of business. #FrancesFrei #MedalliaEXP15,1,1,en,,,,,,,,
596348679050678273,2015-05-07 16:19:39,How do we close the gap between operational complexity and employee sophistication? #MedalliaEXP15,1,0,en,,,,,,,,
596347800436273152,2015-05-07 16:16:09,We just released a whitepaper that takes a deep dive into the ROI of social media engagement: http://t.co/V9BGZHZerT #MedalliaEXP15,0,0,en,,,,,,,,
596347264794255360,2015-05-07 16:14:02,"""Most companies are not designed to set their employees up for success."" -Frances Frei #MedalliaEXP15",0,1,en,,,,,,,,
596346776807940096,2015-05-07 16:12:05,".@Zappos creates a ""Virtuous Cycle of the Beloved"" through superior service. #FrancesFrei #MedalliaEXP15",0,0,en,,,,,,,,
596345114643066880,2015-05-07 16:05:29,"""You need to have the courage to be bad."" -Frances Frei #MedalliaEXP15",2,1,en,,,,,,,,
596341132843425792,2015-05-07 15:49:40,".@HarvardHBS professor and author of ""Uncommon Service,"" Frances Frei, takes the stage! #MedalliaEXP15",1,0,en,,,,,,,,
596340105717141505,2015-05-07 15:45:35,RT @meetnickthomas: Day 2 at #MedalliaEXP15 - learning and sharing with the best of the best. Packed house - here we goooo!!! http://t.co/C…,0,2,en,,,,,,,,
596338955718696961,2015-05-07 15:41:01,And we're off! Day 2 begins at Experience 2015! #MedalliaEXP15,0,0,en,,,,,,,,
596332810287329280,2015-05-07 15:16:35,RT @CXMWorld: Medallia and Deloitte Launch Strategic Alliance to Provide Full Service Solution for Customer ... http://t.co/QrrTwqzAiV #cem,0,1,en,,,,,,,,
596332675163652097,2015-05-07 15:16:03,Why Unconscious Bias Training Shouldn’t Just Be For Big Companies: http://t.co/kvXcvIldLk #MedalliaEXP15,0,0,en,,,,,,,,
596332532469202944,2015-05-07 15:15:29,"RT @DaytonSemerjian: The god father of Net Promoter Fred Reicheld is opening #MedalliaExp15 this morning on ""The Next Loyalty Frontier"". #a…",0,5,en,,,,,,,,
596327674726875136,2015-05-07 14:56:11,RT @jamesallworth: “Not everything that matters can be measured.” Recognizing this: core to building great experiences #MedalliaEXP15 http:…,0,19,en,,,,,,,,
596117352380559361,2015-05-07 01:00:26,@KevinAdamRose welcome!! And glad you're enjoying the content (and the company) so far!,0,0,en,KevinAdamRose,752120348,596116197176803328,,,,,
596113668741459968,2015-05-07 00:45:48,Industry breakout sessions have begun at Experience 2015 -- share insights using #MedalliaEXP15!,0,0,en,,,,,,,,
596096297968500736,2015-05-06 23:36:47,"@btemkin We're looking forward to it, Bruce -- see you soon! #MedalliaEXP14",1,0,en,btemkin,20524725,596095469995954176,,,,,
596090922158395393,2015-05-06 23:15:25,It’s Time to Take a Survey of Your Employee Survey: http://t.co/Oiwljp7561 #MedalliaEXP15,0,1,en,,,,,,,,
596075818729766912,2015-05-06 22:15:24,eBook: How to Transform Your C-Suite into Customer Experience Champions - http://t.co/5NNSPCdIWp #MedalliaEXP15,1,3,en,,,,,,,,
596072124177108992,2015-05-06 22:00:43,"RT @JennOrtegon: We are fundamentally changing what it means to be a business, to be a customer, to be an employee #MedalliaEXP15",0,4,en,,,,,,,,
596066101265616896,2015-05-06 21:36:47,"RT @llwilliams555: Favorite quote from the #MedalliaEXP15 keynote: ""There is no great customer experience with out well functioning teams """,0,3,en,,,,,,,,
596066058315931649,2015-05-06 21:36:37,RT @NPSLoyaltyForum: Looking forward to meeting many great people at this week's Medallia Experience! #MedalliaEXP15,0,2,en,,,,,,,,
596060777783631873,2015-05-06 21:15:38,Driving Bank Earnings Growth through Customer Experience: http://t.co/Us4ASATd2x,0,0,en,,,,,,,,
596059200133861376,2015-05-06 21:09:22,Showtime! #MedalliaEXP15 http://t.co/NcyZRDtD8S,1,0,en,,,,,,,,
596058447344459776,2015-05-06 21:06:22,@ArturoRaj Welcome!!,0,0,en,ArturoRaj,81919157,596056609031237632,,,,,
596055168132653056,2015-05-06 20:53:20,Join the social conversation at Experience 2015! Use hashtag #MedalliaEXP15! http://t.co/ZFSo1xSuTZ,0,1,en,,,,,,,,
596045660417355776,2015-05-06 20:15:34,US consumers are more likely to recommend their favorite FAST FOOD &amp; AIRLINES before their banks: http://t.co/bu0dnaPCyC #MedalliaEXP15,1,0,en,,,,,,,,
596035300901662720,2015-05-06 19:34:24,@_wideangle Thank you for your feedback! Connecting you with @medalliasupport to learn more about the issue. Appreciate your patience!,0,0,en,_wideangle,152962898,596027696255279105,,,,,
596030575162617856,2015-05-06 19:15:37,"Failure in B2B - Not with a Bang, but a Whimper: http://t.co/EVdJZ1GWBR",0,1,en,,,,,,,,
596027798776586240,2015-05-06 19:04:35,RT @BethStefanik: Medallia is looking for a content writer whose only weakness is kryptonite. Sound like you? http://t.co/vlHEwdbmI8 Via @d…,0,2,en,,,,,,,,
596026308196466689,2015-05-06 18:58:40,@Aneet834 Hi there! We appreciate your interest. Some of the presentations for #MedalliaEXP15 will be recorded and posted to our site :) !,0,0,en,Aneet834,17671298,596016408749674496,,,,,
596013077201489921,2015-05-06 18:06:05,Here we go! #MedalliaEXP15 http://t.co/beX6sOAMHy,5,6,en,,,,,,,,
596000410877440001,2015-05-06 17:15:45,Super Bowl commercials. Highway billboards. Social media. We finally know the value of one of these: http://t.co/Y02QJ1SOic,0,0,en,,,,,,,,
595994366306582528,2015-05-06 16:51:44,"RT @LRWonline: What a beautiful morning in Scottsdale, LRW is here to add to the conversation about #CX at the @Medallia Conference http://…",0,1,en,,,,,,,,
595713481904631808,2015-05-05 22:15:36,"According to @TemkinGroup, US consumers are more likely to recommend FAST FOOD &amp; AIRLINES before banks: http://t.co/DOrvi4sGVK",1,0,en,,,,,,,,
595698420146425857,2015-05-05 21:15:45,How will wearables impact customer experience? http://t.co/qU2jSjJBOu,1,0,en,,,,,,,,
595669472347840513,2015-05-05 19:20:43,Driving Bank Earnings Growth through Customer Experience: http://t.co/GiBl670LPd #MedalliaEXP15,0,1,en,,,,,,,,
595623032904949761,2015-05-05 16:16:11,"Social media. It's more than pictures of dogs, cats, and babies: http://t.co/y16qNKz1mC #CustomerLoyalty",0,1,en,,,,,,,,
595336047954948097,2015-05-04 21:15:49,Whitepaper: Turning Social Media Engagement into Customer Loyalty - http://t.co/aXpntYPcUu,0,0,en,,,,,,,,
595305879794253825,2015-05-04 19:15:56,5 Ways to Be More Engaging on Social Media: http://t.co/pR5bReULKJ,0,0,en,,,,,,,,
595303573421973504,2015-05-04 19:06:46,RT @btemkin: Looking forward to speaking about Customer-Centric Culture @Medallia's Experience 2015 in #Scottsdale this Thursday http://t.c…,0,3,en,,,,,,,,
595290737526349824,2015-05-04 18:15:46,We're very excited to announce our partnership with @appirio! Looking forward to the good things to come: http://t.co/DaMlJcVRCB,2,1,en,,,,,,,,
595275666255392768,2015-05-04 17:15:53,Don't wait until you're a big company to tackle unconscious biases: http://t.co/gTBZniXp4X,2,0,en,,,,,,,,
594943374307766272,2015-05-03 19:15:28,The first step in resolving biases in the workplace? Realizing we all have them: http://t.co/YCtZ5UiAwZ,0,0,en,,,,,,,,
594580998546956288,2015-05-02 19:15:31,How Customer-Centric are You? http://t.co/jhQia6kpYu,1,1,en,,,,,,,,
594535720712335361,2015-05-02 16:15:36,Check out our latest whitepaper (and blog) on the financial impact of social media: http://t.co/xmwCUZNPRM,0,0,en,,,,,,,,
594248834819170304,2015-05-01 21:15:37,We just released a whitepaper that takes a deep dive into the ROI of social media engagement: http://t.co/LlPrcXtSU1,1,1,en,,,,,,,,
594218653563912192,2015-05-01 19:15:41,4 Reasons Why Unconscious Bias Training Shouldn't Just Be For Big Companies: http://t.co/83KdThe00u,2,1,en,,,,,,,,
594203529050509312,2015-05-01 18:15:35,BLOG + GUIDE: How to increase survey response rates - http://t.co/k5K4qWeq2j,0,0,en,,,,,,,,
594198393309831168,2015-05-01 17:55:11,@annelizdiemer Thanks for the awesome feedback -- glad you enjoyed it!!,0,0,en,annelizdiemer,2698870748,593984258512789504,,,,,
594198078770544640,2015-05-01 17:53:56,@WaypointGrpB2B of course :) !!,0,0,en,WaypointGrpB2B,2361510278,594189388076060673,,,,,
594188434241155072,2015-05-01 17:15:36,Turning Social Media Engagement into Customer Loyalty: http://t.co/56G0DKpJn6,0,0,en,,,,,,,,
594173388182134784,2015-05-01 16:15:49,Join @WaypointGrpB2B in San Francisco for a workshop on optimizing your B2B customer feedback program: http://t.co/4iRtB8ZTGf,0,0,en,,,,,,,,
593901533223329792,2015-04-30 22:15:34,"BLOG + VIDEO: A DIY ""unconscious bias"" workshop for your company: http://t.co/PRhMAm8wxn",0,0,en,,,,,,,,
593867817444777984,2015-04-30 20:01:35,RT @Which50: WHICH 50 : Driving bank earnings growth through customer experience http://t.co/3PY0HeGkgO @Medallia,0,2,en,,,,,,,,
593856265056591872,2015-04-30 19:15:41,There's more to getting the right amount of customer feedback than survey design: http://t.co/34izA8T71D,0,0,en,,,,,,,,
593835840079429632,2015-04-30 17:54:31,RT @appirio: Survey Your Way to a Better Customer Experience with Medallia http://t.co/i0MD0SFfoy,0,3,en,,,,,,,,
593834035358597120,2015-04-30 17:47:21,RT @CXMWorld: Medallia and Appirio Partner to Improve Customer Experience Efforts by Uniting Customer Insights ... http://t.co/sHlsRpSAYF #…,0,1,en,,,,,,,,
593539269953777665,2015-04-29 22:16:04,5 Ways to Be More Engaging on Social Media: http://t.co/EjmU73pBrq,0,1,en,,,,,,,,
593524110002495489,2015-04-29 21:15:49,The first step in resolving biases in the workplace? Realizing we all have them: http://t.co/sDAfCEIOeX,0,1,en,,,,,,,,
593493920564248576,2015-04-29 19:15:51,"Looking for a new job? Then it's time to learn the difference between ""Eudaimonic"" and ""Hedonic"" happiness: http://t.co/4l3Y8jPFcM",0,1,en,,,,,,,,
593463669838741504,2015-04-29 17:15:39,Workshop: Optimize Your B2B Feedback to Accelerate Growth - http://t.co/k2LjOaewyF,0,1,en,,,,,,,,
593460876637773825,2015-04-29 17:04:33,"RT @TNS_US: Stop by the TNS booth at @Medallia's Experience 2015 conference in Scottsdale, AZ May 6-8 #socialTrim",0,1,en,,,,,,,,
593433495512469505,2015-04-29 15:15:45,"#LoyaltyExpo: Stop by Booth 514, say you've got a Golden Ticket, and claim your surprise -- before they run out...",0,0,en,,,,,,,,
593418431350874114,2015-04-29 14:15:53,Medallia Customer @TheBestWestern wins Platinum Award win at #LoyaltyExpo! http://t.co/udQ9dOpDJi,0,1,en,,,,,,,,
593252232830832641,2015-04-29 03:15:29,At #LoyaltyExpo? Stop by Medallia's booth (514) tomorrow and say you've got a Golden Ticket...,0,0,en,,,,,,,,
593195715247120384,2015-04-28 23:30:54,Congratulations to @TheBestWestern for their Platinum Award win at #LoyaltyExpo! http://t.co/Cvh32kVizq,2,1,en,,,,,,,,
593176782691524608,2015-04-28 22:15:40,Don't wait until you're a big company to tackle unconscious biases: http://t.co/clPx5lFHPb,1,2,en,,,,,,,,
593131554144067584,2015-04-28 19:15:57,How to measure the ROI of customer experience improvements: http://t.co/AcMD4wUsxH,0,1,en,,,,,,,,
593101339892293632,2015-04-28 17:15:53,"Our People &amp; Culture team created a DIY ""Unconscious Bias"" workshop: http://t.co/CfRkykYbQk",1,1,en,,,,,,,,
592814390887473153,2015-04-27 22:15:39,"Whether or not we realize, there are biases that affect the way we interact with others at work: http://t.co/CWs3wx97Dl",0,2,en,,,,,,,,
592784159283748865,2015-04-27 20:15:31,Why Unconscious Bias Training Shouldn't Just Be For Big Companies: http://t.co/p9N85g03fn,0,3,en,,,,,,,,
592732220114231298,2015-04-27 16:49:08,"RT @MedalliaCareers: How do you start your week, or day? Our Co-Founder shares the Medallian way w/ the @dailymuse http://t.co/dfoUd6Fare h…",0,4,en,,,,,,,,
592732092636778496,2015-04-27 16:48:37,"RT @StartupGrind: May 13th, Startup Grind #SiliconValley Presents Amy Pressman (@Medallia) http://t.co/4HJu27oiVx #SV",0,1,en,,,,,,,,
592732043936722945,2015-04-27 16:48:26,@patrickabrunner Welcome aboard :D !!,0,0,en,patrickabrunner,100799312,591800584610549760,,,,,
592044302496301057,2015-04-25 19:15:36,BLOG + GUIDE: How to increase survey response rates - http://t.co/ubAzkjDOTW,1,2,en,,,,,,,,
591681947249876992,2015-04-24 19:15:43,The key to a strong employee survey? Taking action on the feedback: http://t.co/QbFLu6Rkr8,0,2,en,,,,,,,,
591651752946044928,2015-04-24 17:15:44,What are you doing to encourage customers to provide feedback? http://t.co/TV9nIrzi3c,0,1,en,,,,,,,,
591636641682448384,2015-04-24 16:15:42,Workshop: Optimize Your B2B Feedback to Accelerate Growth - http://t.co/b0rsLwfeLX @WaypointGrpB2B,1,2,en,,,,,,,,
591335628371009536,2015-04-23 20:19:34,"RT @Greenhouse: ""Key to delivering a great candidate experience is hiring manager engagement.""  http://t.co/IIBKUukbiW http://t.co/SLp0NPZD…",0,4,en,,,,,,,,
591334840999510016,2015-04-23 20:16:27,@parikhdolly That makes us so happy :) Thank you!!,0,0,en,parikhdolly,87382960,590960652207857665,,,,,
591319591856504833,2015-04-23 19:15:51,How to Be Happier at Your Next Job: http://t.co/TisggWQHag,1,2,en,,,,,,,,
591274331449253888,2015-04-23 16:16:00,Beyond Survey Design: How Companies Can Foster a Culture in which Customers Want to Provide Feedback: http://t.co/vk5SThKr2w,0,0,en,,,,,,,,
590987407996100608,2015-04-22 21:15:52,How do you increase the amount of feedback data you collect from customers? http://t.co/3i3VtgSLI6,1,0,en,,,,,,,,
590957224173928449,2015-04-22 19:15:56,Uncovering the true value of social media: http://t.co/NN1uEZHTtW,0,1,en,,,,,,,,
590927030532833280,2015-04-22 17:15:57,"If you could only ask one question on your employee survey, what would it be? http://t.co/BpV8LXnEdj",0,1,en,,,,,,,,
590919431875854336,2015-04-22 16:45:45,Fostering a Customer Feedback Culture: A Mindset to Increasing Response Rates - http://t.co/ZLSxcLfl3B,0,2,en,,,,,,,,
590911670576283648,2015-04-22 16:14:55,RT @CXMWorld: Cablevision Integrates Medallia into Its Operations Organization to Further Enhance Its Customer ... http://t.co/henkociUxL #…,0,3,en,,,,,,,,
590906820375535616,2015-04-22 15:55:39,"RT @StartupGrind: May 13th, Startup Grind #SiliconValley Presents Amy Pressman (@Medallia) http://t.co/4HJu27oiVx #SV",0,2,en,,,,,,,,
590906673067401219,2015-04-22 15:55:04,IN ONE HOUR: The Business Impact of Social Media #webinar! Sign-up here: http://t.co/AExBtJHXR3,0,0,en,,,,,,,,
590640036523159553,2015-04-21 22:15:32,Is your company using social media? You might want to attend this webinar tomorrow: http://t.co/JnqS1EsSNz,0,1,en,,,,,,,,
590594843149279233,2015-04-21 19:15:57,Did you know that Medallia offers a #CEM certification course? http://t.co/9F88LP7yHY,0,2,en,,,,,,,,
590262604712534018,2015-04-20 21:15:46,It's Time to Take a Survey of Your Employee Survey: http://t.co/MomFpCXctD,0,0,en,,,,,,,,
590232435226456064,2015-04-20 19:15:53,There's still time to register for Wednesday's webinar on the Business Impact of Social Media! http://t.co/FccHtbxiTN,0,0,en,,,,,,,,
590202254315155457,2015-04-20 17:15:57,Secret Life of Medallians: @VDay &amp; the Seeds of a Grassroots Culture - http://t.co/7WnuxwIjQr,0,1,en,,,,,,,,
589870005933707264,2015-04-19 19:15:43,Best Western has found a connection between social media engagement and occupancy rate growth: http://t.co/e0IQYMrG3p,2,4,en,,,,,,,,
589507583393792001,2015-04-18 19:15:35,Why companies aren't making the most of employee feedback: http://t.co/Vzfl7g2VSx,1,0,en,,,,,,,,
589145216508108800,2015-04-17 19:15:40,How one company was able to connect social media engagement with business outcomes: http://t.co/DeleOlPIOu,1,2,en,,,,,,,,
589115088470151168,2015-04-17 17:15:56,Why ask a question if you don't plan to act on the answer? #EmployeeSurveys http://t.co/JBJMYb0QV6,1,2,en,,,,,,,,
588782941741969408,2015-04-16 19:16:07,Get customer-centric. In sunny Scottsdale. In May. http://t.co/mHs3oXOQgo,0,3,en,,,,,,,,
588737561046159360,2015-04-16 16:15:47,How well did your company act on your most recent employee survey? http://t.co/G20fdciKEf,0,1,en,,,,,,,,
588450696002990081,2015-04-15 21:15:53,Get your free ticket and join Medallia on Friday at the @Sheplusplus women in tech conference! http://t.co/89fZKTiYOp,1,0,en,,,,,,,,
588420486222241792,2015-04-15 19:15:50,"Check out our office, meet some Medallians, and hear from our co-founder, Amy: http://t.co/pf9X55WAI8",0,1,en,,,,,,,,
588405359099908096,2015-04-15 18:15:44,"If you could only ask one question on your employee survey, what would it be? http://t.co/2rnt3MdH79",0,1,en,,,,,,,,
588390284096053248,2015-04-15 17:15:50,Super Bowl ads. Conference swag. Social media. What do they have in common? Their impact is tough to measure. http://t.co/sNR2z6ssWa,1,0,en,,,,,,,,
588387089798057984,2015-04-15 17:03:08,"RT @MarijkeMaartens: Perfect description of what success in my job looks like.""Medallia: How to Create Experiences Customers Love"" https://…",0,4,en,,,,,,,,
588088216663826432,2015-04-14 21:15:31,Why companies aren't making the most of employee feedback: http://t.co/QxEK06ldmc,0,1,en,,,,,,,,
588069763659759616,2015-04-14 20:02:12,@sheplusplus Likewise!! :D !!!,0,0,en,sheplusplus,522901844,588051037476544512,,,,,
588069713646907392,2015-04-14 20:02:00,@sequoia @sheplusplus !! That's great news -- we will see you there :),1,0,en,sequoia,24775410,588052863974297600,,,,,
588058110440448002,2015-04-14 19:15:53,Learn how @TheBestWestern was able to identify the true value of their social media activities: http://t.co/rp0tS6zcZC,0,0,en,,,,,,,,
588027835102683138,2015-04-14 17:15:35,It's Time to Take a Survey of Your Employee Survey: http://t.co/O4ReFgij2V,0,3,en,,,,,,,,
588019043224985602,2015-04-14 16:40:39,"RT @CXMWorld: Medallia Partners with Loyalty Expert Fred Reichheld, Acquires Rights to Reichheld's HuddleUp ... http://t.co/loOTJCyPHb #cem",0,6,en,,,,,,,,
587725870468620288,2015-04-13 21:15:41,Get your free ticket and join Medallia at this week's @Sheplusplus women in tech conference! http://t.co/89fZKTiYOp,0,2,en,,,,,,,,
587695657751879680,2015-04-13 19:15:38,Don't miss our upcoming webinar on the business impact of social media: http://t.co/gYA7gwjSsD,1,1,en,,,,,,,,
587665473124306944,2015-04-13 17:15:41,The power of bottom-up (versus top-down) culture: http://t.co/2RECp7LIpk,0,0,en,,,,,,,,
587333242262544384,2015-04-12 19:15:31,Super Bowl ads. Conference swag. Social media. What do they have in common? Their impact is tough to measure. http://t.co/Rw3Yjnu1WX,4,0,en,,,,,,,,
586970848709357568,2015-04-11 19:15:30,"At Medallia, our co-founders and executives empower employees to take initiative with the company's culture: http://t.co/hbpxsCUvoQ",0,1,en,,,,,,,,
586608524047867905,2015-04-10 19:15:45,"May is Female Founders Month -- and you have a chance to meet our co-founder, Amy! http://t.co/WVIIouQeB4 @StartupGrind",0,1,en,,,,,,,,
586578287796867072,2015-04-10 17:15:36,The power of a grassroots employee culture: http://t.co/ENIKG11iOc,0,0,en,,,,,,,,
586563282661703680,2015-04-10 16:15:59,Most companies today are using social media. And most can't measure the value of it. http://t.co/1yX72z21Hi,2,1,en,,,,,,,,
586276264098537472,2015-04-09 21:15:28,Webinar + Blog: New findings from @TheBestWestern underline the true value of social media engagement: http://t.co/1H3YMV1BRw,1,0,en,,,,,,,,
586261212066906114,2015-04-09 20:15:39,Medallia is proud to be a sponsor of next week's @Sheplusplus conference and gala! Find out more here: http://t.co/GopS7L304C,1,0,en,,,,,,,,
586246099503030273,2015-04-09 19:15:36,Who owns the culture in your company? http://t.co/VEEBqDh0xn,1,1,en,,,,,,,,
586223408939147264,2015-04-09 17:45:26,The Business Impact of Social Media Engagement: http://t.co/zqUetEkQ3T,0,0,en,,,,,,,,
586198339110207488,2015-04-09 16:05:49,IN ONE HOUR: Our live webinar with Famers Insurance! Learn how they're focusing on customer experience: http://t.co/STSaCNhYrf,0,0,en,,,,,,,,
585913963281571841,2015-04-08 21:15:49,"The difference between ""perfect"" and ""continuous improvement"": http://t.co/OFPlU7NnHN",3,1,en,,,,,,,,
585898801044578304,2015-04-08 20:15:34,Join us tomorrow to learn how Farmers Insurance has reoriented their large org toward customer-centricity: http://t.co/NmFbqBJZgA,0,0,en,,,,,,,,
585883761558089728,2015-04-08 19:15:48,"For @TheBestWestern, engaging with social media = occupancy rate growth.  http://t.co/DfdSOgij61",0,1,en,,,,,,,,
585868564617424896,2015-04-08 18:15:25,How Medallians rallied to support @VDay - http://t.co/pM2LiDVOsT,1,0,en,,,,,,,,
585853543934009344,2015-04-08 17:15:44,Don't miss tomorrow's webinar with Farmers Insurance! http://t.co/oDbTxLpHd3,0,0,en,,,,,,,,
585566619054841856,2015-04-07 22:15:35,Not happy with your insurance company? Send them this webinar invite: http://t.co/8zpnxCg6VD,0,0,en,,,,,,,,
585551499494842370,2015-04-07 21:15:31,The power of bottom-up (versus top-down) culture: http://t.co/4xbgBPJaCt,1,1,en,,,,,,,,
585521347448700929,2015-04-07 19:15:42,Secret Life of Medallians: @VDay &amp; the Seeds of a Grassroots Culture - http://t.co/pM2LiDVOsT,0,1,en,,,,,,,,
585460909813977088,2015-04-07 15:15:32,BLOG + WEBINAR: What's @WeAreFarmers doing differently to stand out in their industry? http://t.co/jlIuP3lrVa,0,0,en,,,,,,,,
585223140202192899,2015-04-06 23:30:44,We're just one month away from Female Founders Month! Want to meet Medallia's? http://t.co/GpAHgu6RKn,2,3,en,,,,,,,,
585189115932635136,2015-04-06 21:15:32,How one insurance company made the switch to customer-centricity: http://t.co/6AtWCieRd8,0,0,en,,,,,,,,
585158952687665153,2015-04-06 19:15:40,Here's a crash course in life at Medallia (P.S. We're hiring!) - http://t.co/WajYGQFAqe,0,0,en,,,,,,,,
585156371244576770,2015-04-06 19:05:25,RT @customer_report: Medallia Study:  Hotels That Respond to Social Media Reviews Grow Occupancy Rates Faster Than Social Media Laggards ht…,0,2,en,,,,,,,,
585155869513506816,2015-04-06 19:03:25,RT @KimberlyTam: One of my favorite articles I've read on finding happiness in my next job. http://t.co/rQMkNIhtOX @Medallia,0,2,en,,,,,,,,
585155548150136832,2015-04-06 19:02:09,"RT @StartupGrind: May 13th, Startup Grind #SiliconValley Presents Amy Pressman (@Medallia) http://t.co/4HJu27oiVx #SV",0,2,en,,,,,,,,
585098550733832192,2015-04-06 15:15:39,Think you're customer-centric? Prove it: http://t.co/vhI4kAFqrX,0,0,en,,,,,,,,
585083481430093824,2015-04-06 14:15:46,Farmers Insurance: Fighting Google With Customer Centricity - http://t.co/ny1ZlxFKhc,0,1,en,,,,,,,,
584796494726828033,2015-04-05 19:15:23,"The Muse takes a look at Medallia's ""Growth Mindset"" - http://t.co/Y1HxOGGb9J",0,2,en,,,,,,,,
584751144477528064,2015-04-05 16:15:11,How customer-centricity is helping the cream of the crop rise to the top. http://t.co/YL0q8sJyP0 @WeAreFarmers,1,1,en,,,,,,,,
584434138691829760,2015-04-04 19:15:31,Did you know that Medallia offers a #CEM certification course? http://t.co/8AljJ42Ec2,0,1,en,,,,,,,,
584388882613035008,2015-04-04 16:15:41,Not a fan of your insurance company? Share this blog and webinar with them: http://t.co/2iTinyI9Kv,0,0,en,,,,,,,,
584117031559176192,2015-04-03 22:15:27,Could your company's focus on health and diet actually impact your happiness at work? http://t.co/fxYkMgh31F,1,2,en,,,,,,,,
584109389830889472,2015-04-03 21:45:05,BLOG + WEBINAR: What's @WeAreFarmers doing differently to stand out in their industry? http://t.co/dsMy9QeVkm,0,0,en,,,,,,,,
584101949827612674,2015-04-03 21:15:31,Measure your own customer-centricity with this new tool: http://t.co/EHEP4TAgj6,1,0,en,,,,,,,,
584071672438874112,2015-04-03 19:15:12,Farmers Insurance: Fighting Google With Customer Centricity - http://t.co/AFIDXkR3zr,0,0,en,,,,,,,,
584061005023604736,2015-04-03 18:32:49,RT @JennOrtegon: Had the opp to hear Thomas Quill from @WeAreFarmers speak earlier this year. Don't miss this webinar next Wednesday http:/…,0,2,en,,,,,,,,
584041585073135618,2015-04-03 17:15:39,Start connecting your customer experience to financial outcomes: http://t.co/8XBH3pXztl,0,0,en,,,,,,,,
583739610456596480,2015-04-02 21:15:43,We're just one month away from Female Founders Month! http://t.co/zHALjG0aPT,1,1,en,,,,,,,,
583724506222616577,2015-04-02 20:15:42,Sign up for next week's webinar with @WeAreFarmers! http://t.co/vmH3He9DVO,0,0,en,,,,,,,,
583709427322191872,2015-04-02 19:15:46,"Two of our Directors of Engineering are starting an ""Open Source Guide to Management"" - http://t.co/UqZP1onQxB",1,0,en,,,,,,,,
583695007284080640,2015-04-02 18:18:28,Bias for Action: The Transformational Journey of Farmers Insurance to Customer-Centricity - http://t.co/A0laBJk27f,0,1,en,,,,,,,,
583649008259829760,2015-04-02 15:15:41,Get Customer Experience Certified: http://t.co/xuLwhAURfC,0,1,en,,,,,,,,
583392302690914304,2015-04-01 22:15:38,What's it like to work at Medallia? Take a peek: http://t.co/AyWBzAiybW,0,0,en,,,,,,,,
583377107629305856,2015-04-01 21:15:15,A test everyone in your company should take: http://t.co/F43VxMwfoX,1,0,en,,,,,,,,
