id,created_at,text,favorites,retweets,lang,in_reply_to_user,in_reply_to_user_id,in_reply_to_status_id,country,country_code,place_name,place_type,coordinates
531178225524019200,2014-11-08 20:15:32,The Beginner's Guide to Medallia (and Customer Experience Management): http://t.co/9MUQRHTXjX,2,0,en,,,,,,,,
531163070371217408,2014-11-08 19:15:19,Our Senior Research Scientist discusses customer experience and marketing in the @guardian: http://t.co/vxiQIQIA2Y,2,2,en,,,,,,,,
531147977146896384,2014-11-08 18:15:20,This horrible restaurant experience cost a customer thousands of dollars:  http://t.co/JFn5Fd7XOm,1,0,en,,,,,,,,
530894772873871360,2014-11-08 01:29:12,RT @billquiseng: People power: turning customer experience into a marketing tool via @peterkriss @Medallia http://t.co/mhzde2ETZL #cx #cust…,0,2,en,,,,,,,,
530875131024138241,2014-11-08 00:11:09,People power: turning customer experience into a marketing tool http://t.co/Mkndd3NjyV,1,0,en,,,,,,,,
530845986374316032,2014-11-07 22:15:20,In need of a good weekend read? Check out our latest customer experience ebook: http://t.co/arnPivGUyV,0,0,en,,,,,,,,
530815825339760640,2014-11-07 20:15:29,"It's time to talk Experience 2015, Medallia's Customer Experience Leadership Conference: http://t.co/GdtepL7uO1",0,0,en,,,,,,,,
530785637293899776,2014-11-07 18:15:32,The Internet of Things is here to stay -- but what are we going to do with ALL THAT DATA? http://t.co/hCIBaYlwfj,1,1,en,,,,,,,,
530782305405923328,2014-11-07 18:02:17,RT @sequoia: How to Create Experiences Customers Love from @Medallia http://t.co/Zn8vLgHWun,0,6,en,,,,,,,,
530483568720760833,2014-11-06 22:15:13,What are brands like @Nordstrom and @PayPal doing differently? http://t.co/NrGUOKsAoI,0,0,en,,,,,,,,
530453461297799168,2014-11-06 20:15:35,"VIDEO: Customer Experience Management, defined - http://t.co/9U0Df79lRA",0,1,en,,,,,,,,
530451770922004483,2014-11-06 20:08:52,@BillRattner thank you for sharing this!,1,0,en,BillRattner,1191110196,530415046946738176,,,,,
530451709232164865,2014-11-06 20:08:37,RT @BillRattner: Check this out: Paypal Case Study - Medallia - $2 Billion in CX improvements! http://t.co/oqc68iGOeR,0,217,en,,,,,,,,
530438327535935488,2014-11-06 19:15:27,EBOOK: CX strategies from 5 top brands - http://t.co/QWOyF2aIG5,0,0,en,,,,,,,,
530423219267063808,2014-11-06 18:15:24,"Do you eat, sleep, and breathe customer experience? http://t.co/q5jKQdjW1S",0,0,en,,,,,,,,
530136327237672962,2014-11-05 23:15:24,Our latest ebook reveals 5 CX secrets from some of the world's top brands: http://t.co/nbHyfa1LkA,1,0,en,,,,,,,,
530128075376566273,2014-11-05 22:42:37,RT @MedalliaEng: I love the engineers I work w/ want to know why?  I'll share kkelison(at)medallia  @MedalliaEng @MedalliaCareers http://t.…,0,1,en,,,,,,,,
530127927862919168,2014-11-05 22:42:01,RT @DellNetworking: Medallia discusses the huge cost savings and other advantages realized by using Dell Networking technology #dellworld20…,0,8,en,,,,,,,,
530121254154821632,2014-11-05 22:15:30,We're bringing together the highest concentration of CX gurus from the world's leading brands under one roof: http://t.co/XxAXdyOVMJ,0,0,en,,,,,,,,
530117325169500160,2014-11-05 21:59:54,Find out how some of the world's leading brands are creating experiences that customers love! https://t.co/zvzd6py3SB,14,16,en,,,,,,,,
530091097838845953,2014-11-05 20:15:41,What does the Internet of Things have to do with customer experience? http://t.co/ekBqn9XLXk,0,0,en,,,,,,,,
530060426810503168,2014-11-05 18:13:48,EBOOK: Customer Experience Secrets from 5 Brands You Love - http://t.co/2YJ0IRVuCu,2,0,en,,,,,,,,
530056720815767553,2014-11-05 17:59:04,RT @Jaxx_Magee: Join the team. | Medallia http://t.co/FFv6uFFYTJ #medalliaeng #dellworld2014,0,1,en,,,,,,,,
529758807657046017,2014-11-04 22:15:16,Registration is now open for THE customer experience event of 2015: http://t.co/oZ962xLVRi,0,0,en,,,,,,,,
529743046154649600,2014-11-04 21:12:39,RT @karmani68: The leader focused on the customer @MichaelDell with @karmani68 from @medallia the leader in customer experience mgmt http:/…,0,4,en,,,,,,,,
529728658555289601,2014-11-04 20:15:28,Want to come to Experience 2015? Register now to save over 50%! http://t.co/ACQRnkcEkN,1,0,en,,,,,,,,
529713485765427201,2014-11-04 19:15:11,Announcing Experience 2015 - Medallia's Customer Experience Leadership Conference! http://t.co/Y3m0xuJI6m,1,2,en,,,,,,,,
529708279799111680,2014-11-04 18:54:30,RT @podobnik: Don't miss @karmani68 representing @Medallia/@MedalliaEng at #DellWorld2014 this week in Austin!,0,3,en,,,,,,,,
529695029292716032,2014-11-04 18:01:50,LIVE NOW: Our webinar with @CXPA_Assoc! Join here: http://t.co/0NGWrxMycy,1,0,en,,,,,,,,
529694076552372224,2014-11-04 17:58:03,RT @karmani68: In Austin for #DellWorld2014 executive summit and conference. Let's connect if you want to talk technology and learn more ab…,0,4,en,,,,,,,,
529683406293331969,2014-11-04 17:15:39,STARTING IN ONE HOUR: Have you signed up for our webinar with @CXPA_Assoc? http://t.co/yE9YRnCIHF,0,0,en,,,,,,,,
529426600665022464,2014-11-04 00:15:12,Don't miss tomorrow's webinar on the link between customer experience and revenue! http://t.co/eCFKIkAxld,0,1,en,,,,,,,,
529396390762643456,2014-11-03 22:15:09,Uber's next customer experience challenge? Picking up kids from school: http://t.co/1RDqW4r5IS,0,1,en,,,,,,,,
529348875283599361,2014-11-03 19:06:21,RT @LisaKayHawes: Parents (@Medallia CEO) use #Uber RT @serenasaitto: Imagine a future where you don't need to drive your kids around: http…,0,1,en,,,,,,,,
529336125367021569,2014-11-03 18:15:41,WEBINAR: The link between customer experience and revenue - http://t.co/JdVCOzcwQs,0,0,en,,,,,,,,
529307220635574273,2014-11-03 16:20:50,RT @CXPA_Assoc: Who is attending @Medallia webinar 'The Link Between Customer Experience and Revenue' tomorrow? http://t.co/JUZoqKODvj #CXP…,0,3,en,,,,,,,,
529003836623814657,2014-11-02 20:15:17,"How Can You Leverage the ""Continuous Feedback Loop of Everything"" Created by the Internet of Things? http://t.co/cQV5ZgTrpO",0,0,en,,,,,,,,
528294165067882496,2014-10-31 21:15:18,The Internet of Things meets Customer Experience: http://t.co/Iyj12fKNMD,0,1,en,,,,,,,,
528272906082476032,2014-10-31 19:50:50,RT @ScottHRoth: Not sure how #CEM works? Here’s how @Medallia is helping leading brands create experiences their customers love. http://t.c…,0,2,en,,,,,,,,
528264013864763392,2014-10-31 19:15:30,Ever needed to explain Medallia to your grandmother? http://t.co/rZ7ISbVB32,0,1,en,,,,,,,,
528248942350581761,2014-10-31 18:15:36,The Internet of Things = The Continuous Feedback Loop of Everything http://t.co/rfK0jghICd,0,1,en,,,,,,,,
528233863949324291,2014-10-31 17:15:41,WEBINAR: The link between customer experience and revenue - http://t.co/L5RzngTxbt,0,0,en,,,,,,,,
527931854092238848,2014-10-30 21:15:37,How the Internet of Things is poised to revolutionize customer experience: http://t.co/MraTajBVJM,0,1,en,,,,,,,,
527901660522491905,2014-10-30 19:15:38,"Coworker, executive, or spouse still not sure what Medallia is? Send them this video: http://t.co/uWcwqp8sII",1,1,en,,,,,,,,
527871333036998657,2014-10-30 17:15:07,"How Can You Leverage the ""Continuous Feedback Loop of Everything"" Created by the Internet of Things? http://t.co/W2AvWR4PHE",0,0,en,,,,,,,,
527864107249442816,2014-10-30 16:46:25,"@HootSuite_Help No worries, we appreciate it :) !",0,0,en,Hootsuite_Help,61315223,527862060798189568,,,,,
527861463403098112,2014-10-30 16:35:54,@HootSuite_Help Hi there! Scheduler seems to be going a bit haywire. Displaying in reverse chronology and some AM/PMs are out of order...,0,0,en,Hootsuite_Help,61315223,,United States,US,"Daly City, CA",city,
527573551420014593,2014-10-29 21:31:51,@kpedro09 thank you for joining us today :) ! Glad you enjoyed it!,0,0,en,kpedro09,20319451,527534910463287296,,,,,
527569493107941379,2014-10-29 21:15:43,What's the ROI of customer experience? http://t.co/7REe0NqFuB,0,1,en,,,,,,,,
527539219724795904,2014-10-29 19:15:25,"What's ""Operational"" Customer Experience Management? Here's a video explainer: http://t.co/2Mn14buRWO",0,0,en,,,,,,,,
527532997390893056,2014-10-29 18:50:42,Thank you for joining today's webinar! The recording will be online soon. Don't forget to follow finance guru @brettking! #breakingbanks,0,0,en,,,,,,,,
527531992309854209,2014-10-29 18:46:42,Customer experience isn't the only thing changing in banking. Jobs are changing or disappearing entirely. #breakingbanks,0,0,en,,,,,,,,
527531072004059136,2014-10-29 18:43:03,"""Mobile notifications need to be highly contextualized and highly personal."" #breakingbanks @brettking",1,2,en,,,,,,,,
527530591965564928,2014-10-29 18:41:08,"In financial services, we're witnessing a shift to ""Service-Driven"" revenue models: http://t.co/QYxiWms5ec",0,2,en,,,,United States,US,"Daly City, CA",city,
527530050682634240,2014-10-29 18:38:59,"""People don't buy a mortgage, they buy a house. They don't buy a car loan, they buy a car."" @brettking #breakingbanks",3,2,en,,,,,,,,
527529357582299136,2014-10-29 18:36:14,"By 2016, bank customers will interact with their financial institutions on mobile (vs face-to-face) at a rate of 400-to-1! #breakingbanks",0,0,en,,,,,,,,
527528791934259200,2014-10-29 18:33:59,"In Europe, by 2016, customers are predicted to visit their bank branch only 1.3 times A YEAR! #breakingbanks",0,0,en,,,,,,,,
527528477537611776,2014-10-29 18:32:44,"Can your bank pass the toothbrush test? (Do you use it everyday, at least once a day?) @brettking #breakingbanks",1,0,en,,,,,,,,
527528306401632256,2014-10-29 18:32:03,"Financial services: ""The solution is not omni-channel."" @brettking #breakingbanks",0,0,en,,,,,,,,
527527943825002496,2014-10-29 18:30:37,"Sensors and embedded intelligence are increasingly surrounding us, and this data can revolutionize customer experience. #breakingbanks",0,0,en,,,,,,,,
527526694316687361,2014-10-29 18:25:39,The customers who like coming into your bank branch are a shrinking demographic. How will you engage w/ Gen Y? @brettking #breakingbanks,0,0,en,,,,,,,,
527524439148482560,2014-10-29 18:16:41,Have a financial services CX question for guru @brettking? Tweet at us using #breakingbanks!,1,0,en,,,,,,,,
527519549902823424,2014-10-29 17:57:16,Our financial services webinar with @brettking is about to begin! Join in at 11PST and use hashtag #breakingbanks! http://t.co/9U1NQxtxEa,1,0,en,,,,,,,,
527515863080255488,2014-10-29 17:42:37,"RT @Urszulai: This video shows how great brands like Nordstrom, Mercedes, and Verizon use Medallia to create AWESOME experiences. …http://t…",0,1,en,,,,,,,,
527515751885058048,2014-10-29 17:42:10,RT @Jaxx_Magee: You will hear a lot of tweets about @Medallia. This video should help you understand what we do! http://t.co/8wY3MinArk @Me…,0,1,en,,,,,,,,
527509111202926592,2014-10-29 17:15:47,Sign up for an upcoming webinar with Medallia's Senior Research Scientist. The topic? The revenue impact of CX: http://t.co/MCR2yixjm2,0,0,en,,,,,,,,
527237240792313856,2014-10-28 23:15:28,"Tomorrow, we'll be talking about customer experience in the financial services world: http://t.co/BrqH8GyujR",0,0,en,,,,,,,,
527207007829647360,2014-10-28 21:15:20,Ever wanted to explain Medallia to someone? We made this video to help you do it: http://t.co/ThNNEeFa8O,2,2,en,,,,,,,,
527176942735605760,2014-10-28 19:15:52,Our next Virtual Book Club will be LIVE tomorrow with author @brettking! Sign up here: http://t.co/VzczVoozUc,1,3,en,,,,,,,,
527146675245436930,2014-10-28 17:15:35,VIDEO: How to Create Experiences Customers Love - http://t.co/AjSYAcHwzX,1,0,en,,,,,,,,
527131357022265344,2014-10-28 16:14:43,RT @jccarcamo: Learn Hilton’s Secrets for Tripling Its Number of More-Than-Satisfied Customers http://t.co/vncZSOYVfS via @loyalty360,0,1,en,,,,,,,,
527131284343390208,2014-10-28 16:14:26,RT @cxco_ltd: The future of CX for the financial sector focuses on mobile and virtual interactions http://t.co/YcQFpUiR14 #loveyourcustomer,0,3,en,,,,,,,,
526844715870978048,2014-10-27 21:15:43,Searching for the link between customer experience and revenue? Join our upcoming webinar with @CXPA_Assoc! http://t.co/k9RSQUAziO,0,0,en,,,,,,,,
526828688449748992,2014-10-27 20:12:02,RT @CXPA_Assoc: Don't miss the @Medallia webinar 'The Link Between Customer Experience and Revenue' on November 4! http://t.co/JUZoqKODvj #…,0,7,en,,,,,,,,
526814476474277888,2014-10-27 19:15:33,Hate your bank? Send them an invite to our next webinar: http://t.co/jyRwvMUSxY,1,0,en,,,,,,,,
526784349820452865,2014-10-27 17:15:50,Hotels are finally using apps in ways that improve customer experiences: http://t.co/FD3CxP3CAi @ElaineGlusac,4,2,en,,,,,,,,
526773007277387776,2014-10-27 16:30:46,@_jase_clarke_ thank you for sharing this!,0,0,en,_jase_clarke_,2302172218,526128594008150016,,,,,
526772973714571264,2014-10-27 16:30:38,"RT @_jase_clarke_: Banking without Banks: The Rise of Mobile and the Death of the Local Branch
http://t.co/b1uYDqBEdC via @Medallia",0,18,en,,,,,,,,
526452036901277696,2014-10-26 19:15:21,Enter the Dragon: Teaching Young Ninjas to Code in the @CoderDojo http://t.co/O7WuETQ6gF,1,0,en,,,,,,,,
526089685257711616,2014-10-25 19:15:29,Secret Life of Medallians: Skydiving into a New Job - http://t.co/APA20IuTUa,0,0,en,,,,,,,,
525727475339653120,2014-10-24 19:16:12,"Welcome to Medallia. Now, jump out of this airplane: http://t.co/ck9HYBK8qg",0,0,en,,,,,,,,
525712320098746368,2014-10-24 18:15:59,Hate your bank? Send them this: http://t.co/WNkeSwt3ze,0,1,en,,,,,,,,
525697148957249536,2014-10-24 17:15:41,.@mdehaaff discusses our 2014 Hotel Social Media Report with @customer_report: http://t.co/YdDJmlN3fC,0,1,en,,,,,,,,
525682371291791361,2014-10-24 16:16:58,RT @brettking: I'm facilitating a free webinar on the future of banks for Medallia on the 29th of October - would love for you to j…http://…,0,5,en,,,,,,,,
525682349972127746,2014-10-24 16:16:53,@KestutisG thank you for sharing this!,0,0,en,KestutisG,123949156,525645983862882304,,,,,
525682226311467008,2014-10-24 16:16:24,RT @Lucky13Strat: Want good #business #video #content? We think @Medallia has it right. Hint: #Marketing should be fun. @apandya101 http://…,0,5,en,,,,,,,,
525410181782700034,2014-10-23 22:15:23,Hotel Apps Tailored to What a Guest Wants - http://t.co/GYYuMIkyR7 @ElaineGlusac,0,0,en,,,,,,,,
525365126380412928,2014-10-23 19:16:21,Why companies aren't getting the most out of their Voice of the Customer programs: http://t.co/vo8krqeJLd,0,0,en,,,,,,,,
525349978836045825,2014-10-23 18:16:10,Our next live webinar will focus on disruption in the financial services industry + the role of customer experience. http://t.co/gD3n7HurTE,1,2,en,,,,,,,,
525334712915861506,2014-10-23 17:15:30,Download our recent webinar with Forrester here: http://t.co/pYaMruwhfz,0,1,en,,,,,,,,
525047814649552896,2014-10-22 22:15:28,How @Hampton Inn wins with social media: http://t.co/CyLiu70juR,0,0,en,,,,,,,,
525038355583860737,2014-10-22 21:37:53,".@NewCoFest reading list: Carol Dweck's ""Mindset"" &amp; @claychristensen @DillonHBR and @Jamesallworth's ""How Will You Measure Your Life?""",1,1,en,,,,,,,,
525032739029139456,2014-10-22 21:15:34,How can traditional banks compete with mobile disruption? http://t.co/R1KQDYgpVh,0,0,en,,,,,,,,
525030903450701825,2014-10-22 21:08:16,We are about to kick-off our leg of @NewCoFest with speakers/Medallians @jamesallworth and Corey Barker! http://t.co/LrBUNf5ZFO,1,3,en,,,,,,,,
525028264998207489,2014-10-22 20:57:47,RT @MedalliaCareers: It's almost time! So thrilled to welcome @newcofesf attendees to HQ http://t.co/fe7ObtWXlK,0,1,en,,,,,,,,
525028173004541952,2014-10-22 20:57:25,RT @NewCoFest: *DING* Round 3 up next at the 2pm hour. Looking fwd to sessions from @myeatclub @groupon @Fundly @guidebook @medallia. #newc…,0,5,en,,,,,,,,
525002864897572864,2014-10-22 19:16:51,"When we onboard new employees, we challenge them to face a fear. These Medallians took it to the next level: http://t.co/hQ7zFe4smR",1,2,en,,,,,,,,
524972341634535424,2014-10-22 17:15:34,Banking without Banks: The Rise of Mobile and the Death of the Local Branch - http://t.co/btTBDKPvTM,0,0,en,,,,,,,,
524697790123737088,2014-10-21 23:04:36,RT @MedalliaCareers: We're opening our office up to @NewCoFest tomorrow and our slot is almost full! Will we see you at 2? http://t.co/xhvr…,0,2,en,,,,,,,,
524671243669471232,2014-10-21 21:19:07,RT @kerrybodine: My latest post ➔ 3 Ways That @Airbnb Fights Survey Fatigue http://t.co/Cz2SZ1quIU #VoC @Medallia #custexp #CX,0,5,en,,,,,,,,
524670304069894144,2014-10-21 21:15:23,"If your coworkers jumped out of a plane, would you do it? http://t.co/ZqVQKoyZsm",0,0,en,,,,,,,,
524640255061024768,2014-10-21 19:15:58,How to turn your customer experience program into your marketing engine: http://t.co/dN6bOQT9q0,0,1,en,,,,,,,,
524612385437667328,2014-10-21 17:25:14,Secret Life of Medallians: Skydiving into a New Job - http://t.co/yJQssHUCub,1,2,en,,,,,,,,
524608983735500800,2014-10-21 17:11:43,"RT @gbmoran: Medallia, Inc. is hiring! Tech &amp; absolutely amazing people. Reach out!
http://t.co/brztcReC8w #job",0,1,en,,,,,,,,
524608936864133120,2014-10-21 17:11:31,RT @benoite_tweets: 4 Reasons Car Dealers Should Care About Customer Experience http://t.co/i8xZREdPfE,0,1,en,,,,,,,,
524277824795181056,2014-10-20 19:15:48,Why aren't companies sharing customer feedback with customer-facing employees?! http://t.co/tpkesf8Nt4,0,0,en,,,,,,,,
524247565471334400,2014-10-20 17:15:34,Our VP of Marketing talks social media strategy: http://t.co/DfAFopO7z3,0,0,en,,,,,,,,
524233891746680836,2014-10-20 16:21:14,"RT @RingCentral: Check out this article by our President, @DaveBerman about keeping #customers happy via @Medallia http://t.co/3PKXUGuRtv",0,2,en,,,,,,,,
523583155358683136,2014-10-18 21:15:26,Our next LIVE Virtual Book Club will focus on customer experience in the financial services industry: http://t.co/GrpNXFLwew #CEM,0,0,en,,,,,,,,
523522740276711424,2014-10-18 17:15:22,.@Hampton Inn is killing it on social media: http://t.co/gkFV54Qq7K,0,0,en,,,,,,,,
523220767799250944,2014-10-17 21:15:26,Mercedes Benz CEO: Customer Experience is the New Marketing - http://t.co/cIbOcdvgnd,2,1,en,,,,,,,,
523190617393102849,2014-10-17 19:15:38,Our VP of Marketing talks social media strategy: http://t.co/rDd9kMysYX,2,0,en,,,,,,,,
523175432288346112,2014-10-17 18:15:17,How to take your Voice of the Customer program from the sidelines to the frontlines: http://t.co/ArHLilSIjt,0,0,en,,,,,,,,
523160441812705280,2014-10-17 17:15:43,"Whether or not you're a perfectionist, you shouldn't bring it up in a job interview: http://t.co/C4gYevo0sh",1,0,en,,,,,,,,
523145639400849408,2014-10-17 16:16:54,"RT @ppakalnietis: Listening to customers isn't enough, your entire organization must act to truly change experiences: http://t.co/KPL7cxDEOp",0,2,en,,,,,,,,
523145447452717057,2014-10-17 16:16:08,RT @MedalliaCareers: The Medallia biker club. #wemadethemposelikethat http://t.co/y7uNaf8H0k,0,1,en,,,,,,,,
522858378377576448,2014-10-16 21:15:26,Miss our webinar with Forrester on the Voice of the Customer? Catch up here: http://t.co/7WVZWwX4wa,1,0,en,,,,,,,,
522828251912470528,2014-10-16 19:15:43,Mercedes-Benz CEO: Customer Experience is the New Marketing: http://t.co/RwEpNU6JlJ,0,1,en,,,,,,,,
522813105999712257,2014-10-16 18:15:32,Learning to code before bedtime: http://t.co/LUW6467GJ5,0,0,en,,,,,,,,
522797947596341248,2014-10-16 17:15:18,Voice of the Customer: Listening Isn't Enough! http://t.co/gPtZelX4Uk,0,0,en,,,,,,,,
522783009259675651,2014-10-16 16:15:56,Our next LIVE Virtual Book Club will focus on customer experience in the financial services industry: http://t.co/nHsG6Se5QP #CEM,0,1,en,,,,,,,,
522496046325587969,2014-10-15 21:15:39,Medallia made @NewCoFest co-founder's top picks for companies to check out during the upcoming festival! http://t.co/gZCzAMP0kh,2,1,en,,,,,,,,
522470243374215168,2014-10-15 19:33:07,@AHershatter Thanks so much for joining us!,0,0,en,AHershatter,20554106,521785573741064194,,,,,
522469985172852736,2014-10-15 19:32:06,RT @PJChancelier: Sephora Boosts Customer Loyalty Program with Medallia #CEM #VoC #CustomerFeedback #Loyalty #Satisfaction http://t.co/Hhgb…,0,1,en,,,,,,,,
522465862545334273,2014-10-15 19:15:43,Share this post with your local car dealership: http://t.co/NGIvoNT2Fl,0,0,en,,,,,,,,
522450728045277184,2014-10-15 18:15:34,The One Answer You Should Never Give in an Interview: http://t.co/AGSwbmTwWA @JoshBudway,0,0,en,,,,,,,,
522435697656209408,2014-10-15 17:15:51,12 Entrepreneurs Share the Best Advice They Received from a Teacher: http://t.co/U3VCseG4px,0,0,en,,,,,,,,
522420552351621122,2014-10-15 16:15:40,What our engineers are up to after work: http://t.co/b9xGy4Eyo7,1,0,en,,,,,,,,
522133584367591425,2014-10-14 21:15:21,Medallia's engineers are helping mentor the next generation of coders: http://t.co/rDctrTrzxF,0,2,en,,,,,,,,
522118540103782400,2014-10-14 20:15:35,The financial services industry is ripe for disruption. Nobody knows that better than @brettking: http://t.co/euHEBb13W5,2,2,en,,,,,,,,
522109736418693120,2014-10-14 19:40:36,RT @erinraese: Mercedes Benz CEO: Customer Experience is the New Marketing - http://t.co/gxGBjsmYls #automotive #transportation #cem,0,10,en,,,,,,,,
522103446514991104,2014-10-14 19:15:36,You're invited to Medallia HQ in Palo Alto! http://t.co/hxP9gtE7VB,1,0,en,,,,,,,,
522095884100960256,2014-10-14 18:45:33,Our co-founder and president shares the best advice she ever received from a teacher with @FastCompany: http://t.co/QgcSjPWCJ0,1,3,en,,,,,,,,
522083986043314176,2014-10-14 17:58:16,Secret Life of Medallians: Mentoring Young Samurai in the @CoderDojo - http://t.co/xyThkrrVPV,0,1,en,,,,,,,,
522075236867391489,2014-10-14 17:23:30,RT @SmartBrief: Social marketing success begins with a strategy http://t.co/rocfgh2LQ0 via @SBoSM,0,2,en,,,,,,,,
522075068055420928,2014-10-14 17:22:50,RT @pounehl: .#SocialMedia insights shape strategy 4 success - Expert advice from @mdehaff http://t.co/GWZVG5voRo via @SBoSM @medallia #cus…,0,2,en,,,,,,,,
522052223811870721,2014-10-14 15:52:04,RT @judgewebb: CE reigns again! Brands Can Drive Growth And Retention By Addressing Silent Complaints http://t.co/84imO1v449 @medallia #cus…,0,1,en,,,,,,,,
521771263631822848,2014-10-13 21:15:37,Want to know what a day in the life of Medallia is like? Sign-up for our @NewCoFest open house! http://t.co/lRUQjrMPGk,1,0,en,,,,,,,,
521745945122201601,2014-10-13 19:35:01,"RT @johnbattelle: #NewCoSV almost full, but we clear waitlists daily. GO OUT TO GET IN! @newcofest @ScienceExchange @Medallia @WePay @Duart…",0,3,en,,,,,,,,
521741080682049536,2014-10-13 19:15:41,4 ways car dealerships can take their customer experiences into the 21st century: http://t.co/NTQrURNJ3c,1,0,en,,,,,,,,
521725944357453824,2014-10-13 18:15:33,"Thanks for picking Medallia, @johnbattelle! @NewCoFest http://t.co/E7Sgp3cbeu",0,0,en,,,,,,,,
521710849086738433,2014-10-13 17:15:34,Looking for a job that will launch your career in tech? These companies are a good place to start: http://t.co/MFGxdGl8UO,0,0,en,,,,,,,,
521695846644326402,2014-10-13 16:15:57,"Join our next Virtual Book Club and meet the author of ""Bank 3.0"" @brettking! http://t.co/prBJrDY32R",1,1,en,,,,,,,,
521694555926953984,2014-10-13 16:10:49,RT @NewCoFest: Ever wonder how many hours @Medallia spends on on-boarding?! You can ask them at #newcoSV but also read this! http://t.co/EZ…,0,2,en,,,,,,,,
521694445930942464,2014-10-13 16:10:23,RT @billyenvivo: Thrilled @Medallia &amp; @MedalliaCareers will be joining the @BerkeleyHaas @playconference this year!! Get your tix http://t.…,0,1,en,,,,,,,,
521694295217438720,2014-10-13 16:09:47,RT @_jase_clarke_: 3 Steps Toward the Future of Customer Experience http://t.co/NESMgPIzRE via @Medallia #CX,0,1,en,,,,,,,,
521694253110820866,2014-10-13 16:09:37,RT @joshbudway: Join us at @NewCoFest on 10/22 and see inside @Medallia and @MedalliaCareers.  On the hot list of who to see http://t.co/bt…,0,3,en,,,,,,,,
521408790772842496,2014-10-12 21:15:17,Mercedes-Benz CEO: Customer Experience is the New Marketing: http://t.co/I06bt3lwVZ,2,1,en,,,,,,,,
521378615276367872,2014-10-12 19:15:23,"We made @Wealthfront's list of ""107 Career Launching Technology Companies"" !! http://t.co/pN6ShJsJxh",1,0,en,,,,,,,,
521016249422446593,2014-10-11 19:15:28,Our company is in some good company here: http://t.co/vIMlieqcDI @MedalliaCareers,3,3,en,,,,,,,,
521001079937708032,2014-10-11 18:15:11,The One Answer You Should Never Give in an Interview: http://t.co/y5YWjqWe8S,0,0,en,,,,,,,,
520986024940666881,2014-10-11 17:15:22,Our co-founder and president shares the best advice she ever received from a teacher with @FastCompany: http://t.co/HVTQ1hwbrv,1,2,en,,,,,,,,
520684036940124161,2014-10-10 21:15:22,What was your last car buying experience like? http://t.co/3PqOt0EsjX,3,1,en,,,,,,,,
520653846973255680,2014-10-10 19:15:25,Medallia made @NewCoFest co-founder's top picks for companies to check out during the upcoming festival! http://t.co/Hjn4S8qXV1,0,0,en,,,,,,,,
520647831741542400,2014-10-10 18:51:30,@jcaplain thanks for sharing this!,1,0,en,jcaplain,17669682,520599525573275649,,,,,
520647779996434432,2014-10-10 18:51:18,RT @jcaplain: How to hire a great engineering manager http://t.co/fNsC7vyvFI,0,1,en,,,,,,,,
520647624526163968,2014-10-10 18:50:41,RT @JohnRidgeway: #FF Nice job this week @BrandLoveCxP @BenSmithwell @DougSohn @Medallia @LotusOak Keep the conversation going everyone. #F…,0,2,en,,,,,,,,
520638764331577345,2014-10-10 18:15:29,Come hang out with us at Medallia HQ! http://t.co/sIeyVTvMdh,0,0,en,,,,,,,,
520623673825570816,2014-10-10 17:15:31,"We made @Wealthfront's list of ""107 Career Launching Technology Companies"" !! http://t.co/mvTjE4NPpQ",1,0,en,,,,,,,,
