id,created_at,text,favorites,retweets,lang,in_reply_to_user,in_reply_to_user_id,in_reply_to_status_id,country,country_code,place_name,place_type,coordinates
19019046798,2010-07-20 20:05:36,闺秀的气质: 我一直记得陈丹燕谈唐诗宋词的口气，不是不敬，也不是不屑，而是疏离，就像对一个父执辈的长者。她五十年代出生，长于文革，中国国学的根系，自从五四被风卷残云之后，到文革，大概连地下球茎都给摧枯拉朽了。之后，[阅读全文]© 途加.  http://bit.ly/b0TjH0,0,0,zh,,,,,,,,
19019045817,2010-07-20 20:05:35,格雷厄姆・格林和信仰: 刘溪“我染上了信仰，就像染上了病一样。”――Sarah The End Of The Affair近来无事，碌碌终日。过冬。吃喝睡，变肥婆。所写皆断章。幸有朋友可爱，所见皆亲。于是一如往[阅读全文]© 途加.  http://bit.ly/ciItR3,0,0,zh,,,,,,,,
19019044689,2010-07-20 20:05:33,不要快，要稳: 一今天下午碰到写《哈佛经济学笔记》的陈晋，说到一个故事。说DDT当年是消灭蚊虫的，减少传播致命的疟疾。Rachel Carson在1962年出《寂静的春天》，说鸟语花香在几十年后因为环境恶化不[阅读全文]© 途加.  http://bit.ly/bsdx7c,0,0,zh,,,,,,,,
19019043054,2010-07-20 20:05:32,6种，我们不知道的历史: 实际上我们所知的历史已经是过滤之后的，不客气的说已经全都是Bullshit 了我们通过历史书、历史画册了解到了许许多多关于地球之前之前的事情。但是实际上这上面还是有很多错误，并且由于好莱坞奇幻电影[阅读... http://bit.ly/cCsvi7,0,0,zh,,,,,,,,
18939429690,2010-07-19 19:44:23,世界仔: 世界仔是香港的俗语，用来评说年轻人做人处事十分圆滑. 话头醒尾、懂得为自己寻找机遇，比如当年王晶说刘德华，周星驰说张柏芝，年纪轻处世已经这么老辣，所以捞世界，打天下，不在话下，在我的理解里世界仔就是全[阅读全文]© 途加.  http://bit.ly/9ypdk5,0,0,zh,,,,,,,,
18939428572,2010-07-19 19:44:22,蒋介石最大的过是剿匪不力: 《找寻真实的蒋介石2》　　作者：杨天石　　4月份的时候，在杨天石先生赴美查阅《蒋介石日记》最后一部分之前，我邀杨先生在国家图书馆做了一次讲座，题目是《蒋介石日记和蒋介石其人》。　　那天[阅读全文]© 途加.  http://bit.ly/dw6w3E,0,0,zh,,,,,,,,
18939426512,2010-07-19 19:44:19,我们为什么不认错: 认错曾经要资格　　不知从什么时候开始，认错这事，越来越难了。而且，越是地位高、名气大、粉丝多，就越难。要么矢口否认，要么一声不吭，要么倒打一耙，要么把水搅混，甚至把质疑他的人统统说成是“文化杀手”[阅读全文]... http://bit.ly/b1tlfC,0,0,zh,,,,,,,,
18939425358,2010-07-19 19:44:18,谈一场木本爱情，需要以德服妞: 魔幻现实主义的经典开头是：多年以后，奥雷连诺上校站在行刑队面前，准会想起父亲带他去参观冰块的那个遥远的下午。而港式市民幽默的经典开头是：多年以后，张志明蹲在自家卫生间的马桶边，准会想起余春娇爱恨交... http://bit.ly/dtTLu8,0,0,zh,,,,,,,,
18939423600,2010-07-19 19:44:16,6种科学是否能修复女性的高潮: 是否存在一个合理的解释，那就是为什么女性无法在ooxx过程中出现持续的高潮（虽然她们有多重高潮）？我们能否寻找到一种药丸、补丁、药膏或者不管是什么，能够帮助女性与男性在高潮来临时间更加同步与连贯呢... http://bit.ly/9LErlK,0,0,zh,,,,,,,,
18853291951,2010-07-18 17:22:17,李红豪作文《草见人命》原文: 华中师大一附中学生李红豪因在自己的一篇《草见人命》的文章激烈的抨击中国的政治体制，教育制度等，在网络上而迅速走红，并在各大媒体上被头条报道。在此，我们提供了李红豪因《草见人命》的全文，以飨感兴趣的网... http://bit.ly/bmZdXM,0,0,zh,,,,,,,,
18853291015,2010-07-18 17:22:16,《经济史的趣味》书摘: 最近，我读完了（台湾）赖建诚教授的《经济史的趣味》一书。它是一本通俗读物，就像书名所说，确实有不少好玩的内容，我做了一些摘录。2009年，浙江大学出版社曾经出过简体字删节版。但是，你完全不[阅读全文]© 途加.  http://bit.ly/cYpaw3,0,0,zh,,,,,,,,
18853290118,2010-07-18 17:22:14,Nothing Compares 2 U: 文/赵南坊2009年，当看到苏格兰大妈Susan Boyle在台上唱歌时，我以为这将是我这生唯一一次看到大妈级别的歌手演出。昨天，我第二次看到了“大妈”。苏州活力岛音乐节，Sinéad... http://bit.ly/bsE0Ij,0,0,zh,,,,,,,,
18853288847,2010-07-18 17:22:13,长生不老想死不能的重生男人: 看海报的时候我没有多大兴趣，裘德洛，爱看，科幻，不爱看，裘德洛演科幻，可看可不看，结果找不着合适的片子，就将就看了，结果还不错，就是有点重口味，未成年以及心脏不健全者慎入。事情是酱紫的，在不远的未来... http://bit.ly/cTyx9t,0,0,zh,,,,,,,,
18853287710,2010-07-18 17:22:12,拧巴的俄罗斯心态: 文/古尔齐亚俄罗斯电影《黑色闪电》在本国大卖，我猜是俄罗斯人的民族自尊心与自豪感在作祟，觉得俄罗斯人终于可以在经历了几十年的困顿之后，拍出这样一部集合了所有好莱坞元素的电影：飙车、黑帮、神秘元素[阅读全文]© 途加.  http://bit.ly/cZiVHS,0,0,zh,,,,,,,,
18787928521,2010-07-17 19:50:11,金银是炮弹，文艺是糖衣: 卡佛有名言说：一个男人在这个时代就应该轻薄与严肃二者兼备。这话对所有男人都合适。他还说，不工作的人时间充裕，因此就会有太多的时间沉溺于自己和自己的烦恼中。这句话应该说的就是唧唧歪歪恶心不拉拉的穷酸文青[... http://bit.ly/buVOW9,0,0,zh,,,,,,,,
18711235253,2010-07-16 19:44:23,做到这23条，你就成熟了: 1、 遇到不想回答的问题 ：直视对方的眼睛 ，微笑、 沉默 。2 、走路抬头挺胸 。心情不好时 ，不想跟人招呼， 点头微笑， 径直走过 。3 、请记得 ：好朋友的定义是， 你混的好 ，他打心眼[阅读全... http://bit.ly/cy0baT,0,0,zh,,,,,,,,
18711234260,2010-07-16 19:44:22,三国杀价值体系理论———只写给三国杀高手的攻略: 最近一段时间，三国杀风靡各大高校，我亦深深沉迷其中。因此转载我的同学SF神牛的关于三国杀的一篇神作，跟大家分享一下…三国杀价值体系理论————只写给三国杀高手的攻略如果你懂得先拆... http://bit.ly/cr7xwY,0,0,zh,,,,,,,,
18711233163,2010-07-16 19:44:21,古罗马式的优雅: 今天看到有人推荐一个相册，名字叫古罗马式优雅——弗兰，这个标题让我觉得有点雷。因为无论从哪个层次上，我都很难想象罗马和优雅这两个词能联系在一起。如果说是拉丁的话，考虑到近代意大利和法国的倾向，说不定还[阅读全文... http://bit.ly/c7396B,0,0,zh,,,,,,,,
18711232184,2010-07-16 19:44:20,国外的惩罚方式有多巧妙？: 在西班牙安达卢西亚省的首府格拉纳达，有个叫埃米利奥·卡拉塔尤德的人，自1988年以来一直担任未成年人法庭的法官，他为自己确定的目标是给那些出入他办公地点的人们提供第二次机会。凭这点，就知道他是一位有良... http://bit.ly/a92Sz3,0,0,zh,,,,,,,,
18711231123,2010-07-16 19:44:19,慕容复: 金庸小说可谓是一部部的励志史，所有主人公最后都获得了至高无上的武功以及社会地位。即便是不学无术的韦小宝，也是身居高位，家财万贯，武学上也算一朵奇葩：天下第一逃命高手。但金庸笔下除了这些成功的主人公以外[阅读全文]© 途加.  http://bit.ly/anJoVE,0,0,zh,,,,,,,,
18618586888,2010-07-15 17:28:31,送优柔寡断和胡思乱想的人: 1.不要在流泪的时候做任何决定，情绪负面的时候说话越少越好。 2.不要去反复思考同一个问题，不要把所有的感情都放在一个人身上，你还有父母，还有其他朋友。3.不要害怕做错什么，即使错了，也不必懊恼，人[... http://bit.ly/drHeP9,0,0,zh,,,,,,,,
18618585146,2010-07-15 17:28:29,“历史当会给我做证明”——《从龚自珍到司徒雷登》: “历史当会给我做证明” ——《从龚自珍到司徒雷登》 后记傅国涌    我深知，对中国人来说，历史就是我们的宗教，中国人缺乏宗教，缺少外在超越的信仰，可是，中国人不缺乏道德的坚守... http://bit.ly/9Xe9Yy,0,0,zh,,,,,,,,
18618584014,2010-07-15 17:28:28,美国足球告诉了中国什么？: 这次世界杯，日韩两大邻居以杰出的表现昂然出线，建立了东亚足球对欧洲列强的信心。中国则只能顾影自怜。没有资格参与固然令人遗憾。但只要看热闹时能看出门道来，日后说不定也能有风光的机会。这次最值得[阅读全文... http://bit.ly/cclJtJ,0,0,zh,,,,,,,,
18618582750,2010-07-15 17:28:27,中国人为什么丧失了慢的能力？: 急之国　　中国人，赶时间。　　最爱“快进”，狂点“刷新”。评论，要抢“沙发”。寄信，最好是特快专递。拍照，最好是立等可取。坐车，最好是高速公路、高速铁路、磁悬浮。坐飞机，最好是直航。做事，最好[阅... http://bit.ly/cmgMfz,0,0,zh,,,,,,,,
18618580239,2010-07-15 17:28:24,感谢田原，让我们冷冻一夏: 文/赵南坊造型帝，田原个人首张专辑的封面照足可以让人欣赏一个月，太萌了。最近华语女歌手专辑以萌照做封面的还有莫文蔚的《宝贝&Good Bye》，刘若英的《在一起》，郁可唯的《蓝短裤》。所[阅读全文]© 途加.  http://bit.ly/b0156K,0,0,zh,,,,,,,,
18539057279,2010-07-14 18:21:23,25件我们可以拥有的“免费奢侈品”，你有多少？: 《蜗居》里面，宋思明说：“可以用钱解决的问题，也就不是问题了”。　　确实如此，但是人的一生中，最奢侈的东西并不是拥有很多的财富就能同时拥有的。　　相反，懂得去欣赏、去发现生命中能... http://bit.ly/95runV,0,1,zh,,,,,,,,
18537655366,2010-07-14 17:58:54,佛学大师告诉你哪些人不能成功: 人生在世，莫不希望自己建功立业；不一定要功勋盖世，至少能留下立言、立功、立德的“三不朽”事业。人人都希望有功于社会乡里，可惜很多人求功好利，往往适得其反，功败垂成。那么，哪些人不能成功呢?[阅读全... http://bit.ly/9Udan1,0,1,zh,,,,,,,,
18537654032,2010-07-14 17:58:52,"Taste.ly,10个短句和老外聊葡萄酒: 我们常常会去一些老外和葡萄酒共存的社交场合，比如公司宴请、私人Party等等。与老外聊天，该如何打开话闸？据我个人观察，我们手中的那一杯葡萄酒是个很开门见山的话题。但是，要和老外聊葡... http://bit.ly/9oHBp3",0,0,zh,,,,,,,,
18537645572,2010-07-14 17:58:44,我被办公室恋情受尽了折磨！: “夜已深，身边的他酣然入睡，我却怎么也睡不着。我悄悄下床，拿起他的手机和皮包，来到客厅，像做贼似的翻看起来。其实我也不想这样做，如果真的 查出问题，我不知道如何面对。可是，这段时间我太压抑了，那个所... http://bit.ly/amnljN,0,0,zh,,,,,,,,
18537643783,2010-07-14 17:58:42,有了男人，你应该还有死党: 人是情感动物，天生对感情有一种需求和渴望。在马斯洛的需求层次理论里，人在满足了生理需要、安全需要等基本的生存需求之后，马上就会寻求情感和归属感的满足，如果这种需要不能满足的话，就会带来各种各样的问题[... http://bit.ly/c45fEF,0,0,zh,,,,,,,,
18453749272,2010-07-13 17:33:38,校长改说流行语，然后呢？: “不要迷信哥，哥只是个传说。”当北大校长周其凤在研究生毕业典礼上说出这句话时，看台上响起欢呼声，而我只能有些无奈地摇摇头。如果引用网络流行语是“凤哥”的首创，我绝对会为他击掌叫好。可惜，前面已[阅读全... http://bit.ly/dfegzE,0,0,zh,,,,,,,,
18453746763,2010-07-13 17:33:36,《明朝那些事儿》经典语录: 1.风萧萧兮易水寒，欠了债兮你要还。　　2.必须亮出自己的獠牙，才能有效地控制住所有的人，即使是皇帝也不例外。　　3.观点斗争是假的、方向斗争也是假的，只有权力斗争才是真的。　　4.其次，[阅读全文]... http://bit.ly/bKP7hd,0,0,zh,,,,,,,,
18453744654,2010-07-13 17:33:34,还原一个真实的唐骏: 艰难求学的海外学子；成功的微软全球技术支持中心管理者；跨国公司内斗的牺牲品； “知名度就是生产力”的信徒和践行者 　　《新世纪》周刊 记者 王姗姗　　“他不是一个一辈子靠骗人吃饭的人，但后来，特[阅读全文]... http://bit.ly/aP63OR,0,0,zh,,,,,,,,
18453743359,2010-07-13 17:33:33,车震10注意事项: 虽然我们并不提倡这个，但如果你新买了一辆好车，又找到了一个漂亮的女友，正对此跃跃欲试的话。那么，本着疏堵结合方式，我们还是给10个建议，只有做好这些才能万无一失，安全且安心的车震起来。1.野[阅读全文]© 途加.  http://bit.ly/cdAGOc,0,0,zh,,,,,,,,
18453741871,2010-07-13 17:33:31,Jakub Julian Ziolkowski，太牛逼了: 波兰人，1980年出生，我觉得非常富有象征主义。继续完全抛弃了形似，很看好这个画家。Jakub Julian Ziolkowski（1980年出生于波兰扎莫希奇）在Ja... http://bit.ly/9cZnhQ,0,0,zh,,,,,,,,
18386499635,2010-07-12 22:21:59,"你有“职业倦怠症”吗？教你自救指南: 职业倦怠症“又称”职业枯竭症“,它是一种由工作引发的心理枯竭现象,是上班族在工作的重压之下所体验到的身心俱疲、能量被耗尽的感觉,这和肉体的疲倦劳累是不一样的,而是缘自心理的疲乏。如何克服这种... http://bit.ly/bcLZCa",0,0,zh,,,,,,,,
18386498412,2010-07-12 22:21:58,没有人只靠“从众”而成功: 投资界的传奇人物，国际著名投资大师，巴菲特评价其“对市场大趋势的把握无人能及”。罗杰斯1942年出生于美国亚拉巴马州，5岁开始做第一笔生意 赚钱（在棒球场捡瓶子卖钱）。获得奖学金上耶鲁大学， 毕业后，... http://bit.ly/9HjMVV,0,0,zh,,,,,,,,
18386497083,2010-07-12 22:21:57,文学作品的非文学功用: 时下正值暑假，正是读书好时节，那么读什么书呢？用句高考作文题上的话来说，应该仰望星空也要脚踏实地。盖瑞森·凯乐说过一句话，他60多岁了，人生苦短，他决定戒掉一些不良嗜好，其中之一，是看俄罗斯小说。不过[阅... http://bit.ly/9a2pUj,0,0,zh,,,,,,,,
18386495736,2010-07-12 22:21:56,"韩寒,对人生，我没有绝望过（上）: 如果一个人在2000年时读过《三重门》，那么他知道韩寒是“退学生”、“新概念作文大赛”冠军；如果一个人经常上网，那他应该看过韩寒的博客，知道韩寒讽刺“钓鱼”执法、路牌设置，甚至还入选“《时代》... http://bit.ly/cMUYwM",0,0,zh,,,,,,,,
18371402881,2010-07-12 17:53:16,揭秘男人为何喜欢恋爱而不喜欢结婚？: 婚姻对于男女双方有着不同的意义，对于女人来说，婚姻就是人生的赌注，将来生活的好与坏，就看她选择的婚姻是否正确;而对于男人来说，婚姻就是一份责任，他要负责女人的幸福和未来孩子的成长。正是由于这... http://bit.ly/cetUJT,0,0,zh,,,,,,,,
18371401680,2010-07-12 17:53:14,"大家都来测测吧,你的爱情寿命有多长: 甜蜜的爱情总叫人向往，不过美好的开始是否代表有完美的结局呢？下面故事的主角是面包先生和草莓小姐，请试着为他们度身编写爱情故事，最后你便可知道自己的爱情可维持多久！ 　　面包先生决定鼓起勇气向... http://bit.ly/aUGWyb",0,0,zh,,,,,,,,
18371400458,2010-07-12 17:53:13,来自法国的康菲德迷你小果酱！: 前段时间去杭州玩，带了康菲德的迷你小果酱吃早餐。照片正好被在法国出差的朋友小爵看到。她惊讶的发现她酒店里提供的小瓶果酱和我们一模一样的。而事实上，康菲德就是来自法国啊~ 我和小爵说这个迷你版的有好... http://bit.ly/99umbM,0,0,zh,,,,,,,,
18371399353,2010-07-12 17:53:12,女人在外企工作的体会: 首先想说的是，我是一个平凡的在深圳打工的女人。在这里只是想通过我从毕业到现在9年的打工生活和与我类似经历的年轻人一起分享。在现在的经济危机时期，很多人都还在找工作，很多人还在庆幸自己可以保的住饭碗，但[阅... http://bit.ly/cz9EXG,0,0,zh,,,,,,,,
18371398198,2010-07-12 17:53:11,"HR口述,职场上12条绝对禁忌,给未来入职的你: 我的一位大学同学少年老成、沉稳持重，后来做了政府官员，曾说：“我每去一个地方，先找后门和厕所，找到后路我就放心了。-------说职场言语，不可随心所欲。家是避风的港湾，可以直接... http://bit.ly/bitU9q",0,0,zh,,,,,,,,
18284604955,2010-07-11 17:05:35,"明末军事史悖论,论李成梁和戚继光: 说起明朝后期的军事史，不 能不提两个著名将领，那就是戚继光和李成梁。戚继光是抗击倭寇的民族英雄，自不待言。李成梁（1526-1615）是明朝 后期的辽东总 兵。在隆庆、万历年间，李守辽东，戚戍... http://bit.ly/aiPrRe",0,0,zh,,,,,,,,
18284603831,2010-07-11 17:05:34,口口相传，成就普利策奖黑马: 口口相传，成就普利策奖黑马张 芸　　《修补匠》（Tinkers）　　保罗・哈丁（Paul Harding）　　贝尔维文学出版社　　2009年1月出版　　　　《修补匠》（Tink[阅读全文]© 途加.  http://bit.ly/aatERq,0,0,zh,,,,,,,,
18284602603,2010-07-11 17:05:33,小说死亡论再掀波澜: 小说死亡论再掀波澜 康慨　　在文学界和出版界，“小说死亡”尚属敏感词，可以私下那个啥，但不能公开说出来，更不能大张旗鼓、斩钉截铁地说。 　　偏偏有人说了。美国新锐评论家李・西格尔（Lee[阅读全文]© 途加.  http://bit.ly/agLoZ7,0,1,zh,,,,,,,,
18284600920,2010-07-11 17:05:31,时光没有机: 满城现在都能看见周杰伦的演唱会海报了，是的，他又要来开演唱会了，我一恍惚，这不还是五六年前那个哼哼造型吗，不知道还以为在灯箱里放了多少年没换了，还是那身金甲战衣，还是那个有强直性脊柱炎的面无表情的周杰[阅读全文]© 途加.  http://bit.ly/aIB9n4,0,1,zh,,,,,,,,
18284599166,2010-07-11 17:05:30,警惕！“笨蛋时代”来临: 就在前不久，我的家人因为热播的相亲节目“非诚勿扰”引发争论。一方认为，参加节目的人都是真心实意的，二十四位女嘉宾的一言一行，都是真情流露；而另一方则认为，所有的一切都是在演戏，从对白到结果，都是经过精[... http://bit.ly/bG0sEn,0,1,zh,,,,,,,,
18135215442,2010-07-09 17:33:26,"你不是1986和1987，你不懂的。: 献给1986,1987年出生的人花开无声，岁月无痕。我们这一辈，也就是93年开始上小学，99年上初中，02年上高中，05年上大学的，08.09年毕业的，终于要和年少轻狂说拜拜了，有些不舍，... http://bit.ly/bYDqei",0,0,zh,,,,,,,,
18135213902,2010-07-09 17:33:25,80后北漂谈谈在中关村创业的经验: 像很多同龄人一样，我在大学毕业后即加入了找工作的大军中，在很多同学选择南下的时候，我选择了北漂，因为我始终坚信对于计算机专业的人来说，北京的中关村是圣地!　　创业经验分享：学会维护好自己身边的... http://bit.ly/bwCZwr,0,0,zh,,,,,,,,
18135212687,2010-07-09 17:33:24,"留学,继婚姻之后的“第二围城”: 留学围城　　“在国内的人天天想着出国留洋，而在国外的留学生却梦想着回故乡。很多留学生像是站在围城的城墙上，看看城里，再看看城外，却不知道哪里是自己的家。每日，徘徊在城墙上，忧虑，伤感……”如今[... http://bit.ly/9Rv0iX",0,0,zh,,,,,,,,
18135210813,2010-07-09 17:33:22,日本镜中行: 一面照见日本的多棱镜 周鸣之德国导演维姆·文德斯在日本电影大师小津安二郎离世二十年后来到东京，寻访小津影像中那个谦恭、温情、略带感伤的日本。然而，在小津的的墓前，他仅寻得一个“无”字。“无”究[阅读全文]© 途加.  http://bit.ly/9HdY0t,0,0,zh,,,,,,,,
18135206210,2010-07-09 17:33:18,萨拉马戈的隐喻人生: 历史上有那么一个时期，上帝和他的门徒是唯一的叙事者。故事只有经由他们的讲述，我们才认为是真实的。现代世界之后，理性主义和科学剥夺了神性的叙事者，所有故事的作者都是凡人，他们的故事也不再被看作是真实的。[阅读... http://bit.ly/dqhLFu,0,0,zh,,,,,,,,
18050381427,2010-07-08 17:25:32,升职加薪就一定是好事吗?华尔街华人的升职陷阱: 我在华尔街前后干了十五、六年，在多家投行待过，有美国、瑞士的，还有加拿大的。尽管每个公司都分属不同的国家，可有意思的是只要在华尔街，企业文化大同小异。进到办公楼一看，谁是什么级别一... http://bit.ly/aHBb61,0,0,zh,,,,,,,,
18050377205,2010-07-08 17:25:28,职场中这些话无论如何不能说: 在职场上生活，就像武侠中形容的“江湖”一样，到处是明枪暗箭刀光剑影。即使平时同事相处非常融洽，但请你要在聊天的时候管好自己的嘴巴，不然就很容易“祸从口出”。说话不经大脑，是直率的表现，但是在职场，也... http://bit.ly/9WGKrz,0,0,zh,,,,,,,,
18050375881,2010-07-08 17:25:27,韩寒小说《我想和这个世界谈谈》: 空气越来越差，我必须上路了。我开着一台1988年出厂的旅行车，在说不清是迷雾还是毒气的夜色里拐上了318国道。这台旅行车是米色的，但是所有的女人都说，哇，奶色。1988早就应该报废了，我以买废铁... http://bit.ly/cbwivm,0,0,zh,,,,,,,,
18050374503,2010-07-08 17:25:26,为什么文凭打不倒唐骏: 和菜头这几天在唐骏博士文凭上的纠缠实在是一件可悲的事情，因为这个细节实在是无关大局。唐骏究竟是美国西太平洋大学的博士，还是加州理工大学的计算机系博士，本来不应该是问题的焦点。问题的焦点在于：为什[阅读全文... http://bit.ly/cPHVW6,0,0,zh,,,,,,,,
18050372367,2010-07-08 17:25:24,中国的谎言教育: 从我睁着眼睛看世界开始，到我上大学——小学，中学和高中，学校里天天告诉我：世界上还有三分之二的劳动人民受资本家剥削，他们生活得水深火热，特别是美国人民吃不饱穿不暖。而中国人民是世界上最幸福的人，因为天[阅读全文... http://bit.ly/aCJH9X,0,0,zh,,,,,,,,
17966441492,2010-07-07 17:41:19,"西木1984,谭嗣同的殉道精神: 1898年，随着六颗人头的落地，轰轰烈烈的戊戌变法划上了一个惨烈的句号，康梁流亡，所有与新政有关的人，不是被罢官，就是被流放，成了近代中国史上一件不忍触碰的伤痛往事。尤其是“戊戌六君子”横死菜市... http://bit.ly/cOfk2n",0,0,zh,,,,,,,,
17966439972,2010-07-07 17:41:17,告诉你一个真实的朝鲜: 图们江是中朝边境的一部分，左边是中国的图们市，右边是朝鲜的南阳镇。这座铁路桥是中国的援助和货物运往朝鲜的主要通道。中国延吉—— 像许多朝鲜人一样，眼前的这位建筑工人一直生活在贫困之中。雇用他的国有[阅读全... http://bit.ly/aD7fkp,0,0,zh,,,,,,,,
17966437747,2010-07-07 17:41:15,萝莉塔的优势悖论: 文/纳兰铮小鸟依人的大学学妹萝莉塔，上周末在GTALK上哭诉：刚刚结束一段关系，伤筋动骨到不堪回首。热爱厨艺打理家庭本是她的标签，对方也是喜欢男耕女织的传统类型。这段感情看上去很和谐，只是光景[阅读全文]© 途加.  http://bit.ly/dwmLkH,0,0,zh,,,,,,,,
17966434334,2010-07-07 17:41:12,N种科技让钢铁侠已经变成了现实。: 钢铁侠2火热上线，讲述了一个科学天才使用飞行盔甲拯救人类的故事。而在现实生活中，虽然我们还没有达到钢铁侠那么酷的科学技术，但也实现一些足够让你惊讶的科技。看看下面介绍的这几个技术，他们能帮助人... http://bit.ly/bydYF9,0,0,zh,,,,,,,,
17966432781,2010-07-07 17:41:11,完全解析《机器人艺妓》: 文/帮主胡子《机器人艺妓（ロボゲイシャROBO GEISHA）》堪称日本新一代的Cult片大典范，完全按照当年大片儿的套路走。此片的导演为井口昇，这是一个不为大众所熟知的日本导演，如果喜欢日本[阅读全文... http://bit.ly/bzJou7,0,0,ja,,,,,,,,
17902882613,2010-07-06 23:05:14,什么工作能成为事业: “激情像浆糊一样，可让你在艰难困苦的场合里紧紧地把自己粘在这里，坚持到底。它是在别人说你‘不行’时，能在内心里发出‘我行’的有力声音。”——拉夫尔·爱默生布拉格作家弗朗茨•卡夫卡（Franz Ka[阅读全文... http://bit.ly/ajbijX,0,0,zh,,,,,,,,
