id,created_at,text,favorites,retweets,lang,in_reply_to_user,in_reply_to_user_id,in_reply_to_status_id,country,country_code,place_name,place_type,coordinates
70171008719527936,2011-05-16 16:57:26,"贺卫方,文革爆发四十五周年: 1966年5月16日，中共中央发布由陈伯达、康生、江青和张春桥等人起草、毛泽东亲自修改的一份通知，宣布撤销同年2月12日批转的《文化革命五人小组关于当前学术讨论的汇报提纲》，吹响了全面开始文化大... http://bit.ly/iH6JTB",0,0,zh,,,,,,,,
70171007536730112,2011-05-16 16:57:26,沉默不是金: 刘瑜 　　沉默是金，人们常说。这话还被写成大字，镶在框里，贴在很多墙壁上。人们用它来告诫自己：言多必失，少说多做，祸从口出，实干兴邦空谈误国。总之，能闭嘴的时候就闭嘴。 　　但是马丁•路德[阅读全文]© 途加.  http://bit.ly/jT0pLZ,0,0,zh,,,,,,,,
70171006152609792,2011-05-16 16:57:26,过于喧嚣的孤独: 生活在二十世纪六七十年代的布拉格的汉嘉是一位废纸回收站工作的老打包工，没有妻儿，孑然一身，终日在肮脏、潮湿、老鼠和绿头苍蝇到处乱串、充满霉烂腐朽味的地下室用压力机处理废纸和书籍，是一个处于社会底层的普[阅读... http://bit.ly/mJtAlX,0,0,zh,,,,,,,,
70171004906909696,2011-05-16 16:57:25,"菜根新谭,绝望向左，希望向右: 生活总是让我们遍体鳞伤，但到后来，那些受伤的地方一定会变成我们最强壮的地方。1、哈佛教授曼昆对大学生的5点忠告：①学点经济学，知道经济规律，把握自己人生。②学点统计学，统计是现实中最经常用到的... http://bit.ly/jzuhm8",0,0,zh,,,,,,,,
70171003690557440,2011-05-16 16:57:25,创业开店如何保胜算: 思考个人性格特征、兴趣，清楚手头上握有的资金数目后，对即将投入业种的适应度作逐一评估，如工作时段、工作时间长度及工作进行方式等，着重注意以下几点：    一是预见，就是结合本地实际情况，对即将出现的[阅... http://bit.ly/lOWDaT,0,0,zh,,,,,,,,
69752554472476672,2011-05-15 13:14:39,"1921年毛泽东谈政治,压迫是精髓 压迫得法就成功: 核心提示：毛说：“是的，压迫是政治的精髓。如果你压迫得法，说明你的政治是成功的。归根结底，政治的影响力十分简单，不过是经常保持压迫罢了。”本文摘自《毛泽东》 作者：迪克·... http://bit.ly/liZNKX",0,0,zh,,,,,,,,
69752553121910784,2011-05-15 13:14:39,"南师开示,六字诀的要领: 现在我为你重复一次安那般那的要点。这个法门依中国的天台宗，是有为工夫配合无为工夫一起的，上座后身心都放掉，一切不管，先清净一下，即使是假想的清净也没关系。其次，你调整清理身体内部。一般人饮食[阅读全... http://bit.ly/iClYxD",0,0,zh,,,,,,,,
69752552106893312,2011-05-15 13:14:39,"1946年国共谈判,东北学生游行反苏 中共代表避见: 本文摘自《百年潮》2001年第2期 作者：施应霆　施晓平 原题为：军调部东北执行小组谈判轶事为了新中国的建立，无数仁人志士抛头颅、洒热血，付出了沉重的代价。当然，共产党人... http://bit.ly/khMGPe",0,0,zh,,,,,,,,
69752549837783041,2011-05-15 13:14:38,关于人的成长的思考: 星期六的晚上，已经很晚了，本来应该是难得的休息的日子。儿子很可爱，虽然现在还只有6个多月大，但每次我回到家都很腻我，白天都强忍着不愿意睡觉怕我又出差了。妻儿都睡了，上网来收下邮件，顺便细看了一篇前天在[... http://bit.ly/muB2RQ,0,0,zh,,,,,,,,
69752547669311488,2011-05-15 13:14:37,鹰立如睡，虎形似病: 前面这些都是引子，重点分享万涛兄的谋事谋人之道，因为理都是那些理儿，不能应用什么都是废话。地低成海，人低成王地不畏其低，方能聚水成海，人不畏其低，方能孚众成王。世间万事万物皆起于低，成之于低，[阅读全文]© 途加.  http://bit.ly/jwnAeS,0,0,zh,,,,,,,,
69085428946440193,2011-05-13 17:03:44,"凡·高,我不是一个怪人: 凡·高：我不是一个怪人，我说“我是一个艺术家”，有人因此对我进行攻击，我坚信我说的话。即使我不断地遭受挫折，也不灰心；即使我身心疲惫，哪怕是处于崩溃的边缘，也要正视人生。人们总把我看成是一个不[阅读... http://bit.ly/lN5Lju",0,0,zh,,,,,,,,
69085427931430912,2011-05-13 17:03:44,醉驾高晓松和小贩夏俊峰: 药家鑫案时，高晓松质问“漠视生命的人会爱音乐吗”，现在这一质问竟调转头来，指向了自己，从围观者到被围观者；夏俊峰，一个因刺死城管而被终审宣判死刑的小贩，获得的媒体轰动效应虽远不及名人高晓松，但也有一... http://bit.ly/kzadQI,0,0,zh,,,,,,,,
69085426769592320,2011-05-13 17:03:43,国父孙中山革命的钱从哪来？: 　　“革命不是请客吃饭”，毛泽东曾这样为革命正言。  　　国父孙中山的革命同样如此，每次密谋起义，都要先筹足款项，用以购买、偷运军火，雇佣敢死队员，抚恤烈士家属，这些都要花钱。  　　但对[阅读... http://bit.ly/jv9kAv,0,0,zh,,,,,,,,
69085425758765056,2011-05-13 17:03:43,面试时不要说的7件事: 当我们为了工作进行面试时，都希望能展现我们最好的一面，但经常会因为说了不该说的话而面试失败。Even though you may feel comfortable chatting and mak[... http://bit.ly/jOX1pS,0,0,zh,,,,,,,,
69085422143275008,2011-05-13 17:03:42,生命与负熵: 这是EagleFantasy写的一篇物理小论文，我很喜欢，能让我对熵有点儿了解，为什么要了解熵，因为在我的头脑里一直存在着一个平衡系统（从长趋势周期看，今天所做的何事、说的何话都会对将来产生叠加结果，[阅读全文]© 途加.  http://bit.ly/irg9ED,0,0,zh,,,,,,,,
68672830727917568,2011-05-12 13:44:13,本·拉登之死和小布什的风度: 本·拉登被杀死之后，奥巴马在讲话中，着重强调了他如何指挥了这次行动。他感谢军事人员、情报人员的努力和勇敢。对最关心抓本·拉登的布什，他只提到了一句，说同意布什总统的说法，认为本·拉登不代表伊斯兰... http://bit.ly/kyh6JJ,0,0,zh,,,,,,,,
68672829436080128,2011-05-12 13:44:13,最………: 有一次吃饭，聊到一个话题，就是现在记者采访常提什么样的问题。一般可以总结出两类：一类是“您对这件事有什么看法？”一类是“你最……的是什么？”比如发生了一件事，我们把这件事命名为“A事件”，有家叫做[阅读全文]© 途加.  http://bit.ly/k7PjZt,0,0,zh,,,,,,,,
68672828446228481,2011-05-12 13:44:12,盘点五大职场新高危人群: 普华永道年轻女职工是否过劳死的争议还未远去，两名来自不同金融机构的员工轻生的消息又引发人们的叹息。在经济飞速发展和生活节奏快速旋转的今天，曾经颇受艳羡的“金领”、“白领”人士的生命也变得异常脆弱。[... http://bit.ly/ijcHed,0,0,zh,,,,,,,,
68672827246657536,2011-05-12 13:44:12,职场生存的八大原则: 在42街上，走在我身边的那个女子前一秒钟还活着，后一秒钟就死了。一辆计程车冲上了人行道，撞倒了她。事故发生在我到HBO电视台上班的第一天，要么就是第二天。我用公用电话拨打了911急救电话（在1994年[... http://bit.ly/lJDpsF,0,0,zh,,,,,,,,
68672824365158400,2011-05-12 13:44:11,把复杂事物简明化: 管理就是把复杂的问题简单化，混乱的事情规范化。——杰克· 韦尔奇最容易不过的是忙碌，最难不过的是有成效地工作。而化繁为简、善于把复杂的事物简明化，是防止忙乱、事半功倍的法宝。工作中，我们经常看[阅读全文]© 途加.  http://bit.ly/jKPKt6,0,0,zh,,,,,,,,
68579287007109120,2011-05-12 07:32:30,"教科书以外的真相,旧中国不是一穷二白: 在中小学课本上，我们就曾读到这样的内容：旧中国一穷二白，工业落后，连火柴、铁钉都要从国外进口。如今告诉你教科书以外的真相：旧中国不是一穷二白。轰动一时的袁腾飞历史教师曾说过“中国历史教... http://bit.ly/kB50Nl",0,0,zh,,,,,,,,
68579284960288768,2011-05-12 07:32:30,"钱理群,漫说大学: 今天看到在座的诸位大学生们，我很自然地想起了四十八年前的事。四十八年前我十七岁，考取了北大中文系，也是非常的兴奋，同时也有点惶惑。我想，这是跟诸位上大学的心情是一样的。上大学对人生来说是非常重要的一件[阅... http://bit.ly/ioPKZe",0,0,zh,,,,,,,,
68579282829590528,2011-05-12 07:32:29,大学是家高级自助式餐厅: 大学是一家高级自助式餐厅，店长当然是校长，学生当然是顾客，教师和其他工作人员是厨师或服务员，至于那些有职称或头衔的教授自然是高级服务员甚至是主厨。　　进入大学学习就如同吃自助餐，只要你交付[阅读全文]© 途加.  http://bit.ly/lbUzZZ,0,0,zh,,,,,,,,
68579281013456896,2011-05-12 07:32:29,关于性格内向者的10个误解: 我非常幸运的发现了这本《内向者优势——如何在外向的世界中获得成功》的好书，我感觉就好像是有人专门为我们这个罕见的小群体写了一部百科全书一样，它不仅对我的很多怪癖做了解释，还帮助我从一个崭新且积极... http://bit.ly/my2Foz,0,0,zh,,,,,,,,
68579278354268161,2011-05-12 07:32:28,人的气场是怎样炼成的: 1、知识的副作用知识，很有可能成为智慧的敌人。人接受知识，就像吃了肉一样，如果没有消化好就容易变成多余的脂肪，只不过知识没有消化好，变成大脑里多余的脂肪而已，大脑多余的脂肪必然会阻止人获得智慧，甚[阅... http://bit.ly/jYjrjK,0,0,zh,,,,,,,,
67764097634140160,2011-05-10 01:33:14,"大学能不能办小点？: 105个学生的Sterling College，学校的口号是“Working Hands, Working Minds.” 所有学生课余都要参加劳动。看电脑眼睛疲劳，出去散步，一出去就走了老半天[阅读全... http://bit.ly/mU73Ha",0,0,zh,,,,,,,,
67764096476528640,2011-05-10 01:33:14,你管他将来变成党棍还是恶棍呢: 这几天黄艺博老师的新闻很受关注，一个好孩子招致了很多人的批评嘲讽。我想这是一个价值观的问题，我们没有一个普适价值观，都是朴实价值观，用朴实的方式看问题就会有局限性。黄艺博是在这样的一个环境下长... http://bit.ly/mSAJvz,0,0,zh,,,,,,,,
67764095432146944,2011-05-10 01:33:14,"贾樟柯,我不诗话自己的经历: 在我们的文化中，总有人喜欢将自己的生活经历”诗化”，为自己创造那么多传奇。好像平淡的世俗生活容不下这些大仙，一定要吃大苦受大难，经历曲折离奇才算阅尽人间世事。我不诗话自己的经历，幸福这种东西并不... http://bit.ly/mIaVX7",0,0,zh,,,,,,,,
67764094211596288,2011-05-10 01:33:13,90后入职 办公室代沟如何消？: 近日，智联招聘发布的一项80/90后职场生态调查显示，40.5%的80—84年出生的人已经开始进入公司的核心岗位。与此同时，90后也开始成为新一代的职场生力军。　　90后入职后表现出哪些新特... http://bit.ly/m7XwtZ,0,0,zh,,,,,,,,
67764092957495296,2011-05-10 01:33:13,如何管理时间: 人的一生两个最大的财富是：你的才华和你的时间。才华越来越多，但是时间越来越少，我们的一生可以说是用时间来换取才华。如果一天天过去了，我们的时间少了，而才华没有增加，那就是虚度了时光。所以，我们必须节省[阅读全... http://bit.ly/jJX4G3,0,0,zh,,,,,,,,
67317926188949504,2011-05-08 20:00:18,“低调”种菜: 为确保供应安全的绿色食品，特供农产品基地应运而生。那个叫“海关大棚”的地方两米多高的围墙和铁栅栏环绕四周，五名保安把守……如果不是当地居民的提醒，很难找到这个名叫 “海关大棚”的地方，更难以知[阅读全文]© 途加.  http://bit.ly/j1apkz,0,0,zh,,,,,,,,
67317925127790592,2011-05-08 20:00:18,拯救失足妇女: 每个文化人心里都埋藏着一个茶花女，问题是在中国他们遇到的往往是失足妇女。自从青春期的骚动平息以后，我已经十多年没有进过夜总会。但去年好友从远方来，酒足饭饱，本地房地产商非拉着我们走进了一家“国际会[阅读全文]© 途加.  http://bit.ly/moHrTQ,0,0,zh,,,,,,,,
67317924125347840,2011-05-08 20:00:18,迷茫不迷茫: 【和尚与屠夫】从前有一个和尚跟一个屠夫是好朋友。和尚天天早上要起来念经，而屠夫天天要起来杀猪。为了不耽误他们早上的工作，是他们约定早上互相叫对方起床。多年以后，和尚与屠夫相继去世了。屠夫去上天堂了，而[阅读全文]© 途加.  http://bit.ly/lDFZZ2,0,0,zh,,,,,,,,
67317922011426816,2011-05-08 20:00:17,淘宝创业故事《亲身经历》: 算真正接触淘宝，那还是我去年3月份才接触淘宝的，当时由于没有上班，便和我男朋友也就是现在的老公来到了广州，花了好长时间在淘宝上找兼职，也没有找到合适的，原因可能是我的文化太低了吧。只念了初中，所以... http://bit.ly/lSDJt0,0,0,zh,,,,,,,,
67317919754887168,2011-05-08 20:00:17,世界500强公司的招聘潜规则: 影响力：雅虎所聘用的人必须结识一批英才，因为雅虎常常利用企业内部员工的关系网网罗人才。人际技能：雅虎聘用的任何员工短期内都要负责管理他人的工作，因此，雅虎的员工必须具备良好的建立人际关系的能力... http://bit.ly/lpVIjS,0,0,zh,,,,,,,,
66914228598087680,2011-05-07 17:16:09,阅读，是为更好地理解这个世界: “在这条路上走下去，我知道会有女人，会有幻象，会有一切；在这条路上走下去，明珠会交到我手中。”——杰克·凯鲁亚克：《在路上》文/严杰夫四月江南春燥的厉害。这种人心思动的节令，要静下心来读书，恐... http://bit.ly/mcLydH,0,0,zh,,,,,,,,
66914227276890114,2011-05-07 17:16:09,孤独里的喜悦: 近期，还债般的看完了一本书，是关于《瑜伽经》的，梵文译成英文再译成中文，估计也就了了。只是因为很久了断断续续的看，费心费脑，不看完似乎有点对不住这本书和自己。静心是个时尚，冥想是种境界。《瑜伽经》[阅读全文]© 途加.  http://bit.ly/moi82h,0,0,zh,,,,,,,,
66914224928071681,2011-05-07 17:16:09,世界经济危机史简述，三百年来经济历史: 纵观三百年来经济历史繁荣年代该涨的年头经济必繁荣，危机年代该跌的年代经济必走向衰落，如此跌宕起伏 循环往复。本篇只是从资本资金 市场供求关系 消费需求生产力水平 金融借贷 投资投机 关... http://bit.ly/kCKfD9,0,0,zh,,,,,,,,
66914223686561793,2011-05-07 17:16:08,回忆纵使不够美好，现实也已足够温暖: “初恋”对我来说，不如“前男友”三个字有感觉。说到初恋大不了“哦”一声，但说到前男友，往往会“哇”，要不然就是“哎”。都是爱，没有本质的区别，区别可能在于初恋稀里糊涂的，被参与的成分多点... http://bit.ly/js4HEP,0,0,zh,,,,,,,,
66914222633783296,2011-05-07 17:16:08,长到40岁学到的41件事: 6月8日标志着我进入40岁。下面的是我这一路走来学到的41条建议：41. 不要太在意别人如何看你。40. 是人就有自尊。小心行事，不要伤害他们的自尊心。39. 没有什么能比实干能给你更多[阅读全文]© 途加.  http://bit.ly/kX0iQO,0,0,zh,,,,,,,,
66222143540695040,2011-05-05 19:26:04,"刘瑜,超越那一天: 一直不明白为什么会把五四运动和“德先生”与“赛先生”联系起来。《苦涩的革命》（A Bitter Revolution）里面是这样描述90年前那天的情形的：大约3000个学生在天安门会合，聆听了抗议巴黎[阅... http://bit.ly/mzR7aB",0,0,zh,,,,,,,,
66222141103808512,2011-05-05 19:26:03,美国大众文化中的“英国王室”情结: 美国大众文化中的“英国王室”情结徐 贲4月29日星期五，我一走进课堂，就有学生问我，昨天夜里你看英国王室婚礼了吗？我说没有，随即是一片夸张的惋惜声，这是学生们喜欢开玩笑的方式。但是，许多[... http://bit.ly/jKmq86,0,0,zh,,,,,,,,
66222140034269184,2011-05-05 19:26:03,职场史上“最牛自荐”: 从管理的角度解读，如果说诸葛亮的“隆中对”是一次经典的策划案例，那么东汉思想家王充用毕生精力撰写的一部哲学著作《论衡》，可以称之为职场史上的“最牛自荐”。《论衡》的题名，表明王充要对往古与当时的一[阅... http://bit.ly/l9UrfZ,0,0,zh,,,,,,,,
66222138683695105,2011-05-05 19:26:02,60后白领的4个5年规划: 俺是一早期“北漂”，20多年前即来京上大学，目前在京企从事技术工作，LG也是白领，家有一高中宝贝。俺家算是白领，中产家庭吧。目前家庭年收入稳定在80w左右，在京有三套房，两自住，一出租，市值110... http://bit.ly/lLk3zf,0,0,zh,,,,,,,,
66222135575719938,2011-05-05 19:26:02,通往职场成功道路的捷径忠告，真的有！: 什么是职场，套用一句很老的话来说：有人的地方就是江湖。类似的，有工作的地方就是职场    有人在职场里混得风生水起，左右逢源，也有人在职场失意，灰头土脸。要想在职场光鲜八面，你得记住以... http://bit.ly/kFl1Om,0,0,zh,,,,,,,,
65825432972427264,2011-05-04 17:09:40,本拉登强心针维持不了多久: 本拉登被击毙，是一个政治大事件，并不是重大的经济事件，市场走出一日游行情。本拉登消失并不意味着全球经济通胀时代的结束，反而意味着另类多事之秋的开始。当全球政治、经济失衡，总是一个事件引领另一个事[... http://bit.ly/jSMlgj,0,0,zh,,,,,,,,
65825431949033472,2011-05-04 17:09:40,成圣又如何: 给张宏杰的新书《曾国藩的正面与侧面》写的书评，载于《南方周末》－－－张宏杰是真喜爱曾国藩。在新书《曾国藩的正面与侧面》中，他把曾国藩刻画成一个正直又不乏圆通、清廉却也有挣扎、智慧但又有点笨拙的[阅读全文]© 途加.  http://bit.ly/k9RKLE,0,0,zh,,,,,,,,
65825430934011904,2011-05-04 17:09:40,"龙应台,有些事，只能一个人做: 有些事，只能一个人做；有些关，只能一个人过；有些路啊，只能一个人走。每个时代都有思考和不思考的人，一个社会特立独行的人越多，天分、才气、道德、勇气就越多。一有些事，只能一个人做；有些关，只[阅... http://bit.ly/iN4ara",0,0,zh,,,,,,,,
65825429709262848,2011-05-04 17:09:40,"七个寓言,做一棵永远成长的苹果树: 七个让你受用一生的心理寓言，不要太在乎果子，成长是最重要的。一、成长的寓言：做一棵永远成长的苹果树一棵苹果树，终于结果了。第一年，它结了10个苹果，9个被拿走，自己得到1个。对此，苹果[阅... http://bit.ly/l0vrZg",0,0,zh,,,,,,,,
65825427544997888,2011-05-04 17:09:39,忘我之境: 自昨天看完“天生向日葵”这篇文章后，我总觉得缺了点什么，我试图寻找另一个词来概括拥有”好奇心“的”自律“状态，直到今天我读到这两篇短文，那个词终于跃然纸上，熠熠生辉。一、忘我作者：李笑来很[阅读全文]© 途加.  http://bit.ly/mGqM5N,0,0,zh,,,,,,,,
65514729254293504,2011-05-03 20:35:03,金庸的十句顶不上古龙这一句: 金庸的十句顶不上古龙这一句：人在江湖，身不由己！和朋友们讨论金庸最有名的十句话。第一句：侠之大者，为国为民。不错，这算一句金庸的名言，出自郭靖之口，据说当年曾有记者问金庸谁是他心目中的侠客，[阅... http://bit.ly/moOY2M,0,0,zh,,,,,,,,
65514728373497856,2011-05-03 20:35:03,"张竞生,民国时期的李银河: 性，是人的最基本问题，可是直到民国出了个张竞生博士，国内才有人第一次对性有了系统的科学研究，阿忆老师称他为“最早的李银河”，倒不如说李银河是当代的张竞生。张竞生的研究非常仔细深入，连夫妻间如何增加... http://bit.ly/mbbFD2",0,0,zh,,,,,,,,
65514727383638017,2011-05-03 20:35:02,女性谈判取胜之道——刚柔并济: 得到了心仪的工作但对合约条款不满意，却又担心讨价还价可能惹恼未来上司？对此，男性和女性的反应不同。在争取自身利益方面，男性更敢于力争，而女性则不然。琳达・巴布科克 卡内基梅隆大学（Carne[... http://bit.ly/kYj2s9,0,0,zh,,,,,,,,
65514726251171841,2011-05-03 20:35:02,"善用天生魅力 4招搞定职场沟通: 在职场中免不了要和形形色色各种人士打交道,然而,怎样让领导在众多员工中注意到你,并与之建立和谐友好的关系,这是职场沟通中最重要的问题之一!别忘了,女人天生的性格魅力可以让你在沟通方面更具优势... http://bit.ly/mSibgr",0,0,zh,,,,,,,,
65514724590231552,2011-05-03 20:35:02,世界上最浪费时间的三件事: 世界上最浪费时间的三件事：worry 担忧，blame 怪责，judgement 评判。担忧那些准备不足的事，那些无法改变的事；怪责生活中令自己伤心的人；粗 暴评判他人的生活。stop it！准备... http://bit.ly/jpdk6b,0,0,zh,,,,,,,,
64014060638834688,2011-04-29 17:11:56,"南桥,独处的力量: 缅甸女英雄昂山素季出狱后，说很新奇听到了真人的声音。在软禁的无数日子，她能面对的只有收音机。比她更“惨”的是曼德拉，被囚禁将近三十年。一个没有彪 悍内心的人，经过这些灾难，人一定都垮掉了。这两个人都没[阅... http://bit.ly/mxKsTW",0,0,zh,,,,,,,,
64014059762225152,2011-04-29 17:11:55,"王霄,朱镕基功过之一瞥: 朱镕基前总理参加母校校庆时的讲话，虽然根据他的要求不得外传，但已经透露出来的内容，一如当初地引起争议不断，一如当初地让人感到他的坦率与激情。朱先生老则老矣，个性更鲜明了。　　由此连带引出的人们对[阅... http://bit.ly/jL6Rpv",0,0,zh,,,,,,,,
64014057795104769,2011-04-29 17:11:55,"家训,人前不露怯，远足不露财，内外当整洁，自奉须俭约……: 作者：陆勇强我家祖上是当地大户人家，生意通达，在上海也有铺子。后家道中落，到了父亲这一代，只余一间房、几个人。但是我的曾祖母，衣裳总是清清爽爽的，头发总是梳得齐齐的... http://bit.ly/iZgJRD",0,0,zh,,,,,,,,
64014056624893952,2011-04-29 17:11:55,关于商业类、管理类书籍的一些杂想: 1、买商业类、管理类书籍是最麻烦的，比起其他门类，这个行当的伪书特别多。随便去一个机场书店逛逛，基本上都是厚黑类、励志类、神奇类、中国式管 理类的书，而摆放这些书的书架上基本上都贴着管理、... http://bit.ly/iBCOvj,0,0,zh,,,,,,,,
64014054385131520,2011-04-29 17:11:54,如何提高效率: Aaron Swartz写过一篇很有名的文章，叫做《HOWTO: Be more productive》（如何提高效率）。这篇文章写的实在是太好了，我看了好多遍，很赞同作者的观点。我借鉴了作者提到的一[阅读全... http://bit.ly/igCYhS,0,0,zh,,,,,,,,
63648576378634240,2011-04-28 16:59:37,"金庸,人到无求品自高: 腹有诗书气自华，人到无欲品自高。面对财富、智慧和美色，你会选什么？在希腊神话中有三个女神：希腊主神的妻子朱诺、雅典城的守护神雅典娜和爱神维纳斯。她们三个一向自认为最美，争执不休之下便请特洛伊城[阅读全... http://bit.ly/iGLI2a",0,0,zh,,,,,,,,
63648571697799168,2011-04-28 16:59:36,在网上卖什么最畅销？: 在网上开店和在网下开实物店是完全不一样的，在网下，只要你的店的位置不要太差，小生意就可以做的还不错，就算是卖很大众化的东西，都一样可以赚的盆满钵满。在网上做生意，就要独辟蹊径了。一般来说，在网上销售[... http://bit.ly/lc80w8,0,0,zh,,,,,,,,
63648569244127232,2011-04-28 16:59:36,经营的本质就是经营人心: 经营的本质是什么？简单就一句话：经营人心。表面上看，经营的是产品和服务，顾客买走了，经营者赚钱了。往深里想，顾客为什么买，还不是顾客心里认可、接受了，而经营者能提供这些产品和服务，也是员工心里愿意[... http://bit.ly/kuB5kp,0,0,zh,,,,,,,,
63648567729995776,2011-04-28 16:59:35,他为什么放弃7000万: 别人给我讲投资界游戏规则时讲了这样一个例子，有个很有钱的老板，想做一个电影评价系统，通过征集志愿观众、试映影片时采集观众的体征变化数据，对影片进行客观分析，帮影片投资人做公映策略比如推广、档期安排等... http://bit.ly/l7284k,0,0,zh,,,,,,,,
