id,created_at,text,favorites,retweets,lang,in_reply_to_user,in_reply_to_user_id,in_reply_to_status_id,country,country_code,place_name,place_type,coordinates
14790774071762944,2010-12-14 21:16:09,可耻的不是打架而是沉默: 最近，韩国议会再次上演全武行，为什么东亚周边地区的议会总是无法像西方人那样保持一种克制和礼仪程序？打架议会难道是议会制度的初级阶段么？热衷打架的议会到底是否落后呢？打于不打 历史选择了不同的交锋方[... http://bit.ly/f6F2aX,0,0,zh,,,,,,,,
14790771978797056,2010-12-14 21:16:09,闲侃中文字体: 1． 在平面设计中，“字体”是一项重要的基本功。Alex W. White 在《平面设计原理》一书中写道：“组成 typography（排印）这个词的词根是 typo （文字）和 graphy （绘画[阅读全... http://bit.ly/faFMDc,0,0,zh,,,,,,,,
14790770317860864,2010-12-14 21:16:09,中国高等教育是个啥？: 中国学生与西方学生通过雇佣中国与西方大学毕业生的经验，我发现任用中国学生就意味着你可以保证有一个人为你每天工作8小时，不过你得时刻督促他，同时得给他指定一个很清晰的方向。而西方学生呢，有75%的人[阅... http://bit.ly/gQwWBv,0,0,zh,,,,,,,,
14790768736608256,2010-12-14 21:16:08,你和中国一起老去: 文/严杰夫 提到海外中国史研究，魏斐德（Frederic Wakeman）恐怕是怎样都无法忽略的一位大师。费正清曾经这样评价他的学术成就：“对于任何对中国真正感兴趣的人来说，从现在开始，魏斐徳的书[阅读全... http://bit.ly/gll51t,0,0,zh,,,,,,,,
14373388004884480,2010-12-13 17:37:37,职场人士需要培养的7个习惯: 习惯一：忠诚于自己的人生计划我们经常在人生的道路上迷失方向，因徘徊和迷途消耗了生命。而高效能的人懂得设计自己的未来。他们认真地计划自己要成为什么人，想做些什么，要拥有什么，并且清晰明确地写出，以... http://bit.ly/eLVhQ7,0,0,zh,,,,,,,,
14373386687881217,2010-12-13 17:37:37,锐利的《柔软》: 强光打在舞台上，一个高大壮硕的妖冶女子。银发、黑色蕾丝裙、艳红的玫瑰。苍凉的调子，唱着那首出名的法文歌《玫瑰人生》。突然，音乐停止了，然后再度响起，唱到两句，又再度停止。　　开口说话居然是沙哑男[阅读全文]© 途加.  http://bit.ly/euLmcg,0,0,zh,,,,,,,,
14373385555415040,2010-12-13 17:37:36,一个人事经理眼中的中国人劣根性: 出处：北大一塌糊涂BBS勉之哉，勉之哉！我在一个生物技术企业工作了四年，之前是做市场的，最近一年被老板调到了人力资源部当经理。一年的人事工作经历使我对人性有了更深入的认识，对中国人（包括自己... http://bit.ly/h0IE17,0,0,zh,,,,,,,,
14373382791368704,2010-12-13 17:37:36,有些书，仅读中译本是不够的--英若诚一生的传奇与谜团: 读英若诚的合作自传《水流云在》是一次愉快的阅读体验。在这本回忆录中，英若诚展示了强大的内心，和豁达的幽默感。即使被关到监狱，他也能游刃有余，狼虎丛中也立身。他在冀县监狱... http://bit.ly/h0oYHy,0,0,zh,,,,,,,,
14373381893783552,2010-12-13 17:37:35,"罗兰•巴尔特,知识分子有什么用？王立秋: 罗兰·巴尔特，法国文学结构主义及符号学之父，不久前继米歇尔•福柯和皮埃尔•布雷之后，刚被选入法兰西学院。巴尔特表述了许多文学与哲学批评的新方法，这些方法某种程度上受到了一致地追随和用... http://bit.ly/fb1ZYM",0,0,zh,,,,,,,,
14042181018853376,2010-12-12 19:41:31,25种我在十秒内离开你的页面的原因: 是什么让人们在打开你的网页没多久就按下返回键？他们为什么那么快就想摆脱你的网站？可以做些什么来改善这一点呢？长期思考这个问题之后，我发现了比原本想象的还要多的一些因素。如果把一下因素单独... http://bit.ly/h8Jh33,0,0,zh,,,,,,,,
14042179961884672,2010-12-12 19:41:31,最全的厚黑学…教你怎样混社会: 是啊， 我怎么会混得这么差？当年班里（周围）不如我的那个家伙怎么现在这么发达？　　收起你酸酸的目光，让我来告诉你，怎么混社会。　　本文只针对苦苦挣扎混社会的朋友来讲，即工作拼命，拿钱不多，地位... http://bit.ly/fwRTL7,0,0,zh,,,,,,,,
14042178892337152,2010-12-12 19:41:30,压力最大职业排行榜出炉 公务员居首遭疑: 一份研究称—— 十大压力最大行业公务员居首，矿工垫底　　8日，有媒体报道，某课题组研究发现，领导层级越高，心身健康水平相对越低。　　该课题组统计发现，压力分数从高到低依次是：管理中层... http://bit.ly/hEXHKB,0,0,zh,,,,,,,,
14042177680187392,2010-12-12 19:41:30,"《卫报》鲁迅,中国的良心: 中国的良心鲁迅在中国相当于将狄更斯（Dickens）和乔伊斯（ Joyce）集于一身的人物。他深受毛泽东的称许；中国还建有纪念他的博物馆和主题公园。但其著作正慢慢淡出高校教材，相关部门对此的解释是... http://bit.ly/eMe1ov",0,0,zh,,,,,,,,
14042176610639872,2010-12-12 19:41:30,谁在中国过好日子?: 无论精英或草根，当今中国人须自问，这份日子还能不能过下去。没有均富与平权，包容与兼容，谁在中国都不会有好日子过。 文/肖锋1978年中国经济面临崩溃，中国站在历史的转折点上。时隔32年后，中国[阅读全文]© 途加.  http://bit.ly/hx7PI6,0,0,zh,,,,,,,,
13646526895099904,2010-12-11 17:29:20,越头看，阿爸是山: 文/城南草木生台湾人擅长打软糯清新又甜香的温情牌，像这样的亲情故事，交给日本和台湾的师傅掌控都是好料理，拍《母亲》的山田洋次今年出品了同样好口碑的《弟弟》，喜欢日本人谈父母爱男女爱朋友爱的时候那种[阅读全... http://bit.ly/f42AMy,0,0,zh,,,,,,,,
13229061312618497,2010-12-10 13:50:28,人生是非问答曲线: 在“东西网”看到一张来自“smarter.org”关于“人生是非题”的图片，非常经典！这不仅仅是是非题，更像是问答题，从这些问题中我们可以画出自己一生的答案。标题：Could You Be a F[阅读全... http://bit.ly/dUgXZd,0,0,zh,,,,,,,,
13229060167565312,2010-12-10 13:50:28,成长的鞭子: 想到写这个话题，是因为昨天和一位找我聊天大学生的启发。我发现很多人（不仅仅指大学生）找不到目标和方向，这不奇怪，这是常态。一个人一辈子不是经常有目标去奋斗，而是经常觉得自己没有目标值得去奋斗。[阅读全文]© 途加.  http://bit.ly/gJhF5n,0,0,zh,,,,,,,,
13229058875719680,2010-12-10 13:50:28,"人品极差，书法奇好的三位""大奸臣"": 中国历代书法评价中，书品和人品是一个血肉相连的整体，人品历来高于书品，书法是热病的学识、才能、品质高度融合的体现。司马光曾经说过：才胜德者，小人也。很多人认为把人品低下的书家的书法作品收... http://bit.ly/h6dGEn",0,0,zh,,,,,,,,
13229056757596160,2010-12-10 13:50:27,中国历史上有谁征收过资产税？: 今年以来，关于要不要征收房产税，社会舆论已经争论得面红耳赤了，到我写这篇专栏的时候，还没有尘埃落定。中国的治国者是全世界最懂得运用税收工具的人，所以我们喜欢对着他们高呼“万岁（税）”。于是，有... http://bit.ly/g77qNl,0,0,zh,,,,,,,,
13229055830654976,2010-12-10 13:50:27,"整理香港TVB剧经常性出现的台词！！太可爱了，港剧迷的集体回忆~~~: 1.那，做人呢最重要的就是开心。（要用语重心长的口气来说） 2.你有权保持缄默,但你所说的话都会变成呈堂证供（**都要来这一句） 3.让我一个人静一静（... http://bit.ly/gpibVA",0,0,zh,,,,,,,,
12960144803500033,2010-12-09 20:01:53,中国人美国人饭桌上的有趣对话。: 我的一个中学同学于90年去了美国并加入了美国国籍，同学们开玩笑都叫他“美国人”。    前几天“美国人”回中国探亲，老同学一起聚了聚。    饭吃得差不多的时候，一直住在国内的几个同学聊起了... http://bit.ly/ebJ5k6,0,0,zh,,,,,,,,
12960143654256640,2010-12-09 20:01:53,成功人士必须要达到的12条标准: 关于什么才是成功人士的定义说法不一，但是要做成功人士的路径几乎是一致的，今天给大家分享的是其中的一个版本，但可见成功的路径都是大同小异的，记住这个原则，下面的内容一定对你有所帮助——　　1、... http://bit.ly/he2T58,0,0,zh,,,,,,,,
12960141456449536,2010-12-09 20:01:53,"胡安·鲁尔福,回忆与怀念: 回忆与怀念 　　 [秘鲁]胡安·鲁尔福 朱景东 译 　　 　　为了写作，我需要脚踏实地，需要找到自己的位置。任何事情，我都必须把它放在一个地方，以便赋予它生命，一旦它有了生命，我便要跟随它。[阅读... http://bit.ly/fHIQrI",0,0,zh,,,,,,,,
12960140575645696,2010-12-09 20:01:52,“红色”出版家: 1972年3月14日晚上，有个男人爬上米兰郊外的一座高压电线塔安放炸弹。不知为何他从塔上掉下来。他的尸体被附近一户农民的狗所发现，一条腿已被炸掉。第二天的报纸报道说有一不明身份的恐怖分子在安放炸弹时[阅读全... http://bit.ly/eCV37d,0,0,zh,,,,,,,,
12960139267014656,2010-12-09 20:01:52,金庸的数学水平有多差: 据说70后的一大时代爱好是看全庸。最近闲来无事，翻了几页，恰好看到这样一段：  　　洪七公一凉喜交集，细看之下，原来每条牛肉都是由四条小肉条拼成。洪七公闭了眼辨别滋味，道：“嗯，一条是羊羔坐臀，一[阅... http://bit.ly/hzchi7,0,0,zh,,,,,,,,
12566002378211328,2010-12-08 17:55:43,《哪来的天才？》读书笔记—牛人是练出来的: 1万小时的原理许多人都听过了，如果你对通过练习实现卓越感兴趣，这本书就是你想要的。1. 天才，它不是一种经验，在许多领域有成就的人，数年之后反倒更糟。它也不是特别的天生能力。天才源... http://bit.ly/ieQzBu,0,0,zh,,,,,,,,
12566000977313793,2010-12-08 17:55:42,谁是船长？: 他，36岁，葡萄牙人。一个身材矮小的没落贵族，历经十年磨砺的军官、水手，在征战印度时落下了一条瘸腿。因为性格孤僻内向，甚至无法给自己谋到一份体面的差事。祖国的君主没有耐心听取其远航计划，他只能跑到西班[阅读全文]© 途加.  http://bit.ly/fEu5l0,0,0,zh,,,,,,,,
12565999563833344,2010-12-08 17:55:42,有史以来最狂妄的演讲: 注：演讲人 Larry. Ellison是Oracle的CEO。 Larry. Ellison　在耶鲁大学2000届毕业典礼上发表了以下世人看来最为狂妄、不受欢迎但又是现实真实状况的演讲。 [阅读全文]© 途加.  http://bit.ly/i7UXWZ,0,0,zh,,,,,,,,
12565998578180096,2010-12-08 17:55:42,民主到底是个什么东西?: 民主肯定不是一个坏东西……不管民主是是个什么东西，但一定是个不怎么坏的东西。有一个证明方式非常简单，简单得都被我们大伙儿忽略了，那就是在当今世界上，你几乎找不到一个人、组织或者国家会攻击民主[阅读全... http://bit.ly/enYA6B,0,0,zh,,,,,,,,
12565997571547136,2010-12-08 17:55:41,"凤凰周刊,美国物价为什么比中国便宜: 中国虽然属于发展中国家，但是物价却有赶超美国的迹象。造成中美物价异常的因素固然很多，除了国际政治经济分配体制使然，更是两国内部各自司法、经济体制差异的结果，这种制度成本的差异体现在从生产... http://bit.ly/i9X78d",0,0,zh,,,,,,,,
12226437809446912,2010-12-07 19:26:24,如果你是唐僧，给仨徒弟发奖金谁该拿最多？: 先来看一道很有意思的职场问题：如果你是老板，你的员工有孙悟空、猪八戒、沙僧这三种类型，现在发奖金的时候到了，你要怎么分配?谁拿最多，谁拿最少?　　孙悟空非常有本事，但心高气傲，有点... http://bit.ly/f4guvX,0,0,zh,,,,,,,,
12226436521787392,2010-12-07 19:26:24,很短...道理很深……: 大一：你在看美女，我在看书，大二：你在约会，我在锻炼身体，大三：你在花前月下，我在埋头苦读，大四：你在乙醇里买醉，我在社会上积累经验，毕业了...，你拿着毕业证四处求职，我准备读研继续学习。不久后.... http://bit.ly/hzLXWH,0,0,zh,,,,,,,,
12226434214928384,2010-12-07 19:26:23,做美国人的爹: ◎　贾葭     我的一个邻居前一阵子上街，车胎被人戳了，挡风玻璃上还贴了一张字条：开日本车等于叛国！我劝他想开些，日系车虽然省油，却是要冒一些风险的。后来他换了一辆美国牌子的轿车，说年轻人从不抵制[阅读全文]© 途加.  http://bit.ly/fqjfV1,0,0,zh,,,,,,,,
12226433283788800,2010-12-07 19:26:23,《消费者之歌》: 文/东东枪见过一则国外的禁烟广告，全部文案只有三个词：Cancer Cures Smoking。自打看到这广告起，我就老想把这句话译成中文，但译来译去，总是觉得配不上这句原文。无论是“癌症专治吸烟[阅读全文]© 途加.  http://bit.ly/e4onjQ,0,0,zh,,,,,,,,
12226432394600449,2010-12-07 19:26:23,专才还是通才？: 原文：博士生们都在读什么书？来源：南方网，作者：严飞，旅美学者。我一直都在好奇这一问题，是因为我发现至少在我接触的博士生里面，无论是理科博士，亦或是从事社会科学的，会主动读书者，似乎凤毛麟角。[阅读全文]© 途加.  http://bit.ly/gs0Woa,0,0,zh,,,,,,,,
11840932756324352,2010-12-06 17:54:33,前进还是转向，决定你成功还是失败: 有一天上网，收到这样一份短消息，标题是：“现实中，我们该怎样权衡放弃与坚持？”正文是这样的：“老师，在我看得许多有关励志方面的书中，有些里面提到要学会坚持，而且举了很多因为坚持最后取得成功... http://bit.ly/gURuK4,0,0,zh,,,,,,,,
11840931112161280,2010-12-06 17:54:32,解析快乐的三个秘诀: 在 TalBen-Shahar讲授的第七节课中，他终于打开宝盒，传授获得快乐成功人生的三个秘诀：行动、想象、思维。1.行动起来。Tal把这个观点放在第一个，有其现实意义的考虑。他认为，单单拥有[阅读全文]© 途加.  http://bit.ly/fn3Wld,0,0,zh,,,,,,,,
11840928985649152,2010-12-06 17:54:32,一零年喜欢的书: 2010年最喜欢的书非文学类1、  《中间地带的革命》/杨奎松/山西人民出版社/2010年5月/54.00杨奎松的《“中间地带”的革命》是在旧版的基础上经过大量细致地修订，最终以新貌示人的[阅读全文]© 途加.  http://bit.ly/hOcgCh,0,0,zh,,,,,,,,
11840927488286720,2010-12-06 17:54:31,我所认识的“学二代”: 我所认识的“学二代”到绍兴去讲学，晚上俞志慧教授携太太与儿子来看我，儿子已经读中文系二年级了。又一个“学二代”，令人高兴。返沪车上读陈子龙《国朝经世文编序》，云：“朝无良史、国无世家、世无实学”，[阅... http://bit.ly/e0hXjB,0,0,zh,,,,,,,,
11840925470826496,2010-12-06 17:54:31,美 国没有户籍管理为什么不乱套？: 美 国没有户籍管理为什么不乱套？我是1997年认识劳伦斯的，11年来他搬了5次家，平均2年多点时间就搬一次家，真是够频的。美国人就是这样，随意搬家，不在乎搬家，甚至热爱搬家。美国人刚参加工... http://bit.ly/dXk1QV,0,0,zh,,,,,,,,
11471284147851264,2010-12-05 17:25:41,"窥探SNS的今天和未来,失控: 转载自金融界读书这是一本关于机器、系统、生物和社会的“大部头”； 　　这是一部揭示了社会进化、特别是互联网发展的“先知预言”； 　　从这本书里，你可以窥探到SNS的今天和未来！ 　　失[阅读全... http://bit.ly/hUHQPZ",0,0,zh,,,,,,,,
11471283178967040,2010-12-05 17:25:41,"李锦记,家族企业的管理秘籍: 李锦记制定了一套“家族宪法”，其中对接班人有三条特别的规定，包括“不要晚结婚、不准离婚、不准有婚外情”。尤其后两条，是家族成员参政议政的必要条件。而一旦有成员违反了这两条，就要自动退出董事会在中... http://bit.ly/h2Vrok",0,0,zh,,,,,,,,
11471282247835648,2010-12-05 17:25:41,做自己想做的人: 我们常常以为，自己天生就该知道自己能做个什么样的人。不是吗？小时候幼儿园老师就会有意无意地引导我们说“你将来长大了想做什么”。不管是出于攀比或是不想让老师失望，我们总会用奶声奶气的声音回答：“我要做这[阅读... http://bit.ly/dSyjwi,0,0,zh,,,,,,,,
11471281006321664,2010-12-05 17:25:41,朱元璋为何禁止子孙对日动武？: 明朝开国皇帝太祖朱元璋也一度想东征日本，但是他并没有和元世祖忽必烈那样采取行动，只是虚张声势而已。他为什么想要东征日本？又为什么不仅不采取行动，而且最终在临死前立下遗嘱，禁止他的子孙进攻日本等... http://bit.ly/fyBNhH,0,0,zh,,,,,,,,
11471280096153600,2010-12-05 17:25:40,谁告诉你外汇储备就不能用在老百姓头上？: 文/端宏斌　　　　中国外汇储备连年增长，可是这些美元竟然大部分都买了美国国债继续借给美国人消费去了。于是就有一些老百姓问道：我们还是个穷国，为什么政府把这么多钱借给一个富国去消费？而... http://bit.ly/g5LkKU,0,0,zh,,,,,,,,
11140016143073280,2010-12-04 19:29:21,染香谈韩寒: 谁是染香？染香是谁？有网友人肉出新浪微博上@染香 是这位：余进：加州理工学院经济学博士，麦肯锡全球董事合伙人。拥有两个孩子的母亲。在新浪微博上一个网名为染香的女子在个人微博上毫不掩饰的注明自[阅读全文]© 途加.  http://bit.ly/fpKb1z,0,0,zh,,,,,,,,
10777217516699648,2010-12-03 19:27:43,心的独立才是真正的独立: 关于“情感依赖症”达尔文先生出版了那部旷世奇作《物种起源》，但他无论如何也想不到：在几百年后的新世界，人们开始变得聒噪而激烈，越发地没有安全感，然后开始自私地寻求他人身上的慰籍与精神支持，这是否是[... http://bit.ly/egDNQi,0,0,zh,,,,,,,,
10777216510074880,2010-12-03 19:27:43,水浒一百单八将的最终结局: 三十六天罡星天魁星：及时雨(呼保义)·宋江——得胜后被高俅毒死天罡星：玉麒麟·卢俊义——得胜后被奸臣陷害，误饮毒酒后，失足落水而死天机星：智多星·吴用——宋江死后与花荣上吊天闲星：入云龙·公孙[阅... http://bit.ly/fAZImv,0,0,zh,,,,,,,,
10777215314690048,2010-12-03 19:27:43,"昂山素季,一个偶像的精神之路: 作为缅甸的政治领袖和精神偶像，在昂山素季身上，燃烧着她父母的政治家血液。这一点可能与亚洲的家族政治有关，阿基诺夫人、贝·布托以及英迪拉·甘地，都体现出对家族的使命感、献身精神和坚定风格。在过去... http://bit.ly/esqbgv",0,0,zh,,,,,,,,
10777214287089664,2010-12-03 19:27:42,"刘瑜,曼德拉坐牢30年没挨过一次打: 曼德拉坐牢30年没挨过一次打，刘瑜感到很奇怪。当坏人在使坏但又坏得不成气候时，好人就有了可乘之机。刘瑜探讨所谓底线。除了早年的一次警民冲突事故，曼德拉从来没有挨过打。这本700多页的曼德... http://bit.ly/h0yZeF",0,0,zh,,,,,,,,
10777213267877888,2010-12-03 19:27:42,为何中国史上常发生自杀性震荡: 项羽、黄巢、李自成、张献忠、洪秀全，他们领导人民起义并没有错，但他们起义之后，没有一个不是杀人狂魔，或破坏狂，为什么会如此？　　——题记　　一、战争与人口　　不少电视剧导演——甚至像张艺[阅读... http://bit.ly/hXDq9F,0,0,zh,,,,,,,,
10413371518091264,2010-12-02 19:21:55,"北大学术女的自白,我成绩第一但不快乐: 一个是从小第一众人眼羡飘洋留学之大牛，一个是马马虎虎不上不下呼朋引伴之小某，如果让你猜，你会觉得谁更快乐？北大学术女的自白：我成绩第一但不快乐。先来给你们讲个笑话：今天我发现我娘开始为... http://bit.ly/eH4Hj5",0,0,zh,,,,,,,,
10413370582761473,2010-12-02 19:21:55,读“经典文学”有什么用？: 在我经常阅读的博客中，有很大一部分是教师的，他们在博客上更自由地表达自己的教育思想观点，是课堂非常有趣的延伸。下面这篇是子虚老师的贫嘴之作，他写得天马行空，我就把题目放大了些。原文：读《荷塘月[阅... http://bit.ly/fv8t3d,0,0,zh,,,,,,,,
10413369555156992,2010-12-02 19:21:55,中国为什么没牛校?因为从没滋长过大学精神: “网课”风靡，原来人文也性感 　　历史找到了梵高，但我们错过了多少梵高？ 　　人文学科，不就是纸面上的那些东西吗？都是浮云。 　　教育者传授的不单是知识，还有道德、审美、智慧、伦理... http://bit.ly/ehqexR,0,0,zh,,,,,,,,
10413368443666432,2010-12-02 19:21:55,憨人: 某日遇见A君，面带苦色，与之相谈十余分钟后，她便告辞先行离开。随行的小Q告诉我:“A君最近遇上些麻烦。”几日后，A君打电话约我出来吃饭，想起前几日小Q的话，便把手上的事情搁下，打车到了约定地点。[阅读全文]© 途加.  http://bit.ly/e44WHk,0,0,zh,,,,,,,,
10413367311204352,2010-12-02 19:21:54,逃离所多玛城: 耶和华说：“我若在所多玛城里见有五十个义人，我就为他们的缘故饶恕那地方的众人。”——创世纪 18：26文/严杰夫很多人在读到《旧约圣经》中关于所多玛的故事时，恐怕总免不了要感叹上帝的残酷[阅读全文]© 途加.  http://bit.ly/guvhMp,0,0,zh,,,,,,,,
10050658275172352,2010-12-01 19:20:38,个人修养十不要: 1、不要自视清高天外有天，人上有人，淡泊明志，宁静致远。当别人把你当领导时，自己不要把自己当领导，当别人不把你当领导时，自己一定要把自己当领导，权力是一时的，金钱是身外的，身体是自己的，做人是长久[阅读全文]© 途加.  http://bit.ly/h51f0B,0,0,zh,,,,,,,,
10050655758589952,2010-12-01 19:20:37,苦于没有经验吗？从现在开始，用你的网络品牌来展现自己吧: 我生活的城市洛杉矶，充满了无穷尽的机会。这里有著名的大学，让人心驰神往的好莱坞，数不清的大公司和从世界各地来的优秀的人才。因为有了这些独特的魅力，洛杉矶一直吸引着希望... http://bit.ly/f8pZLY,0,0,zh,,,,,,,,
10050653460107264,2010-12-01 19:20:37,怎样做一个流氓绅士: 给GQ的专栏——早年间读《看得见风景的房间》，开头是露西小姐来到了佛罗伦萨，她的房间看不到阿诺河，在餐厅吃饭时，她和夏洛特小姐抱怨，老乔治这时候走上前来，说要把自己的房间让给露西小姐，夏洛特[阅读全文]© 途加.  http://bit.ly/eJM6CX,0,0,zh,,,,,,,,
10050652570914816,2010-12-01 19:20:36,"日本文化再发现, 中国为何与日本交恶 拥抱战败: 对中国而言，日本是一个貌似熟悉的邻居，关于日本的话题占据了中国人涉外言论的相当部分，而另一方面，民间对日本的真实的了解可能并不全面与深入。对这个熟悉的陌生人，我们最好的态度是... http://bit.ly/eK6g9K",0,0,zh,,,,,,,,
10050650469568512,2010-12-01 19:20:36,中国人身体素质亚洲第几: 王锦思 评论作者广州亚运会徐徐落幕，中国金牌第一，但是中国人均寿命在亚洲排名如何？笔者王锦思没有详细统计资料，但是手头大略的数字可见一斑。中国大陆的平均寿命是71岁，其中男性69岁，女性73岁[阅读... http://bit.ly/gRswRf,0,0,zh,,,,,,,,
9687397432295424,2010-11-30 19:17:10,高管谈职场，做一个内心强大的人: 1、无论做什么，记得是为自己而做，那就毫无怨言。2、面对困境，也不要悲观厌世。3、人生没有绝对的公平，但是相对公平的。在一个天平秤上，你得到的越多，也必须比别人承受得更多。4、在人生的任何[... http://bit.ly/h0EXDT,0,0,zh,,,,,,,,
9687394773114880,2010-11-30 19:17:09,办公室里的十大生存法则: 之一：男女搭档干活不累。在办公室里找到个合拍的搭档这很重要，即便是再能干的人，也不可能独自在办公室里游刃有余。还是别把自己总当成是“水”，运用智慧做一条处处都是碧波海洋的快乐之“鱼”，有时候会比“水... http://bit.ly/euCOJf,0,0,zh,,,,,,,,
9687393527398400,2010-11-30 19:17:09,成大事的九种手段、能力和心态！: 成大事的九种手段1、敢于决断－－克服犹豫不定的习性很多人之所以一事无成，最大的毛病就是缺乏敢于决断的手段，总是左顾右盼、思前想后，从而错失成功的最佳时机。成大事者在看到事情的成功可能性到来时... http://bit.ly/hntRPX,0,0,zh,,,,,,,,
