id,created_at,text,favorites,retweets,lang,in_reply_to_user,in_reply_to_user_id,in_reply_to_status_id,country,country_code,place_name,place_type,coordinates
668688970251915264,2015-11-23 07:14:08,NAB Labs hears from new Broadcast related startups at 1776’s Challenge @nablabs https://t.co/x0gUdxO1Hg @peggymiles,0,0,en,,,,,,,,
668302811441025024,2015-11-22 05:39:41,RT @Broadcast_Buzz: Thomas Silliman 1st recipient of Jules Cohen Award for Broadcast Engineering @IEEEBTSociety https://t.co/LP2t97rLzO htt…,0,2,en,,,,,,,,
662036541334777856,2015-11-04 22:39:46,NewsON App for Live Local TV News Goes Live | Broadcasting &amp; Cable: https://t.co/K1UqOFoTz4,0,0,en,,,,,,,,
661232846800084992,2015-11-02 17:26:10,BBG CEO Lansing says more emphasis on growing mobile dialogue a focus at @pdcouncil @bbgov  @peggymiles https://t.co/MWvnWD6klq,0,0,en,,,,,,,,
660819093465923585,2015-11-01 14:02:03,Rolling Stones on 50th Anniversary of Master FM on Empire State Building!! @empirestatebldg #AES  https://t.co/oCfolFK8ZH,0,0,en,,,,,,,,
654114790751604736,2015-10-14 02:01:33,I'm going to New York for #AESorg! http://t.co/XZ9IJqC6xC via @AESorg,1,0,en,,,,,,,,
648983583558778880,2015-09-29 22:11:58,This wearable wrist sensor translates sign language into English: http://t.co/qNTYT5EAsY by @mistercharlie via @FastCoExist,1,0,en,,,,,,,,
646882683209957376,2015-09-24 03:03:44,"How MIT Media Lab pictured the future of technology and marketing for ""Minority Report"" http://t.co/Te1nrtjcQv via @FastCoCreate",2,0,en,,,,,,,,
645054026992717825,2015-09-19 01:57:19,Makes you wonder who did and what show! ;-) https://t.co/i1dp2UZgFp,0,0,en,,,,,,,,
645052007288602629,2015-09-19 01:49:17,"deja vu 'tv guide' one location... google search/video, nope. not yet. https://t.co/V4clPjDo3x",0,0,en,,,,,,,,
645049646532947968,2015-09-19 01:39:54,"Really...speed dating for content (as in Television content pitch. gotta love it!

http://t.co/mhZINU48X1",0,0,en,,,,,,,,
644566959535857664,2015-09-17 17:41:53,Newseum to celebrate Freedom Week attend events Sept. 21-26  https://t.co/vGO0AaAEH8 via @sharethis @newseum @peggymiles,0,0,en,,,,,,,,
644564590316158976,2015-09-17 17:32:28,Newseum to celebrate Freedom Week Sept. 21-26 https://t.co/hPluCkjB4f via @sharethis,0,0,en,,,,,,,,
644342563974049792,2015-09-17 02:50:13,Wired Story How to Get Internet to the Next 4 Billion People http://t.co/cL838VPRp9 via @WIRED,0,0,en,,,,,,,,
644336010936061952,2015-09-17 02:24:10,We’re on the Brink of a Revolution in Crazy-Smart Digital Assistants http://t.co/It6LMJoGpp via @WIRED,1,0,en,,,,,,,,
644251969964535808,2015-09-16 20:50:13,"Likely slow down illegal content removal, increase legal fees, but worth consideration to preserve fair use. TBC https://t.co/79dNvrAyNI",0,0,en,,,,,,,,
644249516523196416,2015-09-16 20:40:28,This is getting interesting...@peggymiles https://t.co/K7X9lyonoZ,0,0,en,,,,,,,,
644248989336891392,2015-09-16 20:38:23,@peggymiles Radio Station to sell transmitter frequency for streamng http://t.co/BtuER4kKtP,0,0,en,vox,1351341,644248610511523840,,,,,
644248610511523840,2015-09-16 20:36:52,Radio Station to sell transmitter/frequency for streaming http://t.co/BtuER4kKtP,0,0,en,,,,,,,,
612337861409554432,2015-06-20 19:14:57,How will they verify content? YouTube Will Offer A Channel Of Breaking Eyewitness News Videos http://t.co/CzxwRJO61Z via @PopSci,0,0,en,,,,,,,,
612336909105414145,2015-06-20 19:11:10,YouTube Will Offer A Channel Of Breaking Eyewitness News Videos http://t.co/OOqgrxO7CF via @PopSci,0,0,en,,,,,,,,
612336056072077313,2015-06-20 19:07:47,These Are What the Google Artificial Intelligence’s Dreams Look Like http://t.co/G86QWImAW5 via @PopSci,0,0,en,,,,,,,,
611387111510413314,2015-06-18 04:17:01,Apple TV dominates the TV Everywhere market http://t.co/c1JIs8bX4y,0,1,en,,,,,,,,
609553826828394496,2015-06-13 02:52:11,LG Shows Off 'Wallpaper' TV No Thicker Than a Sticker http://t.co/Qa8yLfU0e4 via @nbcnews,0,0,en,,,,,,,,
606843483601694720,2015-06-05 15:22:15,"RT @NABCTO: Lifeline phones should be enhanced to ensure public safety, USC Annenberg urges FCC | USC News https://t.co/f9U8L3VfjA",0,1,en,,,,,,,,
606205678613495808,2015-06-03 21:07:51,"Personalized News Podcast Radio raises 3.6 million, what do you think? @peggymiles http://t.co/VlpVaX1YKK via @VentureBeat",0,0,en,,,,,,,,
600484007214751744,2015-05-19 02:11:58,CNN's user generated content site appears to have been used for other purposes...not good. http://t.co/l7aaRvCidK @peggymiles,1,0,en,,,,,,,,
599602033122013184,2015-05-16 15:47:19,Prime Members Can Stream Free Movies on JetBlue http://t.co/p3kaJkSEbj via @dealnews,1,2,en,,,,,,,,
597089306470195200,2015-05-09 17:22:38,"RT @Pontifex: Let us learn to live with kindness, to love everyone, even when they do not love us.",0,19582,en,,,,,,,,
590586776814759936,2015-04-21 18:43:54,RT @NAB_Labs: @skippizzi explains why #ATSC3 is worth moving forward w/at the ATSC 3.0 Tutorial Workshop in S219 #BEC http://t.co/3S9iIcN3Yh,0,4,en,,,,,,,,
590230153441239040,2015-04-20 19:06:49,RT @peggymiles: State of the Net wireless on cord cutting @KatyontheHill #sotnw  @vox @sotn Katy Bachman moderating http://t.co/7b4U3wJhcD,0,2,en,,,,,,,,
590217879833968640,2015-04-20 18:18:02,RT @KatyontheHill: Moffett now seems to be putting odds at 50% approval for #ComcastTWC - that's down from 70% and 60% a couple of weeks ag…,0,1,en,,,,,,,,
583369853932797952,2015-04-01 20:46:26,"Excellent Event in DC, High Level Speakers Apr 20 ""State of the Net Wireless"" http://t.co/y9K1YSHysF @tlordan @netcaucusac @vox @peggymiles",3,0,en,,,,,,,,
580456385961467905,2015-03-24 19:49:21,RT @BoulderPreston: Great new site for news and information on Telecom POLICY/LEGIS - http://t.co/tHewrVClbi,0,1,en,,,,,,,,
578675965414547456,2015-03-19 21:54:36,"RT @KatyontheHill: .@TomWheelerFCC: on FM chips in mobile phones: ""They are a great idea… but I think this is being resolved in the marketp…",0,3,en,,,,,,,,
570688596300189696,2015-02-25 20:55:38,Telegram 1939 World' Fair when TV demonstrated. I hope you smile as much as I did when you read it. Have a great day! http://t.co/VnlXT2JLy4,1,1,en,,,,,,,,
568174086561509376,2015-02-18 22:23:53,46% streaming users share passwords says Consumer Reports. Wonder what is the sharing for magazines/newspapers? http://t.co/ou3LjaI1Q0,1,1,en,,,,United States,US,"Alexandria, VA",city,
566611468104531968,2015-02-14 14:54:35,Target Ends streaming VOD Service. Who knew about this service? http://t.co/Vb5MT7XzBQ via @dealnews,0,0,en,,,,,,,,
564634933826965505,2015-02-09 04:00:33,FCC and Net neutrality: What you really need to know http://t.co/OhHh1IF4jR via @CNET @vox @peggymiles,1,0,en,,,,,,,,
563008126899986432,2015-02-04 16:16:12,RT @Newseum: Tonight: moms @DebraTice &amp; Diane Foley (@dmfaprn) talk #pressfreedom. Watch live: http://t.co/dgvUQmyKww #FreeAustinTice #Reme…,0,28,en,,,,,,,,
560946842469691395,2015-01-29 23:45:23,RT @JRosenworcel: Let's stop dreaming small &amp; instead dream big. Good that @FCC raising #broadband threshold to 25 Mbps--but we should aim …,0,39,en,,,,,,,,
560085513911427072,2015-01-27 14:42:47,Edith Ramirez Chair FTC w/ A. Bedoya of GW @SOTN #SOTN15 http://t.co/OzinjrI9fj @newseum Washington DC @peggymiles http://t.co/2fPvq2ByDL,0,0,en,,,,United States,US,"Washington, DC",city,
559819006866370561,2015-01-26 21:03:46,@alvarombedoya @peggymiles @vox tomorrow  #SOTN15 State of Net@Newseum DC Great speakers livestream http://t.co/OzinjrI9fj,0,0,en,alvarombedoya,2657787980,559793024105197568,,,,,
559817695873761280,2015-01-26 20:58:34,"RT @alvarombedoya: Students, media and government employees -- you can livestream the event free: http://t.co/mMvNGiSovG. #SOTN15",0,8,en,,,,,,,,
559817586918305792,2015-01-26 20:58:08,RT @SOTN: The first US #Bitcoin exchange launched today. Watch our #SOTN15 virtual currency panel &amp; @FEhrsam keynote tomorrow. http://t.co/…,0,2,en,,,,,,,,
542158666913169408,2014-12-09 03:27:53,YouTube shows video creators what copyright restrictions their audio will face http://t.co/GoEItEdrxz,2,1,en,,,,,,,,
537091675693125632,2014-11-25 03:53:28,SurfaceLink: Using Inertial and Acoustic Sensing to Enable Multi-Device ...: http://t.co/iOoURMzbTE via @YouTube,0,0,en,,,,,,,,
537059303929049089,2014-11-25 01:44:50,TVTechnology: Thousand TV Antennas Given Away in Washington D.C. http://t.co/xypRN6UIB4,0,0,en,,,,,,,,
536327800190300160,2014-11-23 01:18:06,How technology is changing the way we plan and experience events http://t.co/meAS3JMXM0 via @mashable,1,1,en,,,,,,,,
535976575117053952,2014-11-22 02:02:28,"RT @PatrickSeaman: CMA study finds streaming drives, not hurts, new music sales http://t.co/xiMqYgqUnP",0,1,en,,,,,,,,
535976167350996992,2014-11-22 02:00:50,ITU (Intl. Telecommunication Union) reports &gt; 60% world’s population still don’t have internet access. Worth Remembering @peggymiles,0,0,en,,,,,,,,
533038441014247424,2014-11-13 23:27:22,@vickykaseorg @Peggy Miles here - if you can record tonight's event on a smartphone or PC.  I have an idea sent email to Tony just now.,0,0,en,vickykaseorg,237453140,,,,,,
533021221425000448,2014-11-13 22:18:56,"Comcast w/ 1st voice-enabled TV interface - female voice to greet X1 visitors in weeks @comcast @peggymiles
http://t.co/NAd0H4S2PC",1,2,en,,,,,,,,
530043980546068480,2014-11-05 17:08:27,#pressfreedom21 reminder from Ray Suarez journalists still in jail. #Freeajstaff @peggymiles http://t.co/E7amuxus7S,0,0,en,,,,,,,,
527207237442228225,2014-10-28 21:16:15,Midterm Elections 2014: No TV Cable? Candidates Struggle To Court The Cord-Cutter Vote http://t.co/kYbVyu6Bdg,2,1,en,,,,,,,,
527102831484874752,2014-10-28 14:21:22,TVTechnology: EAS Community Buzzing Over False National Alert http://t.co/Ye5j92wTuN,0,0,en,,,,,,,,
526774404496519168,2014-10-27 16:36:19,The biggest Internet broadcast network? Facebook May Overtake YouTube Video Viewing - Forbes Article http://t.co/m5mfvWlWHd,3,4,en,,,,,,,,
524699190064975872,2014-10-21 23:10:10,RT @Nielsen: Adobe and Nielsen To Create Industry’s First Comprehensive Measurement Platform for Digital Content. http://t.co/G2XWkixpZH,0,42,en,,,,,,,,
523915975347806208,2014-10-19 19:17:57,Meet RIMP (Robot In My Pocket)—A Wearable Robot Controlled By Google Glass http://t.co/KH6ElWmX5R #wnt2014 via @gomodev,1,0,en,,,,,,,,
522813050957479936,2014-10-16 18:15:19,"Delayed Notice for me on Fyusion startup for anyone to make use 3-D photos, but think about what it could do http://t.co/OIhpSIxyzO via @WSJ",0,0,en,,,,,,,,
521697107418554368,2014-10-13 16:20:57,RT @AjitPaiFCC: .@UCBerkeley researchers develop tech that changes images pixel by pixel to adjust for viewer’s specific impairment. http:/…,0,7,en,,,,,,,,
521696350912532480,2014-10-13 16:17:57,UC Berkeley researchers develop technology to correct screens for visual impairments | The Daily Californian http://t.co/gURE0DeQ7Q,0,0,en,,,,,,,,
517433045285347328,2014-10-01 21:57:06,FCC on Broadcast Valuation for Auction Book - Here's PDF Link http://t.co/PhzwGhcu9X,0,0,en,,,,,,,,
508798811464949760,2014-09-08 02:07:44,Heart and Breathing Rates Tracked with Google Glass | MIT Technology Review http://t.co/nmNklVvCKj,1,0,en,,,,,,,,
508798198769385472,2014-09-08 02:05:18,"Real-time emotion detection with Google Glass: An awesome, creepy taste of the future of wearable computers via @extremetech",0,0,en,,,,,,,,
507629013267800064,2014-09-04 20:39:22,"Google's project to 'cure death,' Calico, announces $1.5 billion research center http://t.co/3Gl4BsHp1j via @verge",0,0,en,,,,,,,,
507164697338990593,2014-09-03 13:54:21,Scan barcode for political leanings.http://t.co/zSrSz2aVUT via @cbsnews,0,0,en,,,,,,,,
507161463602302976,2014-09-03 13:41:30,@WSJ Pushing for Accessibility based on needs and preferences. How about a transcript of all videos for increased distribution!,0,0,en,WSJ,3108351,507156019089522690,,,,,
507159819837788161,2014-09-03 13:34:58,"RT @AjitPaiFCC: Graphic design, GPS/cellular tracking of fishermen, mobile app for menus, more--heard lots of good ideas @ViveLabs. http://…",0,4,en,,,,,,,,
506095470046117888,2014-08-31 15:05:37,@PatrickSeaman I bet there is a smart tv ot tv manufacturer ready to take you to task on your definition of  device. (smiles),0,0,en,PatrickSeaman,21422154,504047159897907200,,,,,
506094494815907841,2014-08-31 15:01:45,"RT @PatrickSeaman: DOT Proposes Mandating Cars Broadcast Location, Direction and Speed http://t.co/g3rLgvTTgT",0,1,en,,,,,,,,
504670141305847808,2014-08-27 16:41:52,RT @lizziej: NHK to begin broadcasting in 8k by 2020.,0,1,en,,,,,,,,
504647879248867328,2014-08-27 15:13:24,Digital Divide of Devices In the Classroom?  What should be done? New pdf Report from @siia http://t.co/7jFAY86ceF,0,1,en,,,,,,,,
503756890527252481,2014-08-25 04:12:56,A Decade of Change for TV From Broadstream (this time with the infographic attached) http://t.co/04ITCKzM7Z,1,1,en,,,,,,,,
503756489073651714,2014-08-25 04:11:21,A Decade of Change for TV from Broadstream,0,0,en,,,,,,,,
503187212968550400,2014-08-23 14:29:14,Microsoft and TracFone collaborate to offer innovative mobile health management solution to the healthcare market http://t.co/QwNFPXKwv7,0,0,en,,,,,,,,
503179290683265024,2014-08-23 13:57:46,"Rabbit Lets You Watch Videos With Friends, No Matter Where They Are http://t.co/fns6ysbROC",0,0,en,,,,,,,,
502940720731144192,2014-08-22 22:09:46,"Despite what you've heard, newspapers are still going strong: Caroline Little via @pennlive",0,0,en,,,,,,,,
502896843273945088,2014-08-22 19:15:25,Majority Of Digital Media Consumption Now Takes Place In Mobile Apps http://t.co/LqtF5IDdSm via @techcrunch,0,0,en,,,,,,,,
502896359674871809,2014-08-22 19:13:30,RT @PBSMediaShift: A federal court rejects Aereo’s request to argue it’s a cable company (@b_fung via @WashingtonPost) http://t.co/kXBHpIms…,0,4,en,,,,,,,,
496723865188319232,2014-08-05 18:26:12,Journalism's Theory of Change: From Community Engagement to Civic Action  - What do you think?  http://t.co/H0KdVkSa0j via @GRDodgeMedia,0,0,en,,,,,,,,
496708145167605761,2014-08-05 17:23:44,Nielsen data shows mobile devices &amp; social networks are making TV better http://t.co/gTAuhvPEe0 via @VentureBeat,0,0,en,,,,,,,,
496675148263854081,2014-08-05 15:12:37,@LetitiaKing posted link re @USC_CCLP Media Broadcasting w BBG and VOA and NY Times to @vox and @peggymiles w your story.  addl photo soon,0,0,en,LetitiaKing,250309859,,,,,,
496674120231550976,2014-08-05 15:08:32,Africa Intl Media Impt Ebola work http://t.co/qOMkeJ4k79 @USC_CCLP EP Adam Powell III wNYTimes BBG VOA @letiticiaking,0,0,en,,,,,,,,
494973487589511168,2014-07-31 22:30:50,Can Social Media Change the Face of Diplomacy? via @BloombergTV http://t.co/up02vfMMUl,0,0,en,,,,,,,,
494946187200327681,2014-07-31 20:42:21,http://t.co/M2JP5tJAcH browser streaming:  a death foretold http://t.co/DvVUti1Itl,0,0,en,,,,,,,,
492782822302576640,2014-07-25 21:25:54,Women Techmakers: Make your passion.: http://t.co/AXlxirpzIn via @YouTube,0,0,en,,,,,,,,
487610050681122818,2014-07-11 14:51:10,"Aereo: Oh wait, we’re a cable system after all - Aereo 2nd take, still possible? http://t.co/CXqZlLGIjJ via @amy_schatz @peggymiles",0,0,en,,,,,,,,
483685657223520256,2014-06-30 18:57:01,#WorldCup on Twitter https://t.co/mHr3EE8EGY via @twitter,0,0,en,,,,,,,,
473498284288647169,2014-06-02 16:16:02,RT @LetitiaKing: Russians are dehumanizing Ukrainians As part of larger strategy hat leads to conflict. Discussion @PDCouncil @vox,0,1,en,,,,,,,,
473498112955514881,2014-06-02 16:15:21,"RT @LetitiaKing: At @PDCouncil RFE/RL's Nenad Pejic describes that once Russia starts to lie, the lies just get bigger. http://t.co/YlQs4cO…",0,1,en,,,,,,,,
471025676829483008,2014-05-26 20:30:47,Freedom of speech for me — but not for those I oppose  by Gene Polinski. http://t.co/UxFhXArmC9 via @newseum @peggymiles,0,1,en,,,,,,,,
470401513806786560,2014-05-25 03:10:35,The Emerging Global Web by @yiibu #africa #alibaba http://t.co/5m4MjcfrDi via @SlideShare,0,1,en,,,,,,,,
469859601542680576,2014-05-23 15:17:13,Google Sides With Netflix Against Comcast's Paid Peering http://t.co/U3a9lErdJw via @mashable,0,0,en,,,,,,,,
469490794026766336,2014-05-22 14:51:42,@peggymiles @newamerica Live Video Looks good. #globalflows,0,0,en,vox,1351341,469490305096744960,,,,,
469490305096744960,2014-05-22 14:49:46,Got the Live Video Now...http://t.co/kdXz7ecBFg  @peggymiles,0,0,en,,,,,,,,
469483714586902528,2014-05-22 14:23:34,@newamerica Can't see the live webcast at....http://t.co/kdXz7ecBFg @peggymiles,0,0,en,NewAmerica,7091082,,,,,,
469481556651024384,2014-05-22 14:15:00,@vox @peggymiles,0,0,und,vox,1351341,469481448043741185,,,,,
469481448043741185,2014-05-22 14:14:34,"Will they learn? If you don't start a live webcast on time, put up a slate/stand by screen rather than black or lose viewers! @peggmiles",0,0,en,,,,,,,,
469473926155096064,2014-05-22 13:44:41,"Live streaming presentation of OMMA Video at Internet Week here, #MPOMMA http://t.co/fiMaRql5t6 @peggymiles",0,0,en,,,,,,,,
469472282151112704,2014-05-22 13:38:09,@peggymiles @newamerica #globalflows @vox,0,0,und,vox,1351341,469471742667550721,,,,,
469471742667550721,2014-05-22 13:36:00,"10 am webcast http://t.co/kdXz7ecBFg includes Eric Schmidt Chairman, Google @ericschmidt",0,0,en,,,,,,,,
469470244877377536,2014-05-22 13:30:03,RT @NewAmerica: How can we ensure that the rising tide from #globalflows lift all boats?  lihttp:/ http://t.co/NuWk5vhxCW http://t.co/NFB6P…,0,3,en,,,,,,,,
469186383639101440,2014-05-21 18:42:05,Globalization Goes Digital http://t.co/gF9hgLL1YP via @newamerica,0,0,en,,,,,,,,
465123344388718592,2014-05-10 13:37:01,TVTechnology: Content Conundrum http://t.co/1g87SxdIGo via @sharethis,0,0,sk,,,,,,,,
459483799181856768,2014-04-25 00:07:29,"RT @Newseum: Oh yes! Pardon us. We're marking it early. MT @GwenLister1 @FreedomHouseDC Nope, it's May 3. MT @Newseum: World Press Freedom …",0,1,en,,,,,,,,
459483599310712832,2014-04-25 00:06:41,"RT @TheEconomist: Trending: For the first time in history, the US college-educated middle-class are working longer hours than the poor http…",0,579,en,,,,,,,,
458451798962212865,2014-04-22 03:46:41,"RT @cnni: Great food, safe streets, crazy parties -- 10 things Hong Kong does better than anywhere else http://t.co/Lr7L0XT5NQ http://t.co/…",0,240,en,,,,,,,,
458449697951072256,2014-04-22 03:38:20,High court’s decision on Aereo could reshape TV industry http://t.co/T3paJsoG9r via @washingtonpost Should get very interesting...,0,0,en,,,,,,,,
458313633135861762,2014-04-21 18:37:39,http://t.co/xr8aOGT9uO  Way to Go Kay Koplovitz..on CNBC video to 3rd world...,0,0,en,,,,,,,,
456801548454993920,2014-04-17 14:29:10,@vox,2,2,und,vox,1351341,,,,,,
456163495403192320,2014-04-15 20:13:47,"#Twitterversary  Wow 7 years on twitter. Back then, you had to explain what this was and lots of folks saying ""not interested"". And NOW!!!",0,0,en,,,,,,,,
453578925445095424,2014-04-08 17:03:37,@EmpireStateBldg Great to see Shane O'Donoghue Empire State Building Broadcasting panel with NBC CBS ABC @nabshow #nabshow,0,0,en,EmpireStateBldg,123289066,,,,,,
450710970931744768,2014-03-31 19:07:23,Wheeler: L.A. Test Makes Compelling Case For Channel Sharing | Broadcasting &amp; Cable: http://t.co/pjYwB3SMsy,0,0,en,,,,,,,,
450493388010184704,2014-03-31 04:42:48,European Union Approves Universal Cell Phone Charger Law Cutting Tons of EWaste  http://t.co/WLACeek4GI via @Inhabitat,0,2,en,,,,,,,,
449643936533864449,2014-03-28 20:27:23,The FCC Pulls the Plug on Broadcasters http://t.co/NDWJi4zJVd @peggymiles,0,0,en,,,,,,,,
449642135663308800,2014-03-28 20:20:13,U.S. TV stations' test finds channel-sharing technically viable http://t.co/V9cCjHxCwJ via @reuters,0,0,en,,,,,,,,
449641889684140033,2014-03-28 20:19:15,CBS May Create Its Own Internet-TV Service to Challenge Aereo http://t.co/REriIwfuHh via @BloombergNews,0,1,en,,,,,,,,
449508614336548865,2014-03-28 11:29:39,RT @tltechforum: Don't forget to join us tomorrow on @Livestream from TF Atlanta. We'll broadcast three select sessions. http://t.co/Gcw48y…,0,5,en,,,,,,,,
444644069059207168,2014-03-15 01:19:41,"Congratulations Jon Klein! Jeff Gaspin, Jon Klein to Launch Online Video Platform TAPP http://t.co/xNVwdUdTGO via @THR",0,0,en,,,,,,,,
444565213157683200,2014-03-14 20:06:21,Floating sphere records and replays public space sounds. Think Floating Video displays next... http://t.co/TB38MbqXUU via @gizmag,0,0,en,,,,,,,,
444498553868910592,2014-03-14 15:41:28,RT @PaulMSparrow1: Live stream of National Freedom of Information Day program #foi http://t.co/4wLV7ApoVd,0,1,en,,,,,,,,
444498480565067776,2014-03-14 15:41:10,RT @CommLawBlog: FHH atty @kevinmgoldberg moderating panel on “FOIA Update from the Administration and Congress” at #Newseum on 3/14: http:…,0,1,en,,,,,,,,
444252721671979008,2014-03-13 23:24:37,"Knight, Ford, Mozilla Giving Out $2.75 Million to Strengthen the Internet | Idea Lab | PBS http://t.co/k0IGByVhON via @pbsmediashift",0,0,en,,,,,,,,
444230485393571840,2014-03-13 21:56:15,"RT @Web25: Happy birthday World Wide Web! http://t.co/ZDrUvVlAoL is now live; tune in for a video of @timberners_lee, greetings, events, et…",0,331,en,,,,,,,,
443935723717005313,2014-03-13 02:24:59,Crowdsourcing volunteers comb satellite photos for Malaysia Airlines jet  http://t.co/MtOD6lcTrf,0,0,en,,,,,,,,
443929410144464897,2014-03-13 01:59:53,Congrats!New York Public Radio Receives Grant for $10 Million most for mobile digital media. @wqxr @wqxrclassical http://t.co/6noSFpOlqx,1,0,en,,,,,,,,
443926076226416640,2014-03-13 01:46:38,"This is a free event on digital media and education in DC, also a webcast...Beyond Screen Time http://t.co/Dt94EE3rca via @newamerica",0,0,en,,,,,,,,
443899309033943041,2014-03-13 00:00:17,Love Google's We are the Web Infographic! @derekslater @peggymiles http://t.co/XsZYBrwTej,0,2,en,,,,,,,,
443897723138240514,2014-03-12 23:53:59,The web turns 25 today! I remember what it was like before the web... http://t.co/mUHgMD7h1O #Web25 http://t.co/kUkolIMoe9,0,0,en,,,,,,,,
443095853452902400,2014-03-10 18:47:38,Edward Snowden's Vdieo On-Demand SXSW 2014 appearance here (updated) includes the full text too http://t.co/p1Lxu6vDEd via @DigitalTrends,0,1,en,,,,,,,,
442480134994796546,2014-03-09 02:00:59,"RT @geoffreyfowler: In #ieee test, the touches hand gesture for ""pause"" video was pretty universal -- except for the Netherlands #SXSW http…",0,5,en,,,,,,,,
442480060277473280,2014-03-09 02:00:41,"RT @geoffreyfowler: Looking for universal controls, #ieeeGoto asked people in 18 countries to imagine gestures for these things #SXSW http:…",0,5,en,,,,,,,,
442469423157231616,2014-03-09 01:18:25,"Julian Assange Warns SXSW of ""Military Occupation of the Internet Space"" http://t.co/0mQDCodadE via @LizGannes",0,0,en,,,,,,,,
442115497165742081,2014-03-08 01:52:03,Facebook Drones Could Give Everyone Internet Access : Discovery News (Really?) http://t.co/QQCCpSwxpy,0,0,en,,,,,,,,
441975397794983937,2014-03-07 16:35:21,"SIMPLY Amazing. Live Video Satellite Merge with Size/Shape/Metrics agri, 3rd world help yes, privacy no. Amazing http://t.co/AOiP3h9h0w",0,1,en,,,,,,,,
441971719214223360,2014-03-07 16:20:43,"RT @sxsw: Join @voxmediainc and @umbel featuring @localnatives tonight for the #SXSW
kickoff party! #umbelvoxkickoff http://t.co/LPzpWG3prJ",0,35,en,,,,,,,,
441971598221139968,2014-03-07 16:20:15,Study for Journalism Outlets &amp; Native Advertising from (http://t.co/kHg63zkOC1) http://t.co/Nd1KFV3heG,1,0,en,,,,,,,,
441970049629581312,2014-03-07 16:14:05,"RT @googleresearch: Live HOA on Disruptive Innovation in CS Education at 10:45 PST, with Khan Academy, Google, &amp; http://t.co/4QVwmPrY3X. ht…",0,8,en,,,,,,,,
441816198607417344,2014-03-07 06:02:44,The PR News Twitter Directory Who's Who of Twitter Handles from PR News http://t.co/Mw0XoujrxL @prnews @peggymiles,0,0,en,,,,,,,,
441812263054639104,2014-03-07 05:47:06,Can the Future of News Be Found in the History of Podcasting from Forbes @peggymiles http://t.co/wou2BZWvco,0,0,en,,,,,,,,
441797061596676096,2014-03-07 04:46:42,@digitalpyramid Hi Ben...where do I need to go to look at the digital work of your students?,0,0,en,digitalpyramid,1209499772,,,,,,
441785150070747136,2014-03-07 03:59:22,Welcome - VOX: http://t.co/JcZx6hv1Lb,0,0,en,,,,,,,,
441600930459308032,2014-03-06 15:47:21,“They can’t kill us all”: Press freedom in Hong Kong? - http://t.co/vQO3HYD5Qz http://t.co/cV9Ft69bK5,0,0,en,,,,,,,,
440950511051624448,2014-03-04 20:42:48,"Amazon readies its potentially game-changing set-top box, aims for March release http://t.co/G2lQpZhctT via @DigitalTrends",0,0,en,,,,,,,,
440861746384076800,2014-03-04 14:50:05,RT @waltmossberg: Disney Opens the Door for Web TV -- As Long As It Looks Like Cable TV http://t.co/835TzdpNFA via @pkafka,0,11,en,,,,,,,,
440203261719498752,2014-03-02 19:13:30,Great 2 meet RockNRoll Hall of Fame Board @ OStMansion.Here's the John Lennon Contest @voxamps http://t.co/FGB0LZI8xl http://t.co/zoNx4cQ90J,0,1,en,,,,,,,,
439521859202084864,2014-02-28 22:05:51,19 billion reasons for opportunity in Ukraine http://t.co/GwiM1UTZnp   This is written by Alex Ross...,0,1,en,,,,,,,,
439518506791337984,2014-02-28 21:52:32,YES!!!! Exclusive: Digital Ad Views In Long-Form Video Up 86% | Broadcasting &amp; Cable: http://t.co/wwBmLu1JyL,0,0,en,,,,,,,,
439515960790114305,2014-02-28 21:42:25,@alialzobaidy Excellent Presentation Your Entire Team put together @bbggov,2,1,en,alialzobaidy,188937721,,,,,,
439435745594736641,2014-02-28 16:23:40,RT @BBGgov: .@BBGinnovate 's Relay offers journalists a sleek and easy way to collect and distribute content using their phones http://t.co…,0,3,en,,,,,,,,
